Year;Code;Description;Origin;A01;A02;A03;B;C10-C12;C13-C15;C16;C17;C18;C19;C20;C21;C22;C23;C24;C25;C26;C27;C28;C29;C30;C31_C32;C33;D35;E36;E37-E39;F;G45;G46;G47;H49;H50;H51;H52;H53;I;J58;J59_J60;J61;J62_J63;K64;K65;K66;L68;M69_M70;M71;M72;M73;M74_M75;N;O84;P85;Q;R_S;T;U;CONS_h;CONS_np;CONS_g;GFCF;INVEN;EXP;GO
2007;G47;Retail trade, except of motor vehicles and motorcycles;Domestic;67;4;0;16;371;12;21;20;14;14;52;36;28;28;14;46;74;41;72;3;8;21;20;108;33;0;226;57;1 071;358;1 280;30;484;370;29;474;35;0;200;40;390;135;0;60;700;0;93;0;32;162;235;164;217;115;0;0;19 270;17;197;399;0;3 272;31 236
2007;H49;Land transport and transport via pipelines;Domestic;20;1;0;65;492;50;104;122;31;62;227;55;110;144;88;129;144;118;255;6;18;36;40;224;47;0;181;74;9 054;281;1 169;28;442;89;57;52;77;0;19;29;125;172;0;32;173;0;82;0;13;1 273;133;93;74;57;0;0;4 546;0;26;252;0;7 409;28 600
2007;H50;Water transport;Domestic;0;0;0;2;12;1;3;3;1;2;6;1;3;4;2;3;4;3;6;0;0;1;1;5;1;0;4;2;222;7;29;1;11;2;1;1;2;0;0;1;3;4;0;1;4;0;2;0;0;31;3;2;2;1;0;0;111;0;1;6;0;185;703
2007;H51;Air transport;Domestic;6;0;0;19;144;14;30;36;9;18;66;16;32;42;26;38;42;34;74;2;5;11;11;64;14;0;53;22;2 646;82;340;8;129;25;17;15;23;0;5;8;36;50;0;9;50;0;24;0;4;372;39;27;22;16;0;0;1 310;0;7;73;0;2 351;8 516
2007;H52;Warehousing and support activities for transportation;Domestic;6;0;0;18;114;6;23;22;8;11;39;6;22;31;13;26;17;35;43;2;3;8;6;179;30;0;40;18;1 138;225;3 029;72;1 146;811;4;12;14;0;4;3;8;6;0;3;30;0;7;0;2;24;28;6;17;8;0;0;466;0;0;11;0;1 543;9 343
2007;H53;Postal and courier activities;Domestic;12;1;0;4;57;5;5;6;13;4;15;15;12;9;5;22;58;11;43;1;4;9;10;55;15;0;52;38;582;174;85;2;32;93;1 774;58;32;0;16;83;569;193;0;87;184;0;42;0;33;128;187;65;114;294;0;0;337;0;0;58;0;797;6 499
2007;I;Accommodation and food service activities;Domestic;4;0;0;1;38;1;2;1;1;1;4;5;2;2;1;6;17;1;13;0;1;3;4;12;4;0;23;7;144;31;77;2;29;11;3;39;4;0;6;6;50;47;0;9;69;0;18;0;4;363;29;18;23;17;0;0;13 424;10;13;25;0;4 305;18 933
2007;J58;Publishing activities;Domestic;3;0;0;2;81;7;4;7;428;4;14;25;4;3;2;6;83;5;18;1;6;14;8;30;12;0;37;73;621;187;36;1;14;20;26;33;1 211;0;90;71;452;160;0;61;209;0;126;0;1 244;262;432;176;71;76;0;0;1 139;0;157;15;0;764;8 531
2007;J59_J60;"Motion picture, video and television programme production, sound recording and music publishing activities; programming and broadcasting activities";Domestic;0;0;0;0;0;0;0;0;0;0;0;0;0;0;0;0;0;0;0;0;0;0;0;0;0;0;0;0;0;0;0;0;0;0;0;0;0;0;0;0;0;0;0;0;0;0;0;0;0;0;0;0;0;0;0;0;0;0;0;0;0;0;0
2007;J61;Telecommunications;Domestic;17;1;0;5;72;7;6;6;19;4;14;19;14;11;5;26;80;11;53;1;4;11;13;77;18;0;61;52;817;266;81;2;31;314;37;74;124;0;2 703;77;633;241;0;73;258;0;48;0;35;195;207;82;140;145;0;0;5 348;0;0;10;0;646;13 197
2007;J62_J63;"Computer programming, consultancy and related activities; information service activities";Domestic;1;0;0;2;63;5;2;12;5;3;9;9;13;11;6;19;93;19;24;1;10;11;4;137;18;0;12;67;438;102;21;1;8;39;44;24;30;0;53;3 269;512;608;0;37;365;0;92;0;25;178;100;26;102;101;0;0;50;0;0;5 448;0;4 918;17 144
2007;K64;Financial service activities, except insurance and pension funding;Domestic;165;9;0;30;532;41;69;67;56;71;258;143;108;90;75;216;561;150;399;22;46;103;94;552;133;0;610;244;2 847;891;524;12;198;304;241;493;111;0;178;382;7 156;1 213;0;1 842;1 007;0;424;0;155;581;1 209;495;551;509;0;0;3 897;0;0;382;0;31 537;61 985
2007;K65;Insurance, reinsurance and pension funding, except compulsory social security;Domestic;23;1;0;6;62;4;8;8;6;4;15;14;12;14;5;19;21;3;31;1;5;10;10;35;17;0;59;39;442;190;103;2;39;56;41;70;13;0;11;51;1 413;3 959;0;603;225;0;83;0;19;72;218;26;80;56;0;0;17 419;11;48;51;0;8 421;34 152
2007;K66;Activities auxiliary to financial services and insurance activities;Domestic;0;0;0;0;0;0;0;0;0;0;0;0;0;0;0;0;0;0;0;0;0;0;0;0;0;0;0;0;0;0;0;0;0;0;0;0;0;0;0;0;0;0;0;0;0;0;0;0;0;0;0;0;0;0;0;0;0;0;0;0;0;0;0
2007;L68;Real estate activities;Domestic;3;0;0;4;27;3;2;1;3;1;4;0;7;4;2;14;8;5;14;0;2;4;6;3;6;0;40;23;219;238;103;2;39;54;12;103;13;0;27;42;77;32;0;297;88;0;51;0;12;49;143;73;90;68;0;0;41 731;0;1;33;0;163;43 949
2007;M69_M70;"Legal and accounting activities; activities of head offices; management consultancy activities";Domestic;44;2;0;61;723;37;40;61;68;52;187;196;126;91;55;192;444;83;297;12;48;93;104;330;118;0;1 617;273;3 558;1 610;743;18;281;499;126;455;170;0;223;324;2 678;925;0;672;6 293;0;473;0;197;1 258;1 039;295;657;586;0;0;902;1;6;3 995;0;4 943;38 282
2007;M71;"Architectural and engineering activities; technical testing and analysis";Domestic;0;0;0;0;0;0;0;0;0;0;0;0;0;0;0;0;0;0;0;0;0;0;0;0;0;0;0;0;0;0;0;0;0;0;0;0;0;0;0;0;0;0;0;0;0;0;0;0;0;0;0;0;0;0;0;0;0;0;0;0;0;0;0
2007;M72;Scientific research and development;Domestic;0;0;0;0;1;0;0;0;0;0;1;196;0;0;0;0;0;0;0;0;0;0;0;0;0;0;0;0;1;0;1;0;0;0;0;0;0;0;0;0;0;0;0;0;0;0;130;0;1;0;2;0;13;0;0;0;58;0;0;10 185;0;1 271;11 864
2007;M73;Advertising and market research;Domestic;0;0;0;0;0;0;0;0;0;0;0;0;0;0;0;0;0;0;0;0;0;0;0;0;0;0;0;0;0;0;0;0;0;0;0;0;0;0;0;0;0;0;0;0;0;0;0;0;0;0;0;0;0;0;0;0;0;0;0;0;0;0;0
2007;M74_M75;"Other professional, scientific and technical activities; veterinary activities";Domestic;145;8;0;6;260;11;8;12;25;9;34;46;18;11;8;31;139;8;66;1;11;19;20;58;23;0;45;75;1 106;317;103;2;39;74;63;48;129;0;174;74;844;291;0;45;323;0;83;0;767;235;184;61;90;171;0;0;307;0;0;5;0;36;6 669
2007;N;Administrative and support service activities;Domestic;51;3;0;13;206;12;13;21;47;23;83;126;27;34;16;101;310;60;188;14;20;36;70;185;69;0;538;86;1 619;534;1 466;35;555;451;67;266;143;0;197;305;640;375;0;1 225;1 062;0;612;0;147;1 894;820;254;437;353;0;0;1 940;0;3;69;0;2 408;20 227
2007;O84;"Public administration and defence; compulsory social security";Domestic;42;2;0;6;198;7;16;33;35;9;32;31;34;18;35;27;84;13;48;3;9;14;15;340;220;0;167;40;480;203;217;5;82;85;17;110;124;0;37;89;247;217;0;514;422;0;116;0;107;295;1 337;105;169;186;0;0;5 610;551;25 901;1 362;23;1 182;41 271
2007;P85;Education;Domestic;14;1;0;10;83;4;9;12;5;7;25;31;8;11;11;24;60;16;78;0;7;13;25;179;47;0;88;66;416;243;170;4;64;360;15;25;16;0;15;71;396;412;0;13;351;0;512;0;26;111;569;1 084;360;69;0;0;3 223;19;17 625;10;0;502;27 517
2007;Q;Human health and social work activities;Domestic;4;0;0;1;24;1;3;1;1;1;2;2;2;1;2;14;8;5;14;0;1;2;1;5;5;0;19;5;39;16;10;0;4;7;3;10;3;0;4;3;23;13;0;10;40;0;9;0;3;11;98;20;370;10;0;0;33 443;4 604;2 638;42;0;1 192;42 746
2007;R_S;Other service activities;Domestic;5;0;0;11;155;15;16;11;18;6;23;38;18;20;8;34;52;4;77;2;8;25;22;19;27;0;159;47;868;361;50;1;19;41;14;302;299;0;36;125;279;115;0;46;522;0;50;0;56;203;276;88;246;833;0;0;6 038;2 098;1 470;24;42;1 337;16 658
2007;T;"Activities of households as employers; undifferentiated goods- and services-producing activities of households for own use";Domestic;0;0;0;0;0;0;0;0;0;0;0;0;0;0;0;0;0;0;0;0;0;0;0;0;0;0;0;0;0;0;0;0;0;0;0;0;0;0;0;0;0;0;0;0;0;0;0;0;0;0;0;0;0;0;0;0;1 526;0;0;0;0;4;1 530
2007;U;Activities of extraterritorial organizations and bodies;Domestic;0;0;0;0;0;0;0;0;0;0;0;0;0;0;0;0;0;0;0;0;0;0;0;0;0;0;0;0;0;0;0;0;0;0;0;0;0;0;0;0;0;0;0;0;0;0;0;0;0;0;0;0;0;0;0;0;0;0;0;0;0;0;0
2007;A01;Crop and animal production, hunting and related service activities;Imports;191;10;0;0;708;1;50;19;0;1;5;2;4;0;0;0;0;0;1;0;0;0;0;7;0;0;1;0;8;32;2;0;1;0;0;33;0;0;0;1;1;0;0;1;1;0;1;0;0;5;11;1;5;2;0;0;1 447;0;0;5;0;0;0
2007;A02;Forestry and logging;Imports;23;1;0;0;85;0;13;2;0;0;1;0;1;0;0;0;0;0;0;0;0;1;0;1;0;0;10;0;2;4;0;0;0;0;0;4;0;0;0;0;0;0;0;0;0;0;0;0;0;1;2;0;1;0;0;0;26;0;0;2;0;0;0
2007;A03;Fishing and aquaculture;Imports;2;0;0;0;6;0;0;0;0;0;0;0;0;0;0;0;0;0;0;0;0;0;0;0;0;0;0;0;0;0;0;0;0;0;0;1;0;0;0;0;0;0;0;0;0;0;0;0;0;0;0;0;0;0;0;0;8;0;0;0;0;0;0
2007;B;Mining and quarrying;Imports;4;0;0;41;10;0;1;10;0;368;1 335;7;3;76;92;5;4;6;4;0;0;3;0;1 113;6;0;62;0;7;7;8;0;3;4;0;1;0;0;0;1;1;1;0;5;5;0;5;0;0;5;31;4;4;3;0;0;16;0;0;13;0;0;0
2007;C10-C12;Manufacture of food products, beverages and tobacco products;Imports;81;4;0;1;379;8;2;4;1;15;53;106;12;3;3;3;14;7;5;0;0;2;1;4;1;0;11;1;16;27;98;2;37;4;1;254;1;0;1;2;6;3;0;2;5;0;12;0;1;4;29;18;68;6;0;0;5 177;0;0;25;0;0;0
2007;C13-C15;Manufacture of textiles, wearing apparel and leather products;Imports;48;3;0;1;37;1 074;1;32;6;2;9;25;156;66;8;40;126;30;78;21;17;139;1;2;4;0;108;83;160;154;91;2;35;33;4;64;9;0;0;1;116;54;0;20;63;0;59;0;18;74;124;29;255;86;0;0;4 387;0;0;23;2;0;0
2007;C16;"Manufacture of wood and of products of wood and cork, except furniture; manufacture of articles of straw and plaiting materials";Imports;13;1;0;3;17;2;464;13;3;2;6;4;17;8;3;16;34;16;20;1;2;75;1;29;1;0;628;1;62;27;3;0;1;2;0;1;0;0;0;1;1;1;0;2;4;0;2;0;2;5;17;2;8;14;0;0;103;0;0;21;1;0;0
2007;C17;Manufacture of paper and paper products;Imports;4;0;0;3;283;7;43;334;272;34;124;104;43;22;2;26;44;23;37;1;3;11;1;3;1;0;24;11;151;91;25;1;9;13;5;33;5;0;7;36;48;18;0;9;51;0;128;0;24;49;60;5;45;31;0;0;171;0;0;9;0;0;0
2007;C18;Printing and reproduction of recorded media;Imports;0;0;0;0;8;1;1;8;17;1;3;3;2;1;0;1;7;2;2;0;0;1;0;1;0;0;2;2;9;7;2;0;1;1;1;1;80;0;2;5;9;3;0;1;7;0;14;0;13;6;10;3;3;15;0;0;35;0;1;25;0;0;0
2007;C19;Manufacture of coke and refined petroleum products ;Imports;51;3;0;10;38;11;8;16;6;88;320;271;95;24;26;20;105;46;13;1;2;9;2;25;12;0;61;7;85;39;238;6;90;27;4;34;3;0;2;5;11;3;0;12;22;0;47;0;6;24;56;44;69;36;0;0;573;0;1;21;0;0;0
2007;C20;Manufacture of chemicals and chemical products ;Imports;324;17;1;63;234;71;50;100;34;555;2 016;1 454;603;150;153;108;661;281;67;6;11;50;10;146;74;0;382;46;505;237;1 494;35;565;167;25;216;10;0;8;32;53;17;0;75;109;0;287;0;26;143;343;278;418;227;0;0;1 224;0;0;126;0;0;0
2007;C21;Manufacture of basic pharmaceutical products and pharmaceutical preparations;Imports;39;2;0;7;64;8;6;11;4;61;222;11 957;67;16;17;12;75;31;9;1;1;7;1;16;8;0;42;5;63;28;166;4;63;19;3;25;1;0;1;4;7;4;0;9;15;0;355;0;31;17;168;32;784;26;0;0;1 875;0;1;86;1;0;0
2007;C22;Manufacture of rubber and plastic products;Imports;24;1;0;6;317;26;16;20;48;18;64;84;275;69;8;57;237;239;231;27;30;72;9;7;11;0;608;115;277;80;48;1;18;29;2;13;6;0;4;11;44;26;0;17;44;0;69;0;18;43;60;12;149;38;0;0;276;0;0;81;1;0;0
2007;C23;Manufacture of other non-metallic mineral products;Imports;5;0;0;5;39;4;16;1;0;6;21;45;44;264;9;38;90;84;25;3;13;13;3;17;7;0;1 126;12;17;5;11;0;4;4;0;2;0;0;0;1;1;2;0;34;6;0;16;0;3;12;39;1;10;2;0;0;86;0;0;24;1;0;0
2007;C24;Manufacture of basic metals;Imports;4;0;0;11;21;2;12;14;4;13;47;20;88;40;1 579;2 151;527;1 071;1 172;49;98;1 289;57;37;14;0;533;10;37;17;56;1;21;3;0;4;1;0;1;2;2;1;0;2;11;0;6;0;1;3;20;4;23;4;0;0;48;0;0;58;0;0;0
2007;C25;Manufacture of fabricated metal products, except machinery and equipment;Imports;25;1;0;2;92;5;19;2;2;3;12;17;39;18;90;886;223;365;876;28;67;103;34;10;3;0;570;139;216;25;34;1;13;12;1;29;3;0;3;3;22;11;0;14;25;0;71;0;2;9;46;23;36;20;0;0;164;0;0;315;1;0;0
2007;C26;Manufacture of computer, electronic and optical products;Imports;2;0;0;0;7;1;1;1;3;2;8;43;8;2;2;8;2 247;289;131;9;19;36;92;13;4;0;87;14;44;8;12;0;4;2;2;3;24;0;282;168;14;12;0;2;41;0;19;0;3;11;18;3;27;16;0;0;1 577;0;1;6 346;31;0;0
2007;C27;Manufacture of electrical equipment;Imports;4;0;0;0;6;1;1;1;1;1;3;16;4;2;6;19;533;1 329;411;11;32;31;161;143;1;0;664;69;18;3;14;0;5;1;0;1;2;0;33;15;3;5;0;2;28;0;4;0;2;3;17;7;14;32;0;0;133;0;0;2 215;1;0;0
2007;C28;Manufacture of machinery and equipment n.e.c.;Imports;6;0;0;11;40;5;7;6;13;3;11;41;30;17;22;41;70;192;2 997;166;63;26;98;12;3;0;326;204;157;7;18;0;7;6;1;2;1;0;4;10;4;3;0;2;93;0;10;0;2;8;12;2;9;5;0;0;177;0;0;6 371;2;0;0
2007;C29;Manufacture of motor vehicles, trailers and semi-trailers;Imports;1;0;0;1;7;3;1;1;1;1;5;8;6;3;4;11;26;42;220;137;19;9;9;5;1;0;41;250;20;6;30;1;11;15;0;1;0;0;2;5;3;2;0;1;9;0;6;0;1;6;6;1;7;9;0;0;3 661;0;0;5 148;1;0;0
2007;C30;Manufacture of other transport equipment;Imports;0;0;0;0;1;1;0;0;0;0;0;1;1;0;1;3;10;5;10;1;437;3;103;1;0;0;4;1;3;1;147;3;55;1;0;0;0;0;1;3;1;1;0;0;9;0;1;0;0;1;1;0;2;1;0;0;1 056;0;0;2 241;4;0;0
2007;C31_C32;"Manufacture of furniture; other manufacturing";Imports;4;0;0;0;8;9;7;1;2;3;10;62;6;6;3;17;233;66;15;1;3;305;2;2;3;0;20;3;31;15;7;0;3;2;0;5;4;0;2;2;10;5;0;13;23;0;13;0;39;26;82;22;352;22;0;0;3 445;0;0;2 038;89;0;0
2007;C33;Repair and installation of machinery and equipment;Imports;1;0;0;0;1;0;0;0;0;0;1;4;1;0;1;3;9;7;23;1;12;1;5;2;0;0;6;2;4;1;6;0;2;0;0;0;0;0;1;2;1;1;0;0;2;0;1;0;0;1;1;0;1;1;0;0;61;0;0;123;0;0;0
2007;D35;Electricity, gas, steam and air conditioning supply;Imports;12;1;0;8;39;3;7;30;3;9;34;20;23;17;32;11;24;15;13;1;1;4;2;1 475;127;0;16;5;56;29;49;1;19;13;3;29;3;0;9;6;19;21;0;210;29;0;17;0;3;11;106;55;59;38;0;0;317;0;1;71;0;0;0
2007;E36;Water collection, treatment and supply;Imports;1;0;0;0;3;0;2;12;0;0;1;1;14;2;17;1;3;2;2;0;0;1;0;46;123;0;3;1;19;5;3;0;1;5;1;7;0;0;1;1;6;17;0;189;4;0;2;0;1;3;40;3;8;4;0;0;3;0;0;2;0;0;0
2007;E37-E39;"Sewerage; waste collection, treatment and disposal activities; materials recovery; remediation activities and other waste management services ";Imports;1;0;0;0;2;0;0;1;0;1;4;2;2;1;3;4;3;3;3;0;0;2;0;5;4;0;3;0;5;1;3;0;1;1;0;1;0;0;0;0;1;1;0;6;2;0;1;0;0;1;2;1;1;1;0;0;9;0;0;7;0;0;0
2007;F;Construction;Imports;0;0;0;0;2;0;2;0;0;1;4;3;1;3;1;5;5;8;25;1;1;1;1;5;0;0;22;3;11;2;3;0;1;1;0;1;0;0;0;2;2;1;0;1;6;0;1;0;0;3;2;1;2;1;0;0;34;0;0;68;0;0;0
2007;G45;Wholesale and retail trade and repair of motor vehicles and motorcycles;Imports;2;0;0;0;7;2;2;1;1;1;5;37;3;2;1;3;8;5;7;1;1;2;1;2;1;0;10;6;10;3;9;0;4;3;0;2;0;0;1;3;2;1;0;1;4;0;3;0;1;2;3;1;6;2;0;0;77;0;1;46;0;0;0
2007;G46;Wholesale trade, except of motor vehicles and motorcycles;Imports;40;2;0;8;127;54;39;23;16;58;210;1 167;56;40;34;79;201;144;194;12;13;43;21;107;8;0;245;33;154;46;116;3;44;21;3;48;9;0;19;44;30;17;0;15;45;0;68;0;14;31;63;22;136;29;0;0;1 087;0;4;832;6;0;0
2007;G47;Retail trade, except of motor vehicles and motorcycles;Imports;10;1;0;1;32;13;6;5;3;7;25;178;12;7;4;11;38;19;25;2;4;10;3;6;2;0;41;6;41;14;29;1;11;5;1;20;2;0;9;10;12;6;0;4;14;0;13;0;3;12;16;9;30;8;0;0;494;0;7;145;2;0;0
2007;H49;Land transport and transport via pipelines;Imports;7;0;0;17;117;14;25;28;8;39;143;88;28;38;26;33;44;33;64;2;4;11;8;108;10;0;56;16;1 928;61;248;6;94;18;12;13;17;0;4;8;25;37;0;5;36;0;21;0;3;271;32;21;23;13;0;0;1 741;0;10;67;1;0;0
2007;H50;Water transport;Imports;0;0;0;0;3;0;1;1;0;1;2;3;1;1;1;1;1;1;2;0;0;0;0;1;0;0;2;1;56;2;10;0;4;1;0;0;1;0;0;0;1;1;0;0;1;0;1;0;0;8;1;1;1;0;0;0;53;0;0;4;0;0;0
2007;H51;Air transport;Imports;1;0;0;5;35;4;7;9;2;4;16;4;8;10;6;9;10;8;18;0;1;3;2;12;3;0;12;5;642;19;75;2;28;4;4;3;5;0;1;4;9;12;0;1;12;0;6;0;1;90;9;6;5;4;0;0;540;0;3;14;0;0;0
2007;H52;Warehousing and support activities for transportation;Imports;2;0;0;4;29;2;6;6;2;3;11;12;6;8;4;8;6;9;13;1;2;2;2;40;7;0;13;5;310;51;663;16;251;176;2;3;4;0;2;4;4;4;0;1;10;0;3;0;1;15;8;2;5;3;0;0;115;0;0;19;0;0;0
2007;H53;Postal and courier activities;Imports;0;0;0;0;1;0;0;0;0;0;0;0;0;0;0;0;1;0;1;0;0;0;0;1;0;0;1;0;10;2;6;0;2;2;14;0;0;0;0;1;4;2;0;1;2;0;1;0;0;2;2;1;1;2;0;0;24;0;0;4;0;0;0
2007;I;Accommodation and food service activities;Imports;1;0;0;0;8;0;0;0;0;0;1;2;0;1;0;2;5;0;3;0;0;1;1;3;1;0;4;2;37;6;22;1;8;2;1;10;1;0;1;2;11;13;0;1;11;0;5;0;1;115;7;5;6;4;0;0;4 245;0;3;4;0;0;0
2007;J58;Publishing activities;Imports;1;0;0;0;19;2;1;2;88;1;3;7;1;1;1;2;20;2;5;0;2;3;2;11;3;0;7;17;143;41;8;0;3;5;7;7;248;0;20;123;108;53;0;14;50;0;29;0;258;60;92;37;18;18;0;0;844;0;119;185;0;0;0
2007;J59_J60;"Motion picture, video and television programme production, sound recording and music publishing activities; programming and broadcasting activities";Imports;0;0;0;0;0;0;0;0;0;0;0;0;0;0;0;0;0;0;0;0;0;0;0;0;0;0;0;0;1;0;0;0;0;0;0;0;0;0;0;2;1;0;0;0;1;0;0;0;0;0;0;0;0;0;0;0;10;0;4;5;0;0;0
2007;J61;Telecommunications;Imports;1;0;0;0;5;0;0;1;1;0;1;2;1;1;0;2;14;4;6;0;0;1;2;6;1;0;6;4;57;19;6;0;2;21;3;5;9;0;179;17;45;18;0;6;20;0;4;0;3;15;15;6;10;10;0;0;239;0;0;79;0;0;0
2007;J62_J63;"Computer programming, consultancy and related activities; information service activities";Imports;0;0;0;1;29;2;1;5;16;1;4;5;5;5;2;8;52;8;11;0;4;5;2;61;8;0;8;32;212;52;12;0;5;18;20;11;52;0;26;1 425;241;271;0;20;175;0;45;0;51;89;59;17;46;47;0;0;164;0;25;2 423;0;0;0
2007;K64;Financial service activities, except insurance and pension funding;Imports;35;2;0;7;114;9;15;14;12;15;55;32;23;19;16;46;120;32;85;5;10;22;20;117;28;0;133;52;611;192;112;3;42;65;51;105;25;0;38;93;1 512;262;0;388;233;0;91;0;34;126;257;105;118;109;0;0;2 661;0;0;38;0;0;0
2007;K65;Insurance, reinsurance and pension funding, except compulsory social security;Imports;1;0;0;0;4;0;1;1;0;0;1;1;1;1;0;1;2;0;2;0;0;1;1;3;1;0;4;2;28;11;6;0;2;3;3;4;1;0;1;11;88;243;0;35;16;0;5;0;1;5;13;1;5;3;0;0;234;0;0;17;0;0;0
2007;K66;Activities auxiliary to financial services and insurance activities;Imports;0;0;0;0;0;0;0;0;0;0;0;0;0;0;0;0;0;0;0;0;0;0;0;0;0;0;1;0;3;1;1;0;0;0;0;0;0;0;0;5;3;3;0;1;3;0;1;0;0;2;1;0;1;1;0;0;8;0;0;11;0;0;0
2007;L68;Real estate activities;Imports;0;0;0;0;1;0;0;0;0;0;0;1;0;0;0;0;0;0;0;0;0;0;0;0;0;0;1;0;2;1;1;0;0;0;0;0;0;0;0;1;1;1;0;1;3;0;0;0;0;1;1;0;1;0;0;0;6;0;0;7;0;0;0
2007;M69_M70;"Legal and accounting activities; activities of head offices; management consultancy activities";Imports;8;0;0;16;182;9;10;15;15;12;45;44;33;22;14;45;97;18;67;2;11;23;23;63;27;0;399;69;849;399;82;2;31;100;30;103;35;0;46;101;697;230;0;82;1 643;0;76;0;43;186;218;60;144;132;0;0;71;0;0;902;0;0;0
2007;M71;"Architectural and engineering activities; technical testing and analysis";Imports;0;0;0;0;1;0;0;0;0;0;0;2;0;0;0;2;2;2;7;0;0;0;0;1;0;0;4;1;6;2;1;0;0;1;0;1;1;0;1;11;5;3;0;1;8;0;1;0;1;2;2;0;1;1;0;0;6;0;0;71;0;0;0
2007;M72;Scientific research and development;Imports;0;0;0;0;1;0;0;0;0;0;0;27;0;0;0;0;1;0;1;0;0;0;0;0;0;0;1;0;3;1;1;0;0;0;0;0;0;0;0;6;2;2;0;1;3;0;42;0;0;2;1;0;2;1;0;0;12;0;0;3 352;0;0;0
2007;M73;Advertising and market research;Imports;0;0;0;0;2;0;0;0;0;0;1;1;0;0;0;1;1;0;1;0;0;0;0;1;0;0;5;1;11;5;1;0;0;1;0;1;1;0;1;6;9;4;0;1;20;0;1;0;1;3;3;1;2;2;0;0;4;0;0;19;0;0;0
2007;M74_M75;"Other professional, scientific and technical activities; veterinary activities";Imports;0;0;0;0;1;0;0;0;0;0;0;1;0;0;0;0;1;1;1;0;0;0;0;1;0;0;1;0;4;1;1;0;0;0;0;0;1;0;1;4;3;2;0;1;3;0;1;0;2;1;1;0;1;1;0;0;7;0;1;21;0;0;0
2007;N;Administrative and support service activities;Imports;6;0;0;2;25;2;2;3;6;3;12;18;4;4;2;12;37;8;23;2;2;5;8;24;8;0;64;10;192;63;166;4;63;51;8;31;17;0;22;41;79;45;0;140;129;0;72;0;18;217;95;30;51;41;0;0;875;0;1;111;0;0;0
2007;O84;"Public administration and defence; compulsory social security";Imports;1;0;0;0;5;0;1;1;1;1;2;13;1;1;1;1;2;1;1;0;0;1;0;16;1;0;2;1;23;4;15;0;6;4;1;1;2;0;1;18;7;8;0;2;8;0;2;0;2;5;17;2;4;2;0;0;67;0;13;52;0;0;0
2007;P85;Education;Imports;0;0;0;0;1;0;0;0;0;0;0;0;0;0;0;0;1;0;2;0;0;0;0;1;0;0;1;0;3;1;1;0;0;1;0;0;1;0;0;6;2;2;0;0;3;0;3;0;1;2;1;1;1;1;0;0;52;0;3;202;0;0;0
2007;Q;Human health and social work activities;Imports;0;0;0;0;0;0;0;0;0;0;0;6;0;0;0;0;3;1;1;0;0;0;0;0;0;0;1;0;2;1;0;0;0;0;0;0;0;0;1;4;1;1;0;0;1;0;1;0;0;1;3;1;13;0;0;0;39;6;3;23;0;0;0
2007;R_S;Other service activities;Imports;0;0;0;0;2;1;1;0;0;0;0;1;0;0;0;1;4;1;2;0;0;1;0;1;0;0;4;1;11;5;2;0;1;1;0;3;1;0;1;8;5;3;0;1;9;0;1;0;1;4;2;1;4;4;0;0;1 159;12;535;28;0;0;0
2007;T;"Activities of households as employers; undifferentiated goods- and services-producing activities of households for own use";Imports;0;0;0;0;0;0;0;0;0;0;0;0;0;0;0;0;0;0;0;0;0;0;0;0;0;0;0;0;0;0;0;0;0;0;0;0;0;0;0;0;0;0;0;0;0;0;0;0;0;0;0;0;0;0;0;0;4;0;0;0;0;0;0
2007;U;Activities of extraterritorial organizations and bodies;Imports;0;0;0;0;0;0;0;0;0;0;0;0;0;0;0;0;0;0;0;0;0;0;0;0;0;0;0;0;0;0;0;0;0;0;0;0;0;0;0;0;0;0;0;0;0;0;0;0;0;0;0;0;0;0;0;0;0;0;0;0;0;0;0
2007;II_fob;Total intermediate consumption;TOT;4 993;268;8;833;21 072;1 991;4 229;2 467;2 245;2 382;8 654;33 062;3 972;3 039;3 536;9 117;26 496;13 046;18 641;1 075;1 964;4 298;3 253;26 337;2 880;0;27 582;4 952;47 606;11 276;18 425;435;6 971;5 901;2 993;10 159;5 223;0;7 309;8 428;21 137;11 295;0;11 586;17 741;0;7 341;0;4 121;10 522;13 669;5 785;12 470;6 993;0;0;246 723;7 343;48 860;113 424;-295;0;0
2007;TXSP;taxes less subsidies on products;TOT;318;17;1;5;0;0;4;2;4;95;346;273;115;17;310;403;195;223;208;11;14;239;10;0;2;0;51;22;0;73;140;3;53;37;42;38;-1;0;0;-2;1 568;729;0;735;136;0;357;0;10;0;794;296;706;224;0;0;6 253;156;770;1 609;0;0;0
2007;EXP_adj;Cif/ fob adjustments on exports;TOT;0;0;0;0;0;0;0;0;0;0;0;0;0;0;0;0;0;0;0;0;0;0;0;0;0;0;0;0;0;0;0;0;0;0;0;0;0;0;0;0;0;0;0;0;0;0;0;0;0;0;0;0;0;0;0;0;0;0;0;0;0;0;0
2007;PURR;Direct purchases abroad by residents;TOT;0;0;0;0;0;0;0;0;0;0;0;0;0;0;0;0;0;0;0;0;0;0;0;0;0;0;0;0;0;0;0;0;0;0;0;0;0;0;0;0;0;0;0;0;0;0;0;0;0;0;0;0;0;0;0;0;12 237;0;0;0;0;0;0
2007;PURNR;Purchases on the domestic territory by non-residents ;TOT;0;0;0;0;0;0;0;0;0;0;0;0;0;0;0;0;0;0;0;0;0;0;0;0;0;0;0;0;0;0;0;0;0;0;0;0;0;0;0;0;0;0;0;0;0;0;0;0;0;0;0;0;0;0;0;0;-15 181;0;0;0;0;0;0
2007;VA;Value added at basic prices;TOT;3 514;317;20;617;8 013;1 129;2 659;1 165;2 148;559;4 775;18 741;2 507;2 108;2 405;7 734;16 872;4 777;10 261;507;765;3 621;1 694;7 009;1 932;0;21 462;5 228;44 109;19 816;9 808;259;1 406;3 375;3 460;8 672;3 303;0;5 857;8 700;39 253;22 116;0;31 610;20 362;0;4 068;0;2 522;9 667;26 708;21 392;29 361;9 389;1 530;0;0;0;0;0;0;0;0
2007;IntTTM;International Transport Margins;TOT;79;4;0;12;211;116;59;48;31;82;298;1 306;132;62;159;279;464;342;507;37;64;183;48;62;13;0;430;79;156;70;226;5;86;30;4;65;6;0;31;19;28;13;0;19;44;0;97;0;15;38;99;45;209;51;0;0;2 203;0;0;2 113;13;0;0
2007;GO;Output at basic prices;TOT;8 904;607;28;1 468;29 296;3 236;6 950;3 682;4 428;3 119;14 072;53 383;6 726;5 226;6 410;17 532;44 027;18 389;29 617;1 631;2 806;8 341;5 006;33 408;4 827;0;49 526;10 280;91 871;31 236;28 600;703;8 516;9 343;6 499;18 933;8 531;0;13 197;17 144;61 985;34 152;0;43 949;38 282;0;11 864;0;6 669;20 227;41 271;27 517;42 746;16 658;1 530;0;0;0;0;0;0;0;0
2008;A01;Crop and animal production, hunting and related service activities;Domestic;1 497;75;2;0;5 793;10;396;150;0;13;33;17;33;1;0;1;1;1;1;0;0;1;0;46;1;0;6;0;47;253;3;0;1;0;0;238;0;0;0;0;1;0;0;3;1;0;5;0;0;29;89;8;33;13;0;0;1 222;0;2;198;-4;210;10 429
2008;A02;Forestry and logging;Domestic;80;4;0;0;311;1;21;8;0;1;2;1;2;0;0;0;0;0;0;0;0;0;0;2;0;0;0;0;3;14;0;0;0;0;0;13;0;0;0;0;0;0;0;0;0;0;0;0;0;2;5;0;2;1;0;0;161;0;0;13;0;13;659
2008;A03;Fishing and aquaculture;Domestic;4;0;0;0;17;0;1;0;0;0;0;0;0;0;0;0;0;0;0;0;0;0;0;0;0;0;0;0;0;1;0;0;0;0;0;1;0;0;0;0;0;0;0;0;0;0;0;0;0;0;0;0;0;0;0;0;7;0;0;0;0;1;34
2008;B;Mining and quarrying;Domestic;1;0;0;17;5;0;0;4;0;220;539;1;1;34;38;0;1;2;1;0;0;0;0;469;3;0;32;0;3;3;2;0;1;2;0;1;0;0;0;0;1;0;0;3;4;0;2;0;0;2;14;2;2;1;0;0;202;0;0;1;-18;53;1 653
2008;C10-C12;Manufacture of food products, beverages and tobacco products;Domestic;1 049;53;2;7;5 482;79;9;32;8;105;258;326;29;14;8;27;64;27;54;2;7;14;14;28;14;0;180;31;426;471;1 047;26;427;49;13;3 624;15;0;26;25;311;109;0;33;637;0;117;0;20;83;404;212;885;72;0;0;11 712;0;1;382;6;6 321;35 376
2008;C13-C15;Manufacture of textiles, wearing apparel and leather products;Domestic;3;0;0;0;15;1;2;2;1;2;4;5;3;2;1;5;13;10;12;1;1;3;3;2;1;0;13;2;33;6;6;0;2;1;0;12;1;0;3;1;2;1;0;1;4;0;5;0;1;2;5;2;11;3;0;0;103;0;0;32;0;3 434;3 776
2008;C16;"Manufacture of wood and of products of wood and cork, except furniture; manufacture of articles of straw and plaiting materials";Domestic;57;3;0;15;70;5;2 145;55;9;7;17;4;66;33;11;65;139;60;74;1;7;336;4;130;4;0;2 896;1;267;124;13;0;5;7;0;5;1;0;1;1;1;1;0;11;12;0;2;0;6;18;75;8;12;61;0;0;316;0;0;32;9;724;7 924
2008;C17;Manufacture of paper and paper products;Domestic;3;0;0;3;241;5;35;273;221;39;95;92;35;18;1;21;36;18;27;0;3;8;1;1;1;0;15;9;119;76;20;0;8;12;4;28;13;0;6;28;39;13;0;7;43;0;118;0;21;41;52;5;37;27;0;0;128;0;0;0;0;2 180;4 224
2008;C18;Printing and reproduction of recorded media;Domestic;2;0;0;1;32;2;1;17;257;1;3;5;3;1;1;1;7;3;5;0;2;2;0;7;5;0;14;37;48;108;14;0;6;13;9;12;1 887;0;21;62;155;53;0;24;133;0;295;0;267;109;194;63;20;346;0;0;431;0;1;6;1;222;4 910
2008;C19;Manufacture of coke and refined petroleum products ;Domestic;37;2;0;7;31;8;6;12;4;88;215;184;70;18;17;14;81;35;10;1;2;6;2;16;9;0;49;6;67;30;172;4;70;21;3;28;1;0;2;3;9;3;0;9;20;0;37;0;3;18;43;34;51;27;0;0;143;0;0;13;0;2 801;4 543
2008;C20;Manufacture of chemicals and chemical products ;Domestic;26;1;0;5;30;6;6;9;4;58;143;125;49;15;12;14;63;31;17;1;2;6;3;12;7;0;53;6;75;27;118;3;48;16;2;26;2;0;4;3;14;4;0;8;32;0;28;0;3;15;34;24;42;21;0;0;2 404;0;0;39;-2;12 396;16 092
2008;C21;Manufacture of basic pharmaceutical products and pharmaceutical preparations;Domestic;11;1;0;2;55;2;2;3;1;16;40;17 683;15;4;4;4;50;12;6;0;1;2;2;4;2;0;17;2;36;14;33;1;14;5;1;10;1;0;5;3;11;5;0;3;29;0;415;0;34;6;166;9;910;8;0;0;2 368;0;0;125;-8;41 484;63 630
2008;C22;Manufacture of rubber and plastic products;Domestic;22;1;0;6;320;12;18;16;43;21;51;83;271;66;6;54;232;236;210;24;30;68;8;6;11;0;593;108;267;77;41;1;17;29;2;15;5;0;4;10;41;23;0;16;42;0;73;0;17;41;58;11;150;35;0;0;221;0;0;17;0;4 142;7 870
2008;C23;Manufacture of other non-metallic mineral products;Domestic;10;0;0;12;89;5;36;1;0;15;37;116;98;623;16;82;204;191;41;7;31;24;7;39;17;0;2 632;27;34;12;20;0;8;11;0;4;1;0;1;1;4;5;0;78;20;0;39;0;6;27;95;2;20;3;0;0;185;0;0;11;0;1 169;6 118
2008;C24;Manufacture of basic metals;Domestic;0;0;0;1;3;0;1;1;0;1;2;1;5;2;78;107;28;56;60;3;5;66;3;2;2;0;28;1;11;3;12;0;5;3;0;2;0;0;1;0;1;0;0;2;2;0;1;0;0;1;2;0;3;1;0;0;85;0;0;17;-484;7 151;7 276
2008;C25;Manufacture of fabricated metal products, except machinery and equipment;Domestic;89;5;0;7;337;12;56;2;5;13;32;29;127;59;217;3 193;764;1 259;2 827;83;247;275;106;28;11;0;2 012;482;751;85;114;3;46;46;3;111;10;0;6;2;74;35;0;48;77;0;289;0;6;25;167;89;111;67;0;0;327;0;0;342;0;5 642;20 755
2008;C26;Manufacture of computer, electronic and optical products;Domestic;4;0;0;1;29;2;4;3;13;3;8;20;34;6;5;35;15 275;1 691;655;50;113;201;553;41;24;0;405;63;248;40;64;2;26;15;8;19;145;0;1 860;760;34;12;0;6;213;0;100;0;9;40;90;6;127;86;0;0;439;0;0;5 293;60;24 702;53 640
2008;C27;Manufacture of electrical equipment;Domestic;9;0;0;1;23;1;4;2;2;2;5;8;10;4;3;21;1 170;3 137;802;18;70;62;352;322;3;0;1 510;148;65;11;34;1;14;4;1;12;3;0;65;31;8;11;0;4;63;0;11;0;3;6;42;18;38;77;0;0;193;8;5;4 309;-22;9 815;22 518
