Year;Code;Description;Origin;A01;A02;A03;B;C10-C12;C13-C15;C16;C17;C18;C19;C20;C21;C22;C23;C24;C25;C26;C27;C28;C29;C30;C31_C32;C33;D35;E36;E37-E39;F;G45;G46;G47;H49;H50;H51;H52;H53;I;J58;J59_J60;J61;J62_J63;K64;K65;K66;L68;M69_M70;M71;M72;M73;M74_M75;N;O84;P85;Q;R_S;T;U;CONS_h;CONS_np;CONS_g;GFCF;INVEN;EXP;GO
2007;G46;Wholesale trade, except of motor vehicles and motorcycles;Domestic;0;0;0;1;119;0;0;0;0;0;0;1;0;2;0;1;0;0;0;0;0;0;0;0;0;1;9;1;12;19;1;446;3;363;0;10;0;2;4;6;1;6;18;5;2;1;0;2;1;1;6;2;32;11;0;0;246;6;29;278;326;429;2 407
2007;G47;Retail trade, except of motor vehicles and motorcycles;Domestic;0;0;0;2;177;0;0;0;0;0;0;0;0;1;0;0;0;0;0;0;0;0;0;0;0;1;2;1;9;11;1;19;2;75;0;5;0;1;1;2;1;2;24;2;1;0;0;1;0;1;2;1;44;11;0;0;138;1;47;371;494;460;1 913
2007;H49;Land transport and transport via pipelines;Domestic;3;0;0;11;2;1;1;0;0;0;0;0;0;5;0;1;0;0;1;0;0;1;0;1;0;0;8;1;40;6;7;34;7;30;2;8;0;1;2;0;1;2;2;3;1;1;0;0;1;3;2;1;1;5;0;0;85;0;0;0;0;70;353
2007;H50;Water transport;Domestic;1;0;0;2;3;1;0;0;0;0;0;0;0;0;0;1;0;0;0;0;0;0;0;2;0;0;15;1;5;5;7;47;21;5;0;17;0;0;3;0;4;2;7;14;4;2;0;4;1;10;14;5;17;10;0;0;32;0;0;0;0;2 115;2 379
2007;H51;Air transport;Domestic;0;0;0;0;0;0;0;0;0;0;0;0;0;0;0;0;0;0;0;0;0;0;0;0;0;0;1;0;2;0;0;0;0;6;0;0;0;2;0;0;1;2;1;2;1;0;0;0;0;0;2;0;1;2;0;0;148;0;0;0;0;379;556
2007;H52;Warehousing and support activities for transportation;Domestic;1;0;0;0;0;0;0;0;0;0;0;0;0;0;0;0;0;0;0;0;0;0;0;0;0;0;0;1;8;5;1;592;26;150;0;1;0;0;0;0;0;0;0;0;0;0;0;0;2;1;1;0;0;0;0;0;32;0;0;1;0;951;1 777
2007;H53;Postal and courier activities;Domestic;0;0;0;0;1;0;0;0;0;0;0;0;0;0;0;0;0;0;0;0;0;0;0;0;0;0;1;0;2;2;0;0;0;2;1;1;0;0;0;0;1;3;4;1;1;1;0;0;0;1;4;2;1;1;0;0;28;0;0;2;0;24;89
2007;I;Accommodation and food service activities;Domestic;0;0;0;0;5;1;0;1;2;0;1;2;0;3;0;1;0;0;0;0;0;1;0;0;0;0;22;5;25;27;1;4;10;24;1;29;1;2;5;0;5;10;11;6;14;4;0;4;1;5;30;13;7;15;0;0;2 299;1;0;2;0;13;2 618
2007;J58;Publishing activities;Domestic;0;0;0;0;0;0;0;0;0;0;0;0;0;0;0;0;0;0;0;0;0;0;0;0;0;0;0;0;0;0;0;0;0;0;0;0;0;0;0;0;0;1;0;0;0;0;0;0;0;0;1;0;0;0;0;0;14;0;0;-19;0;121;122
2007;J59_J60;"Motion picture, video and television programme production, sound recording and music publishing activities; programming and broadcasting activities";Domestic;0;0;0;0;8;0;0;0;0;0;1;0;0;1;0;1;0;0;0;0;0;1;0;0;0;0;2;5;4;4;1;0;1;2;0;7;1;7;4;0;2;9;1;3;1;0;0;0;0;1;12;4;5;19;0;0;53;0;32;15;0;6;216
2007;J61;Telecommunications;Domestic;0;0;0;0;3;0;1;0;0;0;0;0;0;1;0;1;0;0;0;0;0;1;0;0;0;0;12;3;4;3;1;5;5;6;0;4;0;2;87;1;3;7;10;4;5;8;0;7;0;2;6;3;2;12;0;0;455;0;0;1;0;83;753
2007;J62_J63;"Computer programming, consultancy and related activities; information service activities";Domestic;0;0;0;0;0;0;0;0;0;0;0;0;0;0;0;0;0;0;0;0;0;0;0;0;0;0;0;0;2;2;0;0;0;0;0;0;0;0;5;9;1;4;2;0;2;1;0;2;0;0;1;0;0;1;0;0;2;0;0;11;0;201;248
2007;K64;Financial service activities, except insurance and pension funding;Domestic;10;0;1;1;20;2;3;1;2;0;2;2;2;7;1;5;1;1;1;0;0;2;1;7;2;2;36;7;26;20;3;113;5;21;0;28;1;2;7;0;14;7;181;94;6;3;0;3;1;7;0;6;5;6;0;0;77;1;4;0;0;818;1 576
2007;K65;Insurance, reinsurance and pension funding, except compulsory social security;Domestic;4;0;0;1;5;0;2;1;1;0;1;1;1;3;0;3;0;0;0;0;0;2;0;1;0;1;3;4;11;14;6;8;9;6;1;4;0;1;3;0;2;11;3;10;2;1;0;0;0;14;2;2;5;16;0;0;114;0;2;0;0;73;357
2007;K66;Activities auxiliary to financial services and insurance activities;Domestic;37;0;0;0;0;0;28;0;0;0;0;0;0;0;0;0;0;0;0;0;0;0;0;0;0;0;303;0;115;107;30;0;0;0;1;4;0;0;48;4;0;2;1;96;1;0;0;1;0;0;105;0;6;6;0;0;85;0;0;4;0;396;1 380
2007;L68;Real estate activities;Domestic;0;0;0;1;20;0;0;0;3;0;2;6;1;9;0;8;1;0;1;0;0;3;0;1;0;10;7;13;46;176;2;1;25;13;1;67;1;10;4;0;4;19;8;37;10;2;0;2;2;8;36;13;21;20;0;0;2 152;0;0;7;0;62;2 835
2007;M69_M70;"Legal and accounting activities; activities of head offices; management consultancy activities";Domestic;0;0;0;0;5;1;3;1;2;0;1;0;0;1;5;3;0;0;0;1;0;2;0;1;0;1;16;4;24;21;1;16;1;10;1;26;1;3;1;0;150;9;536;21;17;4;0;1;1;3;5;5;2;8;0;0;16;0;0;0;0;81;1 015
2007;M71;"Architectural and engineering activities; technical testing and analysis";Domestic;0;0;0;0;2;1;0;0;0;0;0;1;0;1;0;1;0;0;0;0;0;1;0;1;0;2;8;1;4;2;1;0;0;14;0;3;1;1;2;0;0;5;9;16;2;1;0;4;0;2;2;2;3;2;0;0;27;0;11;60;0;22;219
2007;M72;Scientific research and development;Domestic;0;0;0;0;0;0;0;0;0;0;0;0;0;0;0;0;0;0;0;0;0;0;0;0;0;0;0;0;0;0;0;0;0;0;0;0;0;0;0;0;0;0;0;0;0;0;0;0;0;0;0;0;0;0;0;0;0;0;0;13;0;0;13
2007;M73;Advertising and market research;Domestic;0;0;0;0;0;0;0;0;0;0;0;0;0;0;0;0;0;0;0;0;0;0;0;0;0;0;4;5;41;38;0;12;0;10;0;1;0;10;3;0;0;1;0;6;0;0;0;21;0;0;3;2;0;2;0;0;0;0;0;4;0;60;227
2007;M74_M75;"Other professional, scientific and technical activities; veterinary activities";Domestic;1;0;0;0;1;0;0;0;0;0;0;0;0;0;0;0;0;0;0;0;0;0;0;0;0;0;1;0;0;0;0;0;0;0;0;0;0;0;0;0;0;1;2;1;0;0;0;0;0;0;3;2;0;4;0;0;7;0;14;0;0;67;108
2007;N;Administrative and support service activities;Domestic;0;0;0;0;1;0;0;0;0;0;0;0;0;0;0;0;0;0;0;0;0;0;0;0;0;0;3;0;1;1;0;0;4;1;0;3;0;0;1;0;1;1;1;1;1;0;0;1;0;2;3;1;2;1;0;0;9;0;0;0;0;363;405
2007;O84;"Public administration and defence; compulsory social security";Domestic;2;0;0;0;7;0;1;0;0;0;0;0;0;1;0;4;1;1;0;0;0;0;0;0;0;0;31;1;6;3;0;0;3;1;0;3;0;0;1;0;0;1;1;0;0;1;0;0;0;0;62;2;5;3;0;0;137;3;2 353;30;1;268;2 936
2007;P85;Education;Domestic;0;0;0;0;0;0;0;0;0;0;0;0;0;0;0;0;0;0;0;0;0;0;0;0;0;0;0;0;2;0;0;0;0;1;0;0;0;0;0;0;1;11;2;1;8;0;0;0;0;0;6;11;4;1;0;0;416;0;770;44;0;0;1 279
2007;Q;Human health and social work activities;Domestic;0;0;0;0;0;0;0;0;0;0;0;0;0;0;0;0;0;0;0;0;0;0;0;0;0;0;0;0;0;1;0;0;0;1;0;0;0;0;0;0;0;0;0;0;0;0;0;0;0;0;1;1;30;2;0;0;452;102;472;2;0;0;1 064
2007;R_S;Other service activities;Domestic;0;0;0;0;1;0;0;0;0;0;0;0;0;0;0;1;0;0;0;0;0;0;1;0;0;1;1;0;11;10;0;0;0;1;0;32;0;3;0;2;0;3;9;2;2;1;0;0;0;3;4;4;3;8;0;0;565;80;20;152;-17;49;954
2007;T;"Activities of households as employers; undifferentiated goods- and services-producing activities of households for own use";Domestic;0;0;0;0;0;0;0;0;0;0;0;0;0;0;0;0;0;0;0;0;0;0;0;0;0;0;0;0;0;0;0;0;0;0;0;0;0;0;0;0;0;0;0;12;0;0;0;0;0;0;0;0;0;0;0;0;189;0;0;-1;-50;0;149
2007;U;Activities of extraterritorial organizations and bodies;Domestic;0;0;0;0;0;0;0;0;0;0;0;0;0;0;0;0;0;0;0;0;0;0;0;0;0;0;0;0;0;0;0;0;0;0;0;0;0;0;0;0;0;0;0;0;0;0;0;0;0;0;0;0;0;0;0;0;0;0;0;0;0;0;0
2007;A01;Crop and animal production, hunting and related service activities;Imports;25;0;0;0;105;0;0;0;0;0;1;0;0;0;0;0;0;0;0;0;0;0;0;0;0;0;0;0;0;0;0;0;0;0;0;16;0;0;0;0;0;0;0;0;0;0;0;0;0;0;2;0;1;0;0;0;87;0;0;0;0;0;0
2007;A02;Forestry and logging;Imports;0;0;0;0;0;0;0;0;0;0;0;0;0;0;0;0;0;0;0;0;0;0;0;0;0;0;0;0;0;0;0;0;0;0;0;0;0;0;0;0;0;0;0;0;0;0;0;0;0;0;0;0;0;0;0;0;0;0;0;0;0;0;0
2007;A03;Fishing and aquaculture;Imports;0;0;0;0;3;0;0;0;0;0;0;0;0;0;0;0;0;0;0;0;0;0;0;0;0;0;0;0;0;0;0;0;0;0;0;3;0;0;0;0;0;0;0;0;0;0;0;0;0;0;0;0;1;0;0;0;2;0;0;0;0;0;0
2007;B;Mining and quarrying;Imports;1;0;0;0;0;0;0;0;0;0;0;0;0;4;0;0;0;0;0;0;0;0;0;5;0;0;5;0;0;0;1;1;0;1;0;0;0;0;0;0;0;0;0;0;0;0;0;0;0;0;1;0;0;0;0;0;3;0;0;0;0;0;0
2007;C10-C12;Manufacture of food products, beverages and tobacco products;Imports;27;0;0;0;11;0;0;0;0;0;0;0;0;0;0;0;0;0;0;0;0;0;0;0;0;0;0;0;0;0;0;1;0;1;0;85;0;0;1;0;0;0;0;0;0;0;0;0;0;0;3;1;2;2;0;0;883;0;0;0;0;0;0
2007;C13-C15;Manufacture of textiles, wearing apparel and leather products;Imports;1;0;0;0;1;21;1;0;1;0;0;0;0;1;0;1;0;0;0;0;0;2;0;0;0;0;2;0;3;2;0;0;0;1;0;12;0;0;0;0;0;0;0;0;0;0;0;0;0;0;3;0;2;1;0;0;513;0;0;1;0;0;0
2007;C16;"Manufacture of wood and of products of wood and cork, except furniture; manufacture of articles of straw and plaiting materials";Imports;0;0;0;0;8;0;20;0;0;0;0;0;0;0;0;0;0;0;0;0;0;2;0;0;0;0;30;0;2;1;0;0;0;1;0;5;0;1;0;0;0;0;0;2;0;0;0;0;0;0;3;0;0;1;0;0;7;0;0;1;0;0;0
2007;C17;Manufacture of paper and paper products;Imports;0;0;0;0;1;0;0;13;16;0;1;1;0;1;0;0;0;0;0;0;0;0;0;0;0;0;2;2;3;3;0;1;0;1;0;2;5;0;0;0;0;2;0;1;1;1;0;0;1;2;3;1;1;2;0;0;66;0;0;0;0;0;0
2007;C18;Printing and reproduction of recorded media;Imports;0;0;0;0;0;0;0;1;1;0;0;0;0;0;0;0;0;0;0;0;0;0;0;0;0;0;0;0;0;0;0;0;0;0;0;0;0;0;0;0;0;0;0;0;0;0;0;0;0;0;1;0;0;0;0;0;12;0;0;1;0;0;0
2007;C19;Manufacture of coke and refined petroleum products ;Imports;45;0;2;10;29;1;2;2;3;0;5;17;11;44;1;12;3;0;1;1;0;2;1;310;1;4;17;19;23;24;32;9;13;69;5;24;1;4;2;0;5;10;4;7;3;3;0;1;1;5;22;5;15;11;0;0;267;0;0;0;0;0;0
2007;C20;Manufacture of chemicals and chemical products ;Imports;33;0;1;1;8;3;7;6;10;0;9;16;27;13;5;7;4;1;2;1;1;6;1;2;1;1;12;10;1;1;0;1;1;2;0;10;8;1;1;0;2;2;2;3;1;1;0;0;2;3;4;3;4;8;0;0;184;0;0;1;0;0;0
2007;C21;Manufacture of basic pharmaceutical products and pharmaceutical preparations;Imports;1;0;0;0;0;0;0;0;0;0;0;7;1;0;0;0;0;0;0;0;0;0;0;0;0;0;0;0;0;0;1;0;0;0;0;1;0;0;0;0;0;0;0;2;0;0;0;0;3;0;2;1;27;0;0;0;310;0;0;0;0;0;0
2007;C22;Manufacture of rubber and plastic products;Imports;1;0;0;1;17;1;1;1;1;0;1;2;2;12;0;11;0;2;3;1;0;3;1;0;0;0;6;14;9;12;7;2;2;22;0;4;0;1;0;0;0;1;1;2;0;0;0;0;0;1;2;1;1;2;0;0;51;0;0;2;0;0;0
2007;C23;Manufacture of other non-metallic mineral products;Imports;0;0;0;0;3;0;0;0;0;0;0;0;0;42;0;2;1;0;0;0;0;1;0;0;0;0;86;0;1;0;0;0;1;0;0;4;0;0;0;0;0;0;1;2;0;0;0;0;0;0;11;1;1;0;0;0;16;0;0;1;0;0;0
2007;C24;Manufacture of basic metals;Imports;0;0;0;0;1;0;1;1;1;0;0;1;1;5;35;89;3;3;8;2;0;14;3;5;1;0;58;1;3;1;0;0;1;6;0;1;0;0;1;0;1;0;0;1;0;0;0;0;0;0;30;0;0;0;0;0;8;0;1;5;0;0;0
2007;C25;Manufacture of fabricated metal products, except machinery and equipment;Imports;1;0;1;0;9;0;3;0;0;0;0;0;0;6;2;18;5;4;2;1;0;2;1;1;0;0;120;4;1;1;1;0;12;5;0;4;0;0;1;0;0;1;2;0;0;0;0;0;0;1;7;2;2;2;0;0;29;0;15;68;5;0;0
2007;C26;Manufacture of computer, electronic and optical products;Imports;0;0;0;0;1;0;0;0;1;0;0;1;0;0;0;1;14;2;1;0;0;1;1;1;0;0;4;4;3;2;0;0;16;5;0;1;1;1;2;2;1;1;7;3;4;1;0;0;1;1;4;1;3;4;0;0;131;0;0;158;0;0;0
2007;C27;Manufacture of electrical equipment;Imports;0;0;0;0;1;2;1;1;1;0;6;4;2;3;1;8;1;3;1;1;0;2;1;1;0;0;42;31;8;0;6;0;3;1;0;6;0;0;1;1;0;1;2;0;1;0;0;0;0;1;3;1;2;3;0;0;117;0;0;49;2;0;0
2007;C28;Manufacture of machinery and equipment n.e.c.;Imports;1;0;0;1;7;1;1;1;1;0;0;0;0;2;1;3;1;0;6;0;0;2;1;0;1;0;22;6;3;2;6;4;7;8;0;3;1;1;2;1;1;2;1;2;1;1;0;0;1;2;6;2;1;2;0;0;33;0;1;258;0;0;0
2007;C29;Manufacture of motor vehicles, trailers and semi-trailers;Imports;0;0;0;0;2;0;0;0;0;0;0;0;0;2;0;1;0;0;0;0;0;0;0;0;0;0;5;7;1;1;1;1;7;4;0;1;0;0;1;0;0;1;0;1;0;0;0;0;0;1;1;0;1;1;0;0;569;0;0;18;1;0;0
2007;C30;Manufacture of other transport equipment;Imports;0;0;0;0;0;0;0;0;0;0;0;0;0;0;0;0;0;0;0;0;0;0;0;0;0;0;1;1;0;0;0;7;70;0;0;0;0;0;0;0;0;0;0;0;0;0;0;0;0;0;0;0;0;0;0;0;26;0;8;375;0;0;0
2007;C31_C32;"Manufacture of furniture; other manufacturing";Imports;0;0;0;0;1;0;1;0;0;0;0;0;0;0;0;0;0;0;0;0;0;5;0;0;0;0;3;0;2;1;0;0;1;2;0;2;0;0;0;0;0;3;1;4;0;0;0;0;0;0;6;2;4;7;0;0;252;0;0;51;1;0;0
2007;C33;Repair and installation of machinery and equipment;Imports;0;0;0;0;1;0;0;0;0;0;0;0;0;0;0;0;0;0;0;0;0;0;0;0;0;0;2;1;0;0;0;1;5;1;0;0;0;0;0;0;0;2;1;0;0;0;0;0;0;0;3;1;0;0;0;0;2;0;0;6;0;0;0
2007;D35;Electricity, gas, steam and air conditioning supply;Imports;0;0;0;0;0;0;0;0;0;0;0;0;0;0;0;0;0;0;0;0;0;0;0;0;0;0;0;0;0;0;0;0;0;1;0;0;0;0;0;0;0;0;0;0;0;0;0;0;0;0;0;0;0;0;0;0;1;0;0;1;0;0;0
2007;E36;Water collection, treatment and supply;Imports;0;0;0;0;0;0;0;0;0;0;0;0;0;0;0;0;0;0;0;0;0;0;0;0;0;0;0;0;0;0;0;0;0;0;0;0;0;0;0;0;0;0;0;0;0;0;0;0;0;0;0;0;0;0;0;0;0;0;0;0;0;0;0
2007;E37-E39;"Sewerage; waste collection, treatment and disposal activities; materials recovery; remediation activities and other waste management services ";Imports;0;0;0;0;0;0;0;0;0;0;0;0;0;0;0;0;0;0;0;0;0;0;0;0;0;0;0;0;0;0;0;0;0;0;0;0;0;0;0;0;0;0;0;0;0;0;0;1;0;0;0;0;0;0;0;0;1;0;0;0;0;0;0
2007;F;Construction;Imports;0;0;0;0;0;0;0;0;0;0;0;0;0;0;0;0;0;0;0;0;0;0;0;0;0;0;10;0;1;0;0;0;0;2;0;1;0;0;0;0;0;0;0;1;0;0;0;0;0;0;1;0;0;0;0;0;1;0;0;1;0;0;0
2007;G45;Wholesale and retail trade and repair of motor vehicles and motorcycles;Imports;0;0;0;0;1;0;0;0;0;0;0;0;0;0;0;0;0;0;0;0;0;0;0;0;0;0;1;0;0;0;0;0;0;1;0;1;0;0;0;0;0;0;0;0;0;0;0;0;0;0;0;0;0;0;0;0;7;0;0;2;0;0;0
2007;G46;Wholesale trade, except of motor vehicles and motorcycles;Imports;3;0;0;0;8;1;1;0;1;0;0;1;1;3;0;2;1;0;0;0;0;1;0;2;0;0;9;2;2;2;1;8;2;8;0;5;0;0;1;1;1;1;2;1;1;0;0;1;0;1;3;1;2;1;0;0;71;0;3;14;0;0;0
2007;G47;Retail trade, except of motor vehicles and motorcycles;Imports;2;0;0;0;4;0;0;0;0;0;0;0;0;1;0;1;0;0;0;0;0;0;0;2;0;0;4;1;2;2;0;2;1;3;0;3;0;0;1;1;0;1;1;1;0;0;0;1;0;0;2;0;1;1;0;0;36;0;0;6;0;0;0
2007;H49;Land transport and transport via pipelines;Imports;2;0;0;3;3;1;1;0;0;0;0;0;0;3;0;1;0;0;0;0;0;1;0;2;0;0;6;1;12;2;2;17;3;13;1;4;0;0;1;0;0;1;1;1;0;0;0;0;0;1;1;1;1;2;0;0;47;0;0;9;0;0;0
2007;H50;Water transport;Imports;0;0;0;0;0;0;0;0;0;0;0;0;0;0;0;0;0;0;0;0;0;0;0;0;0;0;0;0;0;0;10;81;3;1;0;0;0;0;0;0;0;0;0;14;0;0;0;0;0;0;0;0;14;7;0;0;10;0;0;0;0;0;0
2007;H51;Air transport;Imports;0;0;0;0;1;0;0;0;1;0;0;0;0;0;0;0;0;0;0;0;0;0;0;0;0;0;1;1;6;1;0;1;0;14;0;1;0;5;1;0;1;5;3;6;3;1;0;0;0;1;4;1;2;5;0;0;350;0;0;0;0;0;0
2007;H52;Warehousing and support activities for transportation;Imports;0;0;0;0;0;0;0;0;0;0;0;0;0;0;0;0;0;0;0;0;0;0;0;0;0;0;0;0;4;2;1;244;11;62;0;1;0;0;0;0;0;0;0;0;0;0;0;0;1;0;1;0;0;0;0;0;16;0;0;1;0;0;0
2007;H53;Postal and courier activities;Imports;0;0;0;0;0;0;0;0;0;0;0;0;0;0;0;0;0;0;0;0;0;0;0;0;0;0;0;0;0;0;0;2;0;1;0;0;0;0;0;0;0;0;1;1;0;0;0;0;0;0;0;0;0;0;0;0;2;0;0;0;0;0;0
2007;I;Accommodation and food service activities;Imports;0;0;0;0;1;0;0;0;0;0;0;0;0;1;0;0;0;0;0;0;0;0;0;0;0;0;4;1;5;5;0;1;2;5;0;6;0;0;1;0;1;2;2;1;3;1;0;1;0;1;6;3;1;3;0;0;32;0;0;0;0;0;0
2007;J58;Publishing activities;Imports;0;0;0;0;1;0;0;0;0;0;0;0;0;0;0;0;0;0;0;0;0;0;0;0;0;0;1;0;1;2;0;0;0;0;0;0;0;0;1;1;1;2;1;1;1;0;0;1;0;0;3;1;1;1;0;0;36;0;0;1;0;0;0
2007;J59_J60;"Motion picture, video and television programme production, sound recording and music publishing activities; programming and broadcasting activities";Imports;0;0;0;0;1;0;0;0;0;0;0;0;0;0;0;0;0;0;0;0;0;0;0;0;0;0;0;1;1;1;0;0;0;0;0;1;0;1;1;0;0;1;0;0;0;0;0;0;0;0;2;0;1;2;0;0;23;0;13;0;0;0;0
2007;J61;Telecommunications;Imports;0;0;0;0;1;0;0;0;0;0;0;0;0;0;0;0;0;0;0;0;0;0;0;0;0;0;3;1;1;1;0;1;2;2;0;1;0;1;22;1;1;2;3;1;1;2;0;2;0;0;2;1;1;3;0;0;29;0;0;1;0;0;0
2007;J62_J63;"Computer programming, consultancy and related activities; information service activities";Imports;0;0;0;0;0;0;0;0;0;0;0;0;0;0;0;0;0;0;0;0;0;0;0;0;0;0;0;0;9;8;1;0;0;1;0;0;1;2;18;34;3;17;9;1;6;2;0;9;1;0;6;0;0;3;0;0;5;0;1;38;0;0;0
2007;K64;Financial service activities, except insurance and pension funding;Imports;10;0;0;1;19;2;3;1;2;0;2;2;2;7;1;5;1;1;1;0;0;2;1;7;2;1;37;7;27;20;3;110;6;22;0;28;1;2;7;1;14;8;178;93;6;3;0;3;1;7;1;6;5;6;0;0;80;1;4;1;0;0;0
2007;K65;Insurance, reinsurance and pension funding, except compulsory social security;Imports;2;0;0;0;2;0;1;0;0;0;1;1;1;2;0;2;0;0;0;0;0;1;0;1;0;0;2;2;5;7;3;4;4;3;0;2;0;0;2;0;1;6;2;5;1;1;0;0;0;7;1;1;3;8;0;0;43;0;1;0;0;0;0
2007;K66;Activities auxiliary to financial services and insurance activities;Imports;2;0;0;0;0;0;2;0;0;0;0;0;0;0;0;0;0;0;0;0;0;0;0;0;0;0;19;0;7;7;2;0;0;1;0;0;0;0;3;0;0;0;0;6;0;0;0;0;0;0;7;0;0;0;0;0;29;0;0;0;0;0;0
2007;L68;Real estate activities;Imports;0;0;0;0;0;0;0;0;0;0;0;0;0;0;0;0;0;0;0;0;0;0;0;0;0;0;0;0;0;0;0;0;0;0;0;0;0;0;0;0;0;0;0;0;0;0;0;0;0;0;0;0;0;0;0;0;0;0;0;0;0;0;0
2007;M69_M70;"Legal and accounting activities; activities of head offices; management consultancy activities";Imports;0;0;0;0;0;0;0;0;0;0;0;0;0;0;0;0;0;0;0;0;0;0;0;0;0;0;1;0;3;2;0;1;0;12;0;2;0;0;0;1;10;1;35;2;1;0;0;1;0;0;1;0;0;1;0;0;2;0;0;1;0;0;0
2007;M71;"Architectural and engineering activities; technical testing and analysis";Imports;0;0;0;0;0;0;0;0;0;0;0;0;0;0;0;0;0;0;0;0;0;0;0;0;0;0;1;0;0;0;0;0;0;1;0;0;0;0;0;0;0;0;0;0;0;0;0;0;0;0;0;0;0;0;0;0;0;0;0;1;0;0;0
2007;M72;Scientific research and development;Imports;0;0;0;0;0;0;0;0;0;0;0;0;0;0;0;0;0;0;0;0;0;0;0;0;0;0;0;0;0;0;0;0;0;0;0;0;0;0;0;0;0;0;0;0;0;0;0;0;0;0;0;0;0;0;0;0;1;0;0;0;0;0;0
2007;M73;Advertising and market research;Imports;0;0;0;0;0;0;0;0;0;0;0;0;0;0;0;0;0;0;0;0;0;0;0;0;0;0;2;2;16;15;0;5;0;4;0;1;0;4;1;0;0;0;0;3;0;0;0;9;0;0;1;1;0;1;0;0;1;0;0;0;0;0;0
2007;M74_M75;"Other professional, scientific and technical activities; veterinary activities";Imports;0;0;0;0;0;0;0;0;0;0;0;0;0;0;0;0;0;0;0;0;0;0;0;0;0;0;0;0;0;0;0;0;0;0;0;0;0;0;0;0;0;0;0;0;0;0;0;0;0;0;0;0;0;0;0;0;0;0;0;0;0;0;0
2007;N;Administrative and support service activities;Imports;1;0;0;1;1;1;0;0;0;0;0;0;0;0;0;0;0;0;0;0;0;0;0;1;0;0;10;0;10;6;1;0;15;126;0;30;0;0;3;1;2;3;5;3;2;0;0;2;1;7;2;0;0;6;0;0;25;0;0;1;0;0;0
2007;O84;"Public administration and defence; compulsory social security";Imports;0;0;0;0;0;0;0;0;0;0;0;0;0;0;0;0;0;0;0;0;0;0;0;0;0;0;2;0;5;2;0;2;0;4;0;0;0;0;1;1;0;0;0;0;0;0;0;0;0;0;42;0;3;1;0;0;3;0;27;1;0;0;0
2007;P85;Education;Imports;0;0;0;0;0;0;0;0;0;0;0;0;0;0;0;0;0;0;0;0;0;0;0;0;0;0;0;0;0;0;0;0;0;0;0;0;0;0;0;0;0;0;0;0;0;0;0;0;0;0;0;0;0;0;0;0;0;0;0;0;0;0;0
2007;Q;Human health and social work activities;Imports;0;0;0;0;0;0;0;0;0;0;0;0;0;0;0;0;0;0;0;0;0;0;0;0;0;0;0;0;0;0;0;0;0;0;0;0;0;0;0;0;0;0;0;0;0;0;0;0;0;0;0;0;0;0;0;0;2;0;0;0;0;0;0
2007;R_S;Other service activities;Imports;0;0;0;0;0;0;0;0;0;0;0;0;0;0;0;0;0;0;0;0;0;0;0;0;0;0;0;0;3;2;0;0;0;1;0;10;0;1;0;1;0;0;0;0;1;0;0;0;0;1;2;0;0;2;0;0;152;2;5;1;0;0;0
2007;T;"Activities of households as employers; undifferentiated goods- and services-producing activities of households for own use";Imports;0;0;0;0;0;0;0;0;0;0;0;0;0;0;0;0;0;0;0;0;0;0;0;0;0;0;0;0;0;0;0;0;0;0;0;0;0;0;0;0;0;0;0;0;0;0;0;0;0;0;0;0;0;0;0;0;0;0;0;0;0;0;0
2007;U;Activities of extraterritorial organizations and bodies;Imports;0;0;0;0;0;0;0;0;0;0;0;0;0;0;0;0;0;0;0;0;0;0;0;0;0;0;0;0;0;0;0;0;0;0;0;0;0;0;0;0;0;0;0;0;0;0;0;0;0;0;0;0;0;0;0;0;0;0;0;0;0;0;0
2007;II_fob;Total intermediate consumption;TOT;432;2;19;50;1 079;63;170;47;82;0;51;90;71;452;73;258;54;30;44;15;4;92;21;368;87;64;2 604;238;683;684;172;1 823;424;1 264;24;1 120;57;105;284;74;254;238;1 136;649;142;64;3;141;38;131;766;177;365;324;0;0;15 753;198;3 913;5 839;-273;0;0
2007;TXSP;taxes less subsidies on products;TOT;41;0;1;3;0;7;3;2;4;0;3;7;5;21;3;8;3;1;2;1;0;4;1;73;8;3;80;15;18;17;10;6;12;12;2;118;3;6;12;1;33;12;113;19;8;4;0;3;2;5;30;10;7;13;0;0;1 215;5;22;235;1;0;0
2007;EXP_adj;Cif/ fob adjustments on exports;TOT;0;0;0;0;0;0;0;0;0;0;0;0;0;0;0;0;0;0;0;0;0;0;0;0;0;0;0;0;0;0;0;0;0;0;0;0;0;0;0;0;0;0;0;0;0;0;0;0;0;0;0;0;0;0;0;0;0;0;0;0;0;0;0
2007;PURR;Direct purchases abroad by residents;TOT;0;0;0;0;0;0;0;0;0;0;0;0;0;0;0;0;0;0;0;0;0;0;0;0;0;0;0;0;0;0;0;0;0;0;0;0;0;0;0;0;0;0;0;0;0;0;0;0;0;0;0;0;0;0;0;0;0;0;0;0;0;0;0
2007;PURNR;Purchases on the domestic territory by non-residents ;TOT;0;0;0;0;0;0;0;0;0;0;0;0;0;0;0;0;0;0;0;0;0;0;0;0;0;0;0;0;0;0;0;0;0;0;0;0;0;0;0;0;0;0;0;0;0;0;0;0;0;0;0;0;0;0;0;0;-2 144;0;0;0;0;0;0
2007;VA;Value added at basic prices;TOT;403;3;40;68;448;47;108;28;61;0;36;57;49;226;45;140;8;17;30;12;2;72;16;316;80;86;2 479;297;1 702;1 208;169;549;111;493;63;1 366;61;104;456;173;1 289;106;130;2 164;864;150;10;83;68;268;2 132;1 091;688;613;149;0;0;0;0;0;0;0;0
2007;IntTTM;International Transport Margins;TOT;10;0;0;1;18;2;3;2;3;0;2;3;3;9;3;10;2;1;2;0;0;3;1;13;0;0;30;7;4;3;3;2;8;7;0;14;1;1;1;0;1;1;1;2;1;1;0;0;1;1;7;1;4;3;0;0;246;0;2;56;1;0;0
2007;GO;Output at basic prices;TOT;885;5;61;122;1 544;119;285;79;150;0;93;156;129;707;124;416;67;49;77;28;6;171;38;770;175;154;5 193;556;2 407;1 913;353;2 379;556;1 777;89;2 618;122;216;753;248;1 576;357;1 380;2 835;1 015;219;13;227;108;405;2 936;1 279;1 064;954;149;0;0;0;0;0;0;0;0
2008;A01;Crop and animal production, hunting and related service activities;Domestic;71;0;0;0;344;0;0;0;0;0;2;0;0;0;0;0;0;0;0;0;0;0;0;0;0;0;0;0;0;0;0;0;0;0;0;50;0;0;0;0;0;0;0;0;0;0;0;0;0;0;6;0;2;1;0;0;406;0;2;-12;-1;143;1 017
2008;A02;Forestry and logging;Domestic;0;0;0;0;0;0;0;0;0;0;0;0;0;0;0;0;0;0;0;0;0;0;0;0;0;0;0;0;0;0;0;0;0;0;0;0;0;0;0;0;0;0;0;0;0;0;0;0;0;0;0;0;0;0;0;0;0;0;4;0;0;0;5
2008;A03;Fishing and aquaculture;Domestic;0;0;2;0;12;0;0;0;0;0;0;0;0;0;0;0;0;0;0;0;0;0;0;0;0;0;0;0;0;0;0;0;0;0;0;13;0;0;0;0;0;0;0;0;0;0;0;0;0;0;0;0;2;0;0;0;0;0;0;0;-8;42;64
2008;B;Mining and quarrying;Domestic;0;0;0;1;0;0;0;0;0;0;2;1;0;47;0;0;0;0;0;0;0;0;0;0;0;0;67;0;0;0;0;0;0;0;0;0;0;0;0;0;0;0;0;0;0;0;0;0;0;0;2;0;0;2;0;0;7;0;0;1;2;25;156
2008;C10-C12;Manufacture of food products, beverages and tobacco products;Domestic;105;0;0;0;61;0;0;0;0;0;2;1;0;0;0;0;0;0;0;0;0;0;0;0;0;0;0;0;1;2;0;1;0;0;0;349;0;2;3;0;0;0;0;0;0;0;0;0;0;0;10;5;9;8;0;0;1 340;0;0;2;-92;45;1 856
2008;C13-C15;Manufacture of textiles, wearing apparel and leather products;Domestic;0;0;0;0;0;9;1;0;1;0;0;0;0;0;0;0;0;0;0;0;0;1;0;0;0;0;2;0;2;1;0;0;0;0;0;6;0;0;0;0;0;0;0;0;0;0;0;0;0;0;2;0;1;1;0;0;307;0;0;-3;-252;26;108
2008;C16;"Manufacture of wood and of products of wood and cork, except furniture; manufacture of articles of straw and plaiting materials";Domestic;1;0;0;0;25;0;65;0;0;0;1;0;0;1;0;1;0;0;0;0;0;6;0;0;0;0;107;1;6;5;0;0;0;3;0;16;0;2;0;0;0;0;0;7;0;0;0;0;0;0;7;0;0;1;0;0;15;0;0;-7;1;47;314
2008;C17;Manufacture of paper and paper products;Domestic;0;0;0;0;1;0;0;9;12;0;0;0;0;0;0;0;0;0;0;0;0;0;0;0;0;0;1;2;2;2;0;1;0;1;0;1;4;0;0;0;0;1;0;0;1;0;0;0;0;2;2;1;1;1;0;0;49;0;0;0;-13;1;90
2008;C18;Printing and reproduction of recorded media;Domestic;0;0;0;0;2;0;0;0;9;0;0;6;3;1;0;0;0;0;0;0;0;1;0;0;0;23;2;9;6;6;0;1;1;1;2;9;19;3;2;0;2;3;3;3;1;1;0;7;1;1;8;7;1;8;0;0;18;0;0;0;-1;1;172
2008;C19;Manufacture of coke and refined petroleum products ;Domestic;10;0;0;2;7;0;0;0;1;0;1;4;3;11;0;3;1;0;0;0;0;0;0;116;0;1;4;4;5;6;8;2;3;12;1;6;0;1;1;0;1;2;1;2;1;1;0;0;0;1;5;1;4;3;0;0;184;0;0;0;-425;6;6
2008;C20;Manufacture of chemicals and chemical products ;Domestic;1;0;0;0;0;0;0;0;1;0;0;0;1;1;0;0;0;0;0;0;0;0;0;0;0;0;1;0;0;0;0;0;0;0;0;0;0;0;0;0;0;0;0;0;0;0;0;0;0;0;0;0;0;0;0;0;124;0;0;1;-68;29;96
2008;C21;Manufacture of basic pharmaceutical products and pharmaceutical preparations;Domestic;0;0;0;0;0;0;0;0;0;0;0;3;0;0;0;0;0;0;0;0;0;0;0;0;0;0;0;0;0;0;0;0;0;0;0;0;0;0;0;0;0;0;0;1;0;0;0;0;1;0;1;0;12;0;0;0;19;0;0;0;9;134;180
2008;C22;Manufacture of rubber and plastic products;Domestic;1;0;0;1;14;1;1;0;0;0;1;1;1;11;0;10;0;2;2;1;0;2;1;0;0;0;5;11;7;10;6;2;2;12;0;3;0;1;0;0;0;0;1;2;0;0;0;0;0;1;1;1;1;2;0;0;26;0;1;-13;12;24;166
2008;C23;Manufacture of other non-metallic mineral products;Domestic;1;0;0;0;14;0;1;0;0;0;0;2;0;225;0;7;6;0;1;0;0;2;1;1;1;0;456;0;3;1;0;0;5;0;0;18;0;0;0;0;2;0;4;8;2;0;0;0;0;0;49;2;3;1;0;0;56;0;0;-25;3;10;866
2008;C24;Manufacture of basic metals;Domestic;0;0;0;0;0;0;0;0;0;0;0;0;0;0;2;6;0;0;1;0;0;1;0;0;0;0;4;0;0;0;0;0;0;0;0;0;0;0;0;0;0;0;0;0;0;0;0;1;0;0;2;0;0;0;0;0;4;0;0;-11;48;69;129
2008;C25;Manufacture of fabricated metal products, except machinery and equipment;Domestic;1;0;1;0;7;0;2;0;0;0;0;0;0;5;0;12;4;2;1;0;0;1;1;0;0;0;93;3;0;0;0;0;8;2;0;3;0;0;0;0;0;1;2;0;0;0;0;0;0;1;4;1;2;2;0;0;101;0;75;82;45;38;504
2008;C26;Manufacture of computer, electronic and optical products;Domestic;0;0;0;0;0;0;0;0;0;0;0;0;0;0;0;0;0;0;0;0;0;0;0;0;0;0;0;0;0;0;0;0;0;0;0;0;0;0;0;0;0;0;0;0;0;0;0;0;0;0;0;0;0;0;0;0;0;0;0;1;0;89;89
2008;C27;Manufacture of electrical equipment;Domestic;0;0;0;0;0;0;0;0;0;0;0;0;0;0;0;1;0;0;0;0;0;0;0;0;0;0;4;2;1;0;0;0;0;0;0;0;0;0;0;0;0;0;0;0;0;0;0;0;0;0;0;0;0;0;0;0;10;0;1;5;1;28;59
2008;C28;Manufacture of machinery and equipment n.e.c.;Domestic;0;0;0;0;0;0;0;0;0;0;0;0;0;0;0;0;0;0;0;0;0;0;0;0;0;0;1;0;0;0;0;0;0;0;0;0;0;0;0;0;0;1;0;0;0;0;0;0;0;0;1;0;0;0;0;0;0;0;0;1;0;86;94
2008;C29;Manufacture of motor vehicles, trailers and semi-trailers;Domestic;0;0;0;0;0;0;0;0;0;0;0;0;0;0;0;0;0;0;0;0;0;0;0;0;0;0;0;0;0;0;0;0;0;0;0;0;0;0;0;0;0;0;0;0;0;0;0;0;0;0;0;0;0;0;0;0;0;0;0;0;0;31;31
2008;C30;Manufacture of other transport equipment;Domestic;0;0;0;0;0;0;0;0;0;0;0;0;0;0;0;0;0;0;0;0;0;0;0;0;0;0;0;0;0;0;0;0;0;0;0;0;0;0;0;0;0;0;0;0;0;0;0;0;0;0;0;0;0;0;0;0;0;0;0;0;0;4;4
2008;C31_C32;"Manufacture of furniture; other manufacturing";Domestic;0;0;0;0;3;0;8;0;0;0;0;0;0;0;0;0;0;0;0;0;0;1;0;0;0;0;13;0;1;1;0;0;0;0;0;2;0;0;0;0;0;0;0;1;0;0;0;0;0;0;1;0;0;0;0;0;12;0;1;0;-6;145;183
2008;C33;Repair and installation of machinery and equipment;Domestic;0;0;0;0;1;0;1;1;0;0;1;0;0;0;0;0;0;0;0;0;0;0;0;1;0;1;2;1;1;0;0;0;2;1;0;0;0;0;1;0;0;4;1;0;0;0;0;0;0;1;6;1;1;1;0;0;1;0;0;0;1;16;52
2008;D35;Electricity, gas, steam and air conditioning supply;Domestic;23;0;3;7;30;1;1;1;4;2;2;1;6;27;2;4;0;0;1;0;0;3;0;1;51;4;8;10;23;7;1;0;4;29;1;66;3;26;16;0;3;16;9;5;10;3;0;1;2;5;29;6;19;22;0;0;323;0;0;290;0;0;1 114
2008;E36;Water collection, treatment and supply;Domestic;3;0;0;0;1;0;0;0;0;0;0;0;0;0;0;0;0;0;0;0;0;0;0;0;27;0;1;0;1;1;0;0;1;1;0;1;0;0;0;0;0;0;2;1;0;0;0;0;0;1;51;1;3;2;0;0;73;0;0;0;0;1;178
2008;E37-E39;"Sewerage; waste collection, treatment and disposal activities; materials recovery; remediation activities and other waste management services ";Domestic;0;0;0;0;3;0;0;0;0;0;0;0;1;1;2;1;0;0;0;0;0;1;0;1;1;12;2;2;3;1;0;0;0;0;0;9;0;0;4;0;0;0;0;5;1;2;0;55;0;1;4;3;3;0;0;0;3;0;0;0;0;69;192
2008;F;Construction;Domestic;5;1;3;1;11;1;4;1;2;0;1;2;3;5;2;3;0;0;1;1;0;3;2;4;12;5;1 149;8;44;36;1;0;3;27;0;70;2;4;6;0;5;23;9;116;5;5;0;0;2;6;62;30;16;15;0;0;80;0;0;4 219;180;117;6 314
2008;G45;Wholesale and retail trade and repair of motor vehicles and motorcycles;Domestic;4;0;0;1;3;1;1;0;1;0;1;0;1;9;0;3;0;0;1;0;0;1;0;4;0;3;22;18;15;5;19;9;92;10;1;4;0;1;1;0;1;1;0;3;1;1;0;0;1;6;5;2;1;2;0;0;361;0;0;0;0;0;619
2008;G46;Wholesale trade, except of motor vehicles and motorcycles;Domestic;0;0;0;2;146;0;0;0;1;0;0;1;0;3;0;1;0;0;0;0;0;1;0;1;0;2;12;2;14;24;1;545;4;316;1;12;0;2;5;9;1;7;20;5;3;1;0;2;1;2;7;2;39;15;0;0;298;7;35;345;390;476;2 762
2008;G47;Retail trade, except of motor vehicles and motorcycles;Domestic;1;0;0;2;216;0;0;0;0;1;0;0;0;2;0;1;0;0;0;0;0;0;0;1;0;1;2;1;12;15;1;23;3;61;0;7;0;1;2;3;1;3;26;3;1;1;0;1;0;1;3;1;52;14;0;0;185;1;57;458;585;525;2 276
2008;H49;Land transport and transport via pipelines;Domestic;3;0;0;13;2;1;1;0;0;0;0;0;0;7;0;1;0;0;1;0;0;1;0;3;0;0;10;1;47;8;8;39;8;25;2;10;0;1;2;0;1;3;3;3;1;1;1;0;1;4;2;1;2;7;0;0;100;0;0;0;0;79;406
2008;H50;Water transport;Domestic;1;0;0;2;4;1;0;0;0;0;0;0;0;0;0;1;0;0;0;0;0;1;0;3;0;1;21;1;6;7;9;58;27;5;1;20;0;1;5;0;6;3;9;17;6;2;0;5;2;15;17;7;22;14;0;0;45;0;0;1;0;2 361;2 709
2008;H51;Air transport;Domestic;0;0;0;0;1;0;0;0;0;0;0;0;0;0;0;0;0;0;0;0;0;0;0;0;0;0;1;0;3;0;0;0;0;5;0;0;0;2;1;0;1;3;2;3;1;1;0;0;0;0;2;1;1;3;0;0;179;0;0;0;0;437;648
