Year;Code;Description;Origin;A01;A02;A03;B;C10-C12;C13-C15;C16;C17;C18;C19;C20;C21;C22;C23;C24;C25;C26;C27;C28;C29;C30;C31_C32;C33;D35;E36;E37-E39;F;G45;G46;G47;H49;H50;H51;H52;H53;I;J58;J59_J60;J61;J62_J63;K64;K65;K66;L68;M69_M70;M71;M72;M73;M74_M75;N;O84;P85;Q;R_S;T;U;CONS_h;CONS_np;CONS_g;GFCF;INVEN;EXP;GO
2010;K65;Insurance, reinsurance and pension funding, except compulsory social security;Domestic;4;0;0;1;5;0;2;1;1;0;1;2;2;3;0;4;0;1;0;0;0;1;0;2;1;1;3;5;10;17;7;11;8;8;1;4;0;1;3;0;4;12;5;11;3;1;0;0;1;16;2;3;8;20;0;0;140;0;3;0;0;69;408
2010;K66;Activities auxiliary to financial services and insurance activities;Domestic;40;0;0;0;0;0;26;0;0;0;0;0;0;0;0;0;0;0;0;0;0;0;0;0;0;0;326;0;117;134;36;0;0;0;1;4;0;0;58;8;0;2;1;111;1;0;0;1;0;0;97;0;6;8;0;0;109;0;0;5;0;624;1 716
2010;L68;Real estate activities;Domestic;0;0;0;1;25;0;0;0;3;0;3;8;1;9;0;9;1;1;0;0;0;3;0;3;0;22;8;16;46;220;3;2;23;20;1;75;1;14;5;1;6;23;12;42;16;2;0;2;3;9;33;16;32;26;0;0;2 523;1;0;8;0;71;3 349
2010;M69_M70;"Legal and accounting activities; activities of head offices; management consultancy activities";Domestic;0;0;0;0;5;1;2;1;2;0;1;0;1;1;4;3;0;1;0;0;0;1;0;1;0;3;15;4;21;23;2;21;1;14;1;26;1;4;1;1;210;9;716;21;23;3;0;1;1;4;4;5;2;9;0;0;17;0;0;0;0;81;1 269
2010;M71;"Architectural and engineering activities; technical testing and analysis";Domestic;0;0;0;0;3;1;0;0;0;0;0;1;0;1;0;1;0;1;0;0;0;1;0;3;0;5;9;1;3;2;1;0;0;22;0;4;1;1;2;1;0;5;13;18;3;1;0;4;0;2;2;2;3;2;0;0;30;0;13;67;0;25;259
2010;M72;Scientific research and development;Domestic;0;0;0;0;0;0;0;0;0;0;0;0;0;0;0;0;0;0;0;0;0;0;0;0;0;0;0;0;0;0;0;0;0;0;0;0;0;0;0;0;0;0;0;0;0;0;0;0;0;0;0;0;0;0;0;0;0;0;0;11;0;0;12
2010;M73;Advertising and market research;Domestic;0;0;0;0;0;0;0;0;0;0;0;0;0;0;0;0;0;0;0;0;0;0;0;1;0;0;3;5;33;38;0;15;0;13;0;1;0;11;3;0;0;1;0;6;0;0;0;18;0;0;2;2;0;2;0;0;0;0;0;3;0;55;214
2010;M74_M75;"Other professional, scientific and technical activities; veterinary activities";Domestic;1;0;0;0;1;0;0;0;0;0;0;0;0;0;0;0;0;0;0;0;0;0;0;0;0;0;1;0;0;0;0;0;0;0;0;0;0;0;0;0;0;2;2;1;0;0;0;0;1;0;2;2;1;4;0;0;7;0;16;0;0;69;114
2010;N;Administrative and support service activities;Domestic;0;0;0;0;1;0;0;0;0;0;0;0;0;0;0;0;0;0;0;0;0;0;0;1;0;0;3;0;1;2;0;0;3;2;0;3;0;0;1;0;1;1;2;1;1;0;0;1;0;3;3;1;3;2;0;0;10;0;0;0;0;368;416
2010;O84;"Public administration and defence; compulsory social security";Domestic;2;0;0;0;7;0;0;0;0;0;0;0;0;1;0;3;1;1;0;0;0;0;0;0;0;0;22;1;4;3;0;0;2;1;0;3;0;0;1;0;0;1;2;0;0;0;0;0;0;0;41;2;2;3;0;0;134;4;2 573;36;18;187;3 059
2010;P85;Education;Domestic;0;0;0;0;0;0;0;0;0;0;0;0;0;0;0;0;0;0;0;0;0;0;0;0;0;0;0;0;2;0;0;0;0;1;0;0;0;0;0;0;2;13;3;1;13;0;0;0;0;0;5;14;4;2;0;0;488;0;966;53;0;0;1 571
2010;Q;Human health and social work activities;Domestic;0;0;0;0;0;0;0;0;0;0;0;0;0;0;0;0;0;0;0;0;0;0;0;0;0;0;0;0;0;0;0;0;0;2;0;0;0;0;0;0;0;0;0;0;0;0;0;0;0;0;1;1;10;2;0;0;584;52;647;4;0;1;1 304
2010;R_S;Other service activities;Domestic;0;0;0;0;1;0;0;0;0;0;0;0;0;0;0;1;0;0;0;0;0;0;1;0;0;1;1;0;7;8;0;0;0;1;0;33;1;4;0;2;0;3;11;3;2;0;0;0;1;3;3;5;4;9;0;0;602;128;23;174;-2;59;1 088
2010;T;"Activities of households as employers; undifferentiated goods- and services-producing activities of households for own use";Domestic;0;0;0;0;0;0;0;0;0;0;0;0;0;0;0;0;0;0;0;0;0;0;0;0;0;0;0;0;0;0;0;0;0;0;0;0;0;0;0;0;0;0;0;13;0;0;0;0;0;0;0;0;0;0;0;0;221;0;0;-1;-5;0;228
2010;U;Activities of extraterritorial organizations and bodies;Domestic;0;0;0;0;0;0;0;0;0;0;0;0;0;0;0;0;0;0;0;0;0;0;0;0;0;0;0;0;0;0;0;0;0;0;0;0;0;0;0;0;0;0;0;0;0;0;0;0;0;0;0;0;0;0;0;0;0;0;0;0;0;0;0
2010;A01;Crop and animal production, hunting and related service activities;Imports;21;0;0;0;103;0;0;0;0;0;1;0;0;0;0;0;0;0;0;0;0;0;0;0;0;0;0;0;0;0;0;0;0;1;0;14;0;0;0;0;0;0;0;0;0;0;0;0;0;0;2;0;1;0;0;0;101;0;0;0;0;0;0
2010;A02;Forestry and logging;Imports;0;0;0;0;0;0;0;0;0;0;0;0;0;0;0;0;0;0;0;0;0;0;0;0;0;0;0;0;0;0;0;0;0;0;0;0;0;0;0;0;0;0;0;0;0;0;0;0;0;0;0;0;0;0;0;0;0;0;0;0;0;0;0
2010;A03;Fishing and aquaculture;Imports;0;0;1;0;4;0;0;0;0;0;0;0;0;0;0;0;0;0;0;0;0;0;0;0;0;0;0;0;0;0;0;0;0;0;0;4;0;0;0;0;0;0;0;0;0;0;0;0;0;0;0;0;1;0;0;0;1;0;0;0;0;0;0
2010;B;Mining and quarrying;Imports;1;0;0;0;0;0;0;0;0;0;0;0;0;3;0;1;0;0;0;0;0;0;0;7;0;0;5;0;0;0;0;1;0;2;0;0;0;0;0;0;0;0;0;0;0;0;0;0;0;0;1;0;0;0;0;0;13;0;0;1;0;0;0
2010;C10-C12;Manufacture of food products, beverages and tobacco products;Imports;26;0;0;0;20;0;0;0;0;0;1;1;0;0;0;0;0;0;0;0;0;0;0;0;0;0;1;0;0;1;0;1;0;1;0;83;0;1;1;0;0;0;0;0;0;0;0;0;0;0;2;1;2;2;0;0;808;0;0;1;0;0;0
2010;C13-C15;Manufacture of textiles, wearing apparel and leather products;Imports;0;0;0;0;1;8;0;0;1;0;0;0;0;0;0;1;0;0;0;0;0;1;0;0;0;0;1;1;2;2;0;0;0;1;0;9;1;0;0;0;0;0;0;0;0;0;0;0;0;0;2;0;2;1;0;0;409;0;0;1;0;0;0
2010;C16;"Manufacture of wood and of products of wood and cork, except furniture; manufacture of articles of straw and plaiting materials";Imports;0;0;0;0;9;0;17;0;0;0;0;0;0;0;0;0;0;0;0;0;0;2;0;0;0;0;29;0;2;2;0;0;0;2;0;5;0;1;0;0;0;0;0;2;0;0;0;0;0;0;2;0;0;1;0;0;8;0;0;1;0;0;0
2010;C17;Manufacture of paper and paper products;Imports;0;0;1;0;2;0;0;18;22;0;1;1;1;1;0;0;0;1;0;0;0;1;0;0;0;0;2;4;4;5;0;2;0;2;1;2;9;0;1;0;1;3;1;1;3;1;0;0;1;4;4;2;2;3;0;0;32;0;0;0;0;0;0
2010;C18;Printing and reproduction of recorded media;Imports;0;0;0;0;0;0;0;1;1;0;0;0;0;0;0;0;0;0;0;0;0;0;0;0;0;0;0;0;0;0;0;0;0;0;0;0;0;0;0;0;0;0;0;0;0;0;0;0;0;0;0;0;0;0;0;0;5;0;0;1;0;0;0
2010;C19;Manufacture of coke and refined petroleum products ;Imports;28;0;2;6;17;1;1;1;2;0;4;14;9;26;0;8;3;0;1;0;0;1;0;332;0;4;10;13;13;17;21;7;6;61;3;15;1;3;1;0;5;7;4;5;3;2;0;1;1;3;11;4;14;8;0;0;515;0;0;0;0;0;0
2010;C20;Manufacture of chemicals and chemical products ;Imports;29;0;1;1;9;1;5;5;9;0;9;18;30;11;4;7;6;1;1;0;0;5;1;4;1;2;11;11;1;1;1;1;1;3;0;9;10;1;1;1;3;2;2;3;1;1;0;0;3;4;3;3;6;9;0;0;192;0;0;2;0;0;0
2010;C21;Manufacture of basic pharmaceutical products and pharmaceutical preparations;Imports;1;0;0;0;0;0;0;0;0;0;0;6;1;0;0;0;0;0;0;0;0;0;0;0;0;0;0;0;0;0;1;1;0;1;0;1;0;0;0;0;0;0;0;2;0;0;0;0;3;0;1;1;29;0;0;0;296;0;0;1;0;0;0
2010;C22;Manufacture of rubber and plastic products;Imports;1;0;0;1;19;1;1;1;1;0;1;2;2;11;0;11;1;4;2;1;0;3;1;0;0;0;6;15;7;13;7;3;2;29;0;4;1;2;0;0;0;1;2;2;0;0;0;0;0;1;2;1;2;2;0;0;49;0;0;2;0;0;0
2010;C23;Manufacture of other non-metallic mineral products;Imports;0;0;0;0;3;0;0;0;0;0;0;1;0;41;0;2;2;0;0;0;0;1;0;0;0;0;83;0;1;0;0;0;1;1;0;4;0;0;0;0;1;0;1;2;0;0;0;0;0;0;9;1;1;0;0;0;16;0;0;1;0;0;0
2010;C24;Manufacture of basic metals;Imports;0;0;0;0;1;0;1;1;1;0;0;1;1;5;29;97;6;6;6;2;0;12;3;7;1;0;59;0;3;1;0;0;1;9;0;1;0;0;1;0;1;0;0;1;0;0;0;0;0;0;27;0;0;0;0;0;10;0;2;4;1;0;0
2010;C25;Manufacture of fabricated metal products, except machinery and equipment;Imports;1;0;1;0;11;0;3;0;0;0;0;0;0;6;1;19;9;7;1;1;0;2;2;1;0;1;123;5;0;1;1;0;10;8;0;4;0;0;1;0;0;1;3;0;1;0;0;0;0;1;6;2;2;3;0;0;33;0;18;44;25;0;0
2010;C26;Manufacture of computer, electronic and optical products;Imports;0;0;0;0;1;0;0;0;1;0;0;1;0;0;0;1;23;3;0;0;0;1;1;1;0;0;4;5;2;3;0;0;14;7;0;1;1;1;2;2;1;1;9;3;5;1;0;0;1;1;3;1;4;3;0;0;139;0;0;112;2;0;0
2010;C27;Manufacture of electrical equipment;Imports;0;0;1;0;1;1;1;0;1;0;5;5;2;3;1;7;2;6;1;1;0;1;1;2;0;0;37;32;6;0;6;0;2;1;0;5;0;0;1;1;0;1;2;0;1;0;0;0;0;1;2;1;2;3;0;0;122;0;0;41;15;0;0
2010;C28;Manufacture of machinery and equipment n.e.c.;Imports;1;0;0;1;8;0;0;1;0;0;0;0;0;2;0;3;1;1;4;0;0;2;1;0;1;0;22;7;3;3;7;6;6;12;0;3;1;1;2;1;2;2;1;2;1;1;0;0;1;3;4;2;1;2;0;0;37;0;1;254;5;0;0
2010;C29;Manufacture of motor vehicles, trailers and semi-trailers;Imports;0;0;0;0;3;0;0;0;0;0;0;0;0;2;0;1;0;0;0;0;0;0;0;0;0;1;5;8;1;1;1;1;4;5;0;1;0;0;1;0;0;1;0;1;1;0;0;0;0;1;1;0;1;1;0;0;613;0;0;10;7;0;0
2010;C30;Manufacture of other transport equipment;Imports;0;0;0;0;0;0;0;0;0;0;0;0;0;0;0;0;0;0;0;0;0;0;0;0;0;0;1;1;0;0;0;9;53;0;0;0;0;0;0;0;0;0;0;0;0;0;0;0;0;0;0;0;0;0;0;0;26;0;5;342;3;0;0
2010;C31_C32;"Manufacture of furniture; other manufacturing";Imports;0;0;0;0;1;0;1;0;0;0;0;0;0;0;0;0;0;0;0;0;0;4;0;0;0;0;3;0;2;1;0;0;1;2;0;2;0;0;0;0;1;2;1;4;1;0;0;0;1;0;5;2;6;7;0;0;228;0;0;23;5;0;0
2010;C33;Repair and installation of machinery and equipment;Imports;0;0;0;0;1;0;0;0;0;0;0;0;0;0;0;1;1;0;0;0;0;0;0;0;0;1;4;1;0;0;0;1;3;1;0;0;0;0;1;0;0;3;1;0;0;0;0;0;0;0;3;1;1;1;0;0;4;0;1;6;2;0;0
2010;D35;Electricity, gas, steam and air conditioning supply;Imports;0;0;0;0;0;0;0;0;0;0;0;0;0;0;0;0;0;0;0;0;0;0;0;0;0;0;1;0;0;0;0;0;0;2;0;0;0;0;0;0;0;0;0;0;0;0;0;0;0;0;0;0;0;0;0;0;3;0;0;1;0;0;0
2010;E36;Water collection, treatment and supply;Imports;0;0;0;0;0;0;0;0;0;0;0;0;0;0;0;0;0;0;0;0;0;0;0;0;0;0;0;0;0;0;0;0;0;0;0;0;0;0;0;0;0;0;0;0;0;0;0;0;0;0;0;0;0;0;0;0;0;0;0;1;0;0;0
2010;E37-E39;"Sewerage; waste collection, treatment and disposal activities; materials recovery; remediation activities and other waste management services ";Imports;0;0;0;0;0;0;0;0;0;0;0;0;0;0;0;0;0;0;0;0;0;0;0;0;0;0;0;0;0;0;0;0;0;1;0;0;0;0;0;0;0;0;0;0;0;0;0;0;0;0;0;0;0;0;0;0;1;0;0;0;0;0;0
2010;F;Construction;Imports;0;0;0;0;0;0;0;0;0;0;0;0;0;0;0;0;0;0;0;0;0;0;0;0;0;0;4;0;0;0;0;0;0;2;0;0;0;0;0;0;0;0;0;0;0;0;0;0;0;0;0;0;0;0;0;0;2;0;0;11;1;0;0
2010;G45;Wholesale and retail trade and repair of motor vehicles and motorcycles;Imports;0;0;0;0;1;0;0;0;0;0;0;0;0;0;0;0;0;0;0;0;0;0;0;1;0;0;2;0;0;0;0;1;0;1;0;1;0;0;0;0;0;0;0;0;0;0;0;0;0;0;0;0;1;0;0;0;30;0;0;4;0;0;0
2010;G46;Wholesale trade, except of motor vehicles and motorcycles;Imports;5;0;0;0;11;2;1;1;2;0;1;2;2;4;0;3;3;1;1;0;0;1;0;8;0;1;14;4;4;4;2;7;4;11;0;11;1;1;1;2;1;2;3;2;1;0;0;1;1;1;4;1;6;3;0;0;305;0;4;31;3;0;0
2010;G47;Retail trade, except of motor vehicles and motorcycles;Imports;1;0;0;0;2;0;0;0;0;0;0;0;0;1;0;1;0;0;0;0;0;0;0;3;0;0;4;1;2;2;0;3;1;4;0;3;0;0;0;1;0;1;1;1;1;0;0;0;0;0;1;0;1;1;0;0;61;0;0;6;1;0;0
2010;H49;Land transport and transport via pipelines;Imports;1;0;0;3;2;0;0;0;0;0;0;0;0;3;0;1;0;0;0;0;0;0;0;2;0;0;6;1;10;2;2;21;2;16;0;4;0;0;1;0;1;1;1;1;0;0;0;0;0;1;1;1;1;2;0;0;54;0;0;5;0;0;0
2010;H50;Water transport;Imports;0;0;0;0;0;0;0;0;0;0;0;0;0;0;0;0;0;0;0;0;0;0;0;0;0;0;0;0;0;0;9;93;2;1;0;0;0;0;0;0;0;0;0;15;0;0;0;0;0;0;0;0;20;9;0;0;8;0;0;0;0;0;0
2010;H51;Air transport;Imports;0;0;0;0;1;0;0;0;1;0;0;0;0;0;0;0;0;0;0;0;0;0;0;0;0;1;1;1;5;1;0;1;0;17;0;1;0;5;1;0;2;5;4;5;3;1;0;0;0;1;3;1;2;5;0;0;354;0;0;0;0;0;0
2010;H52;Warehousing and support activities for transportation;Imports;0;0;0;0;0;0;0;0;0;0;0;0;0;0;0;0;0;0;0;0;0;0;0;0;0;0;0;0;3;2;1;286;8;76;0;1;0;0;0;0;0;0;0;0;0;0;0;0;1;0;1;0;0;0;0;0;19;0;0;1;0;0;0
2010;H53;Postal and courier activities;Imports;0;0;0;0;0;0;0;0;0;0;0;0;0;0;0;0;0;0;0;0;0;0;0;0;0;0;0;0;0;0;0;1;0;1;0;0;0;0;0;0;0;0;1;0;0;0;0;0;0;0;0;0;0;0;0;0;2;0;0;0;0;0;0
2010;I;Accommodation and food service activities;Imports;0;0;0;0;1;0;0;0;0;0;0;0;0;1;0;0;0;0;0;0;0;0;0;0;0;0;4;1;4;5;0;1;2;7;0;6;0;0;1;0;1;2;3;1;4;1;0;1;0;1;5;3;1;3;0;0;33;0;0;0;0;0;0
2010;J58;Publishing activities;Imports;0;0;0;0;2;0;0;0;0;0;0;0;0;0;0;0;0;0;0;0;0;0;0;0;0;0;1;1;1;3;0;0;0;1;0;1;1;1;2;2;2;4;2;2;4;0;0;1;0;1;5;3;3;3;0;0;45;0;0;1;0;0;0
2010;J59_J60;"Motion picture, video and television programme production, sound recording and music publishing activities; programming and broadcasting activities";Imports;0;0;0;0;1;0;0;0;0;0;0;0;0;0;0;0;0;0;0;0;0;0;0;0;0;0;0;1;1;1;0;0;0;1;0;1;0;1;1;0;0;1;0;0;0;0;0;0;0;0;1;1;1;3;0;0;24;0;14;0;0;0;0
2010;J61;Telecommunications;Imports;0;0;0;0;1;0;0;0;0;0;0;0;0;0;0;0;0;0;0;0;0;0;0;0;0;0;3;1;1;1;0;2;1;3;0;1;0;1;22;1;1;2;4;1;2;1;0;2;0;1;1;1;1;3;0;0;30;0;0;1;0;0;0
2010;J62_J63;"Computer programming, consultancy and related activities; information service activities";Imports;0;0;0;0;1;0;0;0;0;0;0;0;0;0;0;0;0;0;0;0;0;0;0;0;0;0;0;0;8;8;1;0;0;2;0;0;1;2;17;65;4;16;12;1;8;2;0;8;1;1;5;0;1;3;0;0;6;0;1;41;0;0;0
2010;K64;Financial service activities, except insurance and pension funding;Imports;9;0;1;1;19;1;2;1;1;0;2;2;2;6;1;4;1;1;1;0;0;2;1;10;2;3;35;7;23;22;3;135;4;28;0;26;2;2;7;2;18;7;219;86;7;2;0;2;1;7;1;6;6;7;0;0;80;2;4;1;0;0;0
2010;K65;Insurance, reinsurance and pension funding, except compulsory social security;Imports;2;0;0;0;2;0;1;0;0;0;1;1;1;2;0;2;0;0;0;0;0;1;0;1;0;1;2;2;5;8;3;5;3;4;0;2;0;1;2;1;2;6;2;5;1;0;0;0;0;7;1;1;4;9;0;0;55;0;1;1;0;0;0
2010;K66;Activities auxiliary to financial services and insurance activities;Imports;2;0;0;0;0;0;1;0;0;0;0;0;0;0;0;0;0;0;0;0;0;0;0;0;0;0;15;0;5;6;2;0;0;1;0;0;0;0;3;0;0;0;0;5;0;0;0;0;0;0;4;0;0;0;0;0;23;0;0;0;0;0;0
2010;L68;Real estate activities;Imports;0;0;0;0;0;0;0;0;0;0;0;0;0;0;0;0;0;0;0;0;0;0;0;0;0;0;0;0;0;0;0;0;0;1;0;0;0;0;0;0;0;0;0;0;0;0;0;0;0;0;0;0;0;0;0;0;0;0;0;0;0;0;0
2010;M69_M70;"Legal and accounting activities; activities of head offices; management consultancy activities";Imports;0;0;0;0;1;0;0;0;0;0;0;0;0;0;0;0;0;0;0;0;0;0;0;0;0;0;1;0;2;2;0;2;0;8;0;2;0;0;0;1;12;1;43;2;2;0;0;0;0;0;0;0;0;1;0;0;3;0;0;1;0;0;0
2010;M71;"Architectural and engineering activities; technical testing and analysis";Imports;0;0;0;0;0;0;0;0;0;0;0;0;0;0;0;0;0;0;0;0;0;0;0;0;0;0;0;0;0;0;0;0;0;1;0;0;0;0;0;1;0;0;0;0;0;0;0;0;0;0;0;0;0;0;0;0;1;0;0;1;0;0;0
2010;M72;Scientific research and development;Imports;0;0;0;0;0;0;0;0;0;0;0;0;0;0;0;0;0;0;0;0;0;0;0;0;0;0;0;0;0;0;0;0;0;1;0;0;0;0;0;0;0;0;0;0;0;0;0;0;0;0;0;0;0;0;0;0;2;0;0;0;0;0;0
2010;M73;Advertising and market research;Imports;0;0;0;0;0;0;0;0;0;0;0;0;0;0;0;0;0;0;0;0;0;0;0;0;0;0;1;2;14;15;0;6;0;5;0;1;0;5;1;0;0;1;0;2;0;0;0;7;0;0;1;1;0;1;0;0;2;0;0;0;0;0;0
2010;M74_M75;"Other professional, scientific and technical activities; veterinary activities";Imports;0;0;0;0;0;0;0;0;0;0;0;0;0;0;0;0;0;0;0;0;0;0;0;0;0;0;0;0;0;0;0;0;0;0;0;0;0;0;0;0;0;0;0;0;0;0;0;0;0;0;0;0;0;0;0;0;1;0;0;0;0;0;0
2010;N;Administrative and support service activities;Imports;1;0;0;1;2;0;0;0;0;0;0;0;0;0;0;0;0;0;0;0;0;0;0;1;0;0;9;0;9;6;1;0;12;153;0;28;0;0;3;1;3;3;7;2;2;0;0;1;1;8;2;0;1;6;0;0;26;0;0;1;0;0;0
2010;O84;"Public administration and defence; compulsory social security";Imports;0;0;0;0;0;0;0;0;0;0;0;0;0;0;0;0;0;0;0;0;0;0;0;0;0;0;2;0;5;3;0;2;0;3;0;0;0;0;1;1;0;0;1;0;0;0;0;0;0;0;42;0;2;1;0;0;3;0;27;1;0;0;0
2010;P85;Education;Imports;0;0;0;0;0;0;0;0;0;0;0;0;0;0;0;0;0;0;0;0;0;0;0;0;0;0;0;0;0;0;0;0;0;0;0;0;0;0;0;0;0;0;0;0;0;0;0;0;0;0;0;0;0;0;0;0;1;0;0;0;0;0;0
2010;Q;Human health and social work activities;Imports;0;0;0;0;0;0;0;0;0;0;0;0;0;0;0;0;0;0;0;0;0;0;0;0;0;0;0;0;0;0;0;0;0;0;0;0;0;0;0;0;0;0;0;0;0;0;0;0;0;0;0;0;0;0;0;0;3;0;0;1;0;0;0
2010;R_S;Other service activities;Imports;0;0;0;0;0;0;0;0;0;0;0;0;0;0;0;0;0;0;0;0;0;0;0;0;0;0;0;0;2;2;0;0;0;1;0;9;0;2;0;1;0;0;0;0;1;0;0;0;0;1;1;0;1;2;0;0;148;4;6;0;0;0;0
2010;T;"Activities of households as employers; undifferentiated goods- and services-producing activities of households for own use";Imports;0;0;0;0;0;0;0;0;0;0;0;0;0;0;0;0;0;0;0;0;0;0;0;0;0;0;0;0;0;0;0;0;0;0;0;0;0;0;0;0;0;0;0;0;0;0;0;0;0;0;0;0;0;0;0;0;0;0;0;0;0;0;0
2010;U;Activities of extraterritorial organizations and bodies;Imports;0;0;0;0;0;0;0;0;0;0;0;0;0;0;0;0;0;0;0;0;0;0;0;0;0;0;0;0;0;0;0;0;0;0;0;0;0;0;0;0;0;0;0;0;0;0;0;0;0;0;0;0;0;0;0;0;0;0;0;0;0;0;0
2010;II_fob;Total intermediate consumption;TOT;435;6;20;49;1 245;34;134;43;72;0;53;105;85;412;53;244;80;52;28;13;2;75;24;547;129;120;2 267;261;607;769;178;1 930;335;1 366;20;1 152;70;135;313;136;351;250;1 472;641;196;47;3;140;46;148;644;198;446;374;0;0;16 961;202;4 555;5 252;472;0;0
2010;TXSP;taxes less subsidies on products;TOT;32;0;1;2;-1;3;2;2;3;0;3;7;6;17;2;7;4;2;1;1;0;3;1;117;7;4;77;14;13;16;8;5;7;12;2;96;3;6;10;1;36;11;117;17;9;2;0;2;2;5;21;9;8;13;0;0;1 082;8;20;245;13;0;0
2010;EXP_adj;Cif/ fob adjustments on exports;TOT;0;0;0;0;0;0;0;0;0;0;0;0;0;0;0;0;0;0;0;0;0;0;0;0;0;0;0;0;0;0;0;0;0;0;0;0;0;0;0;0;0;0;0;0;0;0;0;0;0;0;0;0;0;0;0;0;0;0;0;0;0;0;0
2010;PURR;Direct purchases abroad by residents;TOT;0;0;0;0;0;0;0;0;0;0;0;0;0;0;0;0;0;0;0;0;0;0;0;0;0;0;0;0;0;0;0;0;0;0;0;0;0;0;0;0;0;0;0;0;0;0;0;0;0;0;0;0;0;0;0;0;0;0;0;0;0;0;0
2010;PURNR;Purchases on the domestic territory by non-residents ;TOT;0;0;0;0;0;0;0;0;0;0;0;0;0;0;0;0;0;0;0;0;0;0;0;0;0;0;0;0;0;0;0;0;0;0;0;0;0;0;0;0;0;0;0;0;0;0;0;0;0;0;0;0;0;0;0;0;-2 104;0;0;0;0;0;0
2010;VA;Value added at basic prices;TOT;500;22;20;62;466;28;88;27;56;0;37;74;54;172;36;131;0;29;27;9;1;67;26;386;83;106;1 865;268;1 114;1 949;188;627;26;688;82;1 280;105;86;508;200;1 439;146;125;2 688;1 062;209;9;72;65;262;2 388;1 362;845;698;228;0;0;0;0;0;0;0;0
2010;IntTTM;International Transport Margins;TOT;8;0;0;1;15;1;2;2;3;0;2;4;3;8;2;10;4;2;1;0;0;2;1;27;0;1;27;8;3;4;3;2;7;10;0;13;2;1;1;0;1;1;2;2;1;0;0;0;1;1;6;2;6;3;0;0;264;0;2;47;4;0;0
2010;GO;Output at basic prices;TOT;975;28;43;114;1 725;66;227;74;133;0;95;190;148;609;93;392;87;85;57;23;4;147;52;1 077;219;230;4 236;550;1 738;2 738;377;2 565;375;2 077;104;2 541;180;228;833;338;1 828;408;1 716;3 349;1 269;259;12;214;114;416;3 059;1 571;1 304;1 088;228;0;0;0;0;0;0;0;0
2011;A01;Crop and animal production, hunting and related service activities;Domestic;87;0;0;0;426;0;0;0;0;0;2;0;0;0;0;0;0;0;0;0;0;0;0;0;0;0;1;0;0;0;0;0;0;0;0;58;0;0;0;0;0;0;0;0;0;0;0;0;0;0;6;0;3;2;0;0;430;0;1;-29;-8;118;1 100
2011;A02;Forestry and logging;Domestic;0;1;0;0;1;0;0;0;0;0;0;0;0;0;0;0;0;0;0;0;0;0;0;0;0;0;0;0;0;0;0;0;0;0;0;0;0;0;0;0;0;0;0;0;0;0;0;0;0;0;0;0;0;1;0;0;2;0;22;0;0;1;28
2011;A03;Fishing and aquaculture;Domestic;0;0;3;0;20;0;0;0;0;0;0;0;0;0;0;0;0;0;0;0;0;0;0;0;0;0;0;0;0;0;0;0;0;0;0;19;0;0;0;0;0;0;0;0;0;0;0;0;0;0;0;0;4;0;0;0;1;0;0;0;-31;29;46
2011;B;Mining and quarrying;Domestic;0;0;0;1;0;0;0;0;0;0;2;1;0;35;0;0;0;0;0;0;0;0;0;0;0;0;49;0;0;0;0;0;0;0;0;0;0;0;0;0;0;0;0;0;0;0;0;0;0;0;1;0;0;1;0;0;5;0;0;-1;0;16;113
2011;C10-C12;Manufacture of food products, beverages and tobacco products;Domestic;124;0;0;0;52;0;0;0;0;0;2;2;0;0;0;0;0;0;0;0;0;0;0;0;0;0;0;0;1;2;0;1;0;0;0;390;0;2;3;0;0;0;0;0;0;0;0;0;0;0;10;6;9;9;0;0;1 408;0;0;1;-129;14;1 910
2011;C13-C15;Manufacture of textiles, wearing apparel and leather products;Domestic;0;0;0;0;0;6;1;0;1;0;0;0;0;0;0;0;0;0;0;0;0;1;0;0;0;0;1;0;1;1;0;0;0;0;0;7;0;0;0;0;0;0;0;0;0;0;0;0;0;0;1;0;2;1;0;0;279;0;0;-6;-240;6;67
2011;C16;"Manufacture of wood and of products of wood and cork, except furniture; manufacture of articles of straw and plaiting materials";Domestic;1;0;0;0;25;0;43;0;0;0;0;0;0;1;0;1;0;0;0;0;0;4;0;0;0;0;72;1;4;4;0;0;0;6;0;14;0;2;0;0;0;0;0;6;0;0;0;0;0;0;6;0;1;2;0;0;29;0;0;-6;0;11;229
2011;C17;Manufacture of paper and paper products;Domestic;0;0;0;0;1;0;0;8;11;0;0;0;0;0;0;0;0;0;0;0;0;0;0;0;0;0;1;2;2;2;0;1;0;1;0;1;5;0;0;0;0;1;0;0;1;0;0;0;0;2;2;1;1;1;0;0;47;0;0;0;-22;0;75
2011;C18;Printing and reproduction of recorded media;Domestic;0;0;0;0;2;0;0;0;7;0;0;7;2;0;0;0;0;0;0;0;0;0;0;0;0;25;1;8;4;5;0;1;0;1;1;7;19;3;1;0;2;3;4;2;1;0;0;4;1;1;5;6;1;7;0;0;16;0;0;0;-8;0;145
2011;C19;Manufacture of coke and refined petroleum products ;Domestic;9;0;1;2;7;0;0;0;1;0;1;5;3;8;0;2;1;0;0;0;0;0;0;164;0;1;3;4;4;5;6;3;2;22;1;5;0;1;0;0;2;2;1;1;1;0;0;0;0;1;4;1;4;3;0;0;400;0;0;0;-684;5;5
2011;C20;Manufacture of chemicals and chemical products ;Domestic;3;0;0;0;1;0;0;1;1;0;1;2;3;1;0;1;0;0;0;0;0;0;0;0;0;0;2;1;0;0;0;0;0;0;0;1;1;0;0;0;0;0;0;0;0;0;0;0;0;0;0;0;1;1;0;0;119;0;0;1;-70;20;94
2011;C21;Manufacture of basic pharmaceutical products and pharmaceutical preparations;Domestic;0;0;0;0;0;0;0;0;0;0;0;5;0;0;0;0;0;0;0;0;0;0;0;0;0;0;0;0;0;0;0;0;0;0;0;0;0;0;0;0;0;0;0;1;0;0;0;0;2;0;1;0;25;0;0;0;76;0;0;-6;-9;118;215
2011;C22;Manufacture of rubber and plastic products;Domestic;1;0;0;1;15;0;1;0;0;0;1;2;1;8;0;8;0;2;1;0;0;2;1;0;0;0;4;12;5;9;5;2;1;23;0;3;0;1;0;0;0;0;1;2;0;0;0;0;0;0;1;1;1;2;0;0;22;0;1;-7;3;14;151
2011;C23;Manufacture of other non-metallic mineral products;Domestic;1;0;0;0;15;0;1;0;0;0;0;2;1;162;0;6;5;0;1;0;0;2;1;2;1;0;317;0;2;1;0;0;3;1;0;17;0;0;0;0;2;0;6;7;2;0;0;0;0;0;37;2;5;1;0;0;50;0;0;-38;-5;7;618
2011;C24;Manufacture of basic metals;Domestic;0;0;0;0;0;0;0;0;0;0;0;0;0;1;8;19;1;1;1;0;0;2;1;2;0;0;10;0;1;0;0;0;0;2;0;0;0;0;0;0;0;0;0;0;0;0;0;1;0;0;5;0;0;0;0;0;4;0;0;-18;13;73;130
2011;C25;Manufacture of fabricated metal products, except machinery and equipment;Domestic;1;0;1;0;8;0;2;0;0;0;0;0;0;4;1;11;4;3;1;0;0;1;1;1;0;0;79;3;0;0;0;0;6;5;0;3;0;0;0;0;0;1;3;0;0;0;0;0;0;1;4;2;2;2;0;0;96;0;68;58;6;19;402
2011;C26;Manufacture of computer, electronic and optical products;Domestic;0;0;0;0;0;0;0;0;0;0;0;0;0;0;0;0;1;0;0;0;0;0;0;0;0;0;0;0;0;0;0;0;1;0;0;0;0;0;0;0;0;0;1;0;0;0;0;0;0;0;0;0;0;0;0;0;8;0;0;6;-20;71;71
2011;C27;Manufacture of electrical equipment;Domestic;0;0;0;0;0;0;0;0;0;0;1;1;0;0;0;1;0;1;0;0;0;0;0;0;0;0;6;4;1;0;1;0;0;0;0;1;0;0;0;0;0;0;0;0;0;0;0;0;0;0;0;0;0;0;0;0;17;0;1;4;0;25;68
2011;C28;Manufacture of machinery and equipment n.e.c.;Domestic;0;0;0;0;1;0;0;0;0;0;0;0;0;0;0;0;0;0;0;0;0;0;0;0;0;0;2;1;0;0;0;0;0;1;0;0;0;0;0;0;0;1;0;0;0;0;0;0;0;0;1;0;0;0;0;0;3;0;0;14;-3;43;70
2011;C29;Manufacture of motor vehicles, trailers and semi-trailers;Domestic;0;0;0;0;0;0;0;0;0;0;0;0;0;0;0;0;0;0;0;0;0;0;0;0;0;0;0;1;0;0;0;0;0;0;0;0;0;0;0;0;0;0;0;0;0;0;0;0;0;0;0;0;0;0;0;0;50;0;0;-42;0;13;24
2011;C30;Manufacture of other transport equipment;Domestic;0;0;0;0;0;0;0;0;0;0;0;0;0;0;0;0;0;0;0;0;0;0;0;0;0;0;0;0;0;0;0;0;0;0;0;0;0;0;0;0;0;0;0;0;0;0;0;0;0;0;0;0;0;0;0;0;0;0;0;0;0;4;4
2011;C31_C32;"Manufacture of furniture; other manufacturing";Domestic;0;0;0;0;3;0;6;0;0;0;0;0;0;0;0;0;0;0;0;0;0;1;0;0;0;0;10;0;1;1;0;0;0;1;0;3;0;0;0;0;0;1;0;2;0;0;0;0;0;0;2;1;2;2;0;0;70;0;0;2;-8;32;134
2011;C33;Repair and installation of machinery and equipment;Domestic;0;0;0;0;1;0;1;1;0;0;1;0;0;0;0;0;1;0;0;0;0;0;0;1;0;1;2;1;1;0;0;0;1;2;0;0;1;0;1;0;1;5;2;0;1;0;0;0;1;1;6;1;1;1;0;0;1;0;0;0;1;13;57
2011;D35;Electricity, gas, steam and air conditioning supply;Domestic;30;0;5;8;39;0;1;1;4;2;2;2;8;25;2;4;0;0;1;0;0;3;0;1;70;7;7;13;24;8;1;0;3;72;1;80;4;35;16;1;5;19;17;6;14;2;0;1;2;7;29;8;28;26;0;0;390;0;0;260;0;0;1 298
2011;E36;Water collection, treatment and supply;Domestic;4;0;0;0;2;0;0;0;0;0;0;0;0;0;0;0;0;0;0;0;0;0;0;0;41;0;1;1;1;2;0;0;1;3;0;1;0;0;0;0;0;0;4;1;0;0;0;0;1;1;57;1;5;3;0;0;99;0;0;0;0;2;236
2011;E37-E39;"Sewerage; waste collection, treatment and disposal activities; materials recovery; remediation activities and other waste management services ";Domestic;0;0;0;0;5;0;0;0;0;0;0;0;2;1;2;2;0;0;0;0;0;1;0;2;2;23;3;3;4;2;0;0;0;0;0;13;0;0;5;0;0;0;0;6;1;2;0;67;0;2;4;5;5;0;0;0;8;0;0;0;-8;88;254
2011;F;Construction;Domestic;5;1;3;1;10;1;3;1;2;0;1;3;2;4;1;2;0;0;1;1;0;2;1;5;11;5;753;7;31;28;1;0;2;47;0;60;2;3;5;0;6;20;11;98;5;3;0;0;2;5;44;28;12;12;0;0;46;0;0;2 687;42;75;4 101
2011;G45;Wholesale and retail trade and repair of motor vehicles and motorcycles;Domestic;4;0;0;1;3;0;1;1;1;0;1;0;1;6;0;2;0;1;1;0;0;1;0;3;0;3;15;17;11;4;13;11;54;18;1;5;1;1;1;0;2;1;0;3;1;1;0;0;1;4;4;2;1;2;0;0;374;0;0;0;0;0;578
2011;G46;Wholesale trade, except of motor vehicles and motorcycles;Domestic;0;0;0;0;152;0;0;0;0;0;0;0;0;0;0;0;0;0;0;0;0;0;0;0;0;0;2;0;2;4;0;153;0;168;0;2;0;0;1;2;0;1;24;1;0;0;0;0;0;0;1;0;37;8;0;0;50;3;37;315;452;437;1 856
2011;G47;Retail trade, except of motor vehicles and motorcycles;Domestic;1;0;0;4;238;1;0;0;1;0;0;1;0;2;0;1;0;0;0;0;0;1;0;2;0;2;3;2;17;25;2;41;4;116;1;12;0;2;2;5;2;5;40;5;3;1;0;1;1;2;4;2;60;15;0;0;336;5;63;478;667;735;2 911
2011;H49;Land transport and transport via pipelines;Domestic;3;0;0;10;2;1;1;0;0;0;0;0;0;4;0;0;0;0;0;0;0;1;0;3;0;0;6;1;32;6;6;44;4;42;1;8;0;1;2;0;2;2;3;2;1;1;0;0;1;3;1;1;1;6;0;0;82;0;0;0;0;73;361
2011;H50;Water transport;Domestic;1;0;0;2;5;0;0;0;0;0;0;0;0;0;0;1;0;0;0;0;0;0;0;5;0;1;17;1;5;8;7;68;20;12;0;21;0;1;4;0;9;3;15;18;8;2;0;4;2;15;15;8;28;16;0;0;58;0;0;0;0;2 278;2 664
2011;H51;Air transport;Domestic;0;0;0;0;0;0;0;0;0;0;0;0;0;0;0;0;0;0;0;0;0;0;0;0;0;0;0;0;1;0;0;0;0;4;0;0;0;1;0;0;0;1;1;1;1;0;0;0;0;0;1;0;0;1;0;0;95;0;0;0;0;246;358
2011;H52;Warehousing and support activities for transportation;Domestic;1;0;0;0;0;0;0;0;0;0;0;0;0;0;0;0;0;0;0;0;0;0;0;1;0;0;0;1;7;5;1;813;18;217;0;1;0;0;0;0;0;0;0;0;0;0;0;0;2;1;1;0;0;0;0;0;33;0;0;1;0;1 027;2 132
2011;H53;Postal and courier activities;Domestic;0;0;0;0;1;0;0;0;0;0;0;0;0;0;0;0;0;0;0;0;0;0;0;0;0;0;1;1;2;2;0;0;0;2;1;1;0;0;0;0;1;3;6;1;2;1;0;0;0;1;4;2;1;1;0;0;32;0;0;2;0;24;99
2011;I;Accommodation and food service activities;Domestic;0;0;0;0;6;0;0;1;2;0;1;2;0;3;0;1;0;0;0;0;0;1;1;1;0;1;20;6;23;30;1;5;8;36;1;30;2;2;6;1;9;11;17;6;19;3;0;3;2;6;24;15;7;18;0;0;2 493;1;0;2;0;12;2 839
2011;J58;Publishing activities;Domestic;0;0;0;0;1;0;0;0;0;0;0;0;0;0;0;0;0;0;0;0;0;0;0;0;0;0;1;1;0;1;0;0;0;0;0;1;1;0;1;0;1;2;1;1;3;0;0;0;0;1;3;2;2;2;0;0;138;0;0;8;1;11;185
2011;J59_J60;"Motion picture, video and television programme production, sound recording and music publishing activities; programming and broadcasting activities";Domestic;0;0;0;0;9;0;0;0;0;0;1;0;0;0;0;1;0;0;0;0;0;1;0;1;0;0;2;6;3;4;1;0;1;3;0;7;1;8;4;0;3;10;2;3;2;0;0;0;0;1;10;5;6;25;0;0;62;0;38;14;0;5;245
2011;J61;Telecommunications;Domestic;0;0;0;0;3;0;1;0;0;0;0;0;1;1;0;1;0;0;0;0;0;1;0;1;0;1;12;3;4;4;1;8;4;10;0;5;1;3;102;3;5;8;17;4;8;6;0;7;0;3;5;4;4;16;0;0;559;0;0;1;0;89;910
2011;J62_J63;"Computer programming, consultancy and related activities; information service activities";Domestic;0;0;0;0;0;0;0;0;0;0;0;0;0;0;0;0;0;0;0;0;0;0;0;0;0;0;0;0;2;3;0;0;0;0;0;0;0;1;5;20;1;5;4;0;2;1;0;2;0;0;1;0;0;1;0;0;5;0;1;15;0;289;362
2011;K64;Financial service activities, except insurance and pension funding;Domestic;9;0;1;1;21;1;2;1;1;0;1;3;2;6;1;4;1;1;1;0;0;1;1;15;2;3;28;7;21;19;3;145;3;29;0;26;2;2;6;1;21;7;245;85;7;2;0;2;1;7;0;6;5;6;0;0;73;2;4;0;0;1 311;2 156
2011;K65;Insurance, reinsurance and pension funding, except compulsory social security;Domestic;5;0;1;1;6;0;2;1;1;0;1;2;2;3;0;4;0;0;0;0;0;1;0;3;1;1;3;6;11;18;7;12;7;10;1;5;0;1;3;0;5;13;6;12;3;1;0;0;1;17;2;3;9;21;0;0;157;0;3;0;0;74;447
2011;K66;Activities auxiliary to financial services and insurance activities;Domestic;48;0;0;0;0;0;28;0;0;0;0;0;0;0;0;0;0;0;0;0;0;0;0;0;0;0;340;0;130;148;36;0;0;0;1;5;0;0;63;9;1;2;2;124;1;0;0;1;0;0;107;0;7;9;0;0;128;0;0;5;0;839;2 033
2011;L68;Real estate activities;Domestic;0;0;0;2;28;0;0;0;3;0;3;10;1;9;0;9;1;0;1;0;0;2;0;4;0;22;8;18;49;231;3;2;22;24;1;82;1;14;5;1;8;25;14;45;17;2;0;2;3;10;34;17;35;28;0;0;2 742;1;0;7;0;55;3 599
2011;M69_M70;"Legal and accounting activities; activities of head offices; management consultancy activities";Domestic;0;0;0;1;6;1;2;1;2;0;1;1;1;1;6;4;0;1;0;1;0;1;0;2;0;3;16;5;24;26;2;25;1;17;1;30;2;4;2;1;278;10;908;24;26;3;0;1;1;4;5;6;3;10;0;0;20;0;0;0;0;67;1 556
