Year;Code;Description;Origin;A01;A02;A03;B;C10-C12;C13-C15;C16;C17;C18;C19;C20;C21;C22;C23;C24;C25;C26;C27;C28;C29;C30;C31_C32;C33;D35;E36;E37-E39;F;G45;G46;G47;H49;H50;H51;H52;H53;I;J58;J59_J60;J61;J62_J63;K64;K65;K66;L68;M69_M70;M71;M72;M73;M74_M75;N;O84;P85;Q;R_S;T;U;CONS_h;CONS_np;CONS_g;GFCF;INVEN;EXP;GO
2003;D35;Electricity, gas, steam and air conditioning supply;Imports;2;0;0;2;3;8;1;3;1;10;4;0;3;6;10;2;1;1;3;1;0;1;0;72;1;0;3;3;3;3;1;0;0;0;0;4;0;0;2;0;1;0;0;1;0;0;0;0;0;1;7;2;2;2;0;0;20;0;0;3;0;0;0
2003;E36;Water collection, treatment and supply;Imports;0;0;0;0;0;0;0;0;0;0;0;0;0;0;0;0;0;0;0;0;0;0;0;1;0;0;0;0;0;0;1;0;0;0;0;0;0;0;0;0;0;0;0;0;0;0;0;0;0;0;0;0;0;0;0;0;1;0;0;0;0;0;0
2003;E37-E39;"Sewerage; waste collection, treatment and disposal activities; materials recovery; remediation activities and other waste management services ";Imports;1;0;0;0;1;4;0;0;0;0;4;0;3;1;9;4;1;1;4;2;0;3;0;0;0;0;4;0;0;0;1;0;0;0;0;0;0;0;0;0;0;0;0;0;0;0;0;0;0;0;0;0;1;0;0;0;2;0;0;1;0;0;0
2003;F;Construction;Imports;1;0;0;0;1;1;0;0;0;4;2;0;0;2;1;1;0;1;3;1;0;0;0;3;0;0;4;0;0;1;1;0;0;0;0;0;0;0;0;0;0;0;0;1;0;0;0;0;0;0;1;0;0;0;0;0;2;0;0;33;0;0;0
2003;G45;Wholesale and retail trade and repair of motor vehicles and motorcycles;Imports;2;0;0;0;2;4;0;1;0;0;3;0;2;1;1;1;2;1;1;4;0;1;0;0;0;0;2;1;1;1;2;0;0;0;0;0;0;0;1;0;0;0;0;1;0;0;0;0;0;0;1;0;1;0;0;0;10;0;1;11;0;0;0
2003;G46;Wholesale trade, except of motor vehicles and motorcycles;Imports;33;0;0;14;48;119;8;17;6;332;123;0;33;106;76;17;33;17;28;19;2;15;0;193;1;1;75;8;16;25;17;2;2;5;0;13;0;0;13;1;3;0;0;13;0;0;0;0;8;3;17;5;11;5;0;0;105;0;3;216;3;0;0
2003;G47;Retail trade, except of motor vehicles and motorcycles;Imports;9;0;0;1;15;35;1;3;2;1;14;0;8;3;5;3;9;4;6;5;0;3;0;1;0;0;8;1;1;2;4;0;0;1;0;4;0;0;3;0;0;0;0;3;0;0;0;0;2;1;4;1;3;1;0;0;41;0;1;44;1;0;0
2003;H49;Land transport and transport via pipelines;Imports;21;0;0;12;57;64;5;12;3;309;86;0;12;98;61;11;9;8;12;14;1;10;0;177;1;0;60;13;32;48;104;7;2;28;0;16;0;0;5;1;3;0;0;8;0;0;0;0;5;3;16;5;5;4;0;0;264;0;1;15;1;0;0
2003;H50;Water transport;Imports;19;0;1;3;30;24;3;4;2;47;33;0;12;12;33;15;2;5;18;12;3;13;0;27;1;0;36;49;136;317;72;116;3;4;0;9;0;0;2;0;2;0;0;7;0;0;0;0;3;2;53;2;2;4;0;0;102;0;1;62;11;0;0
2003;H51;Air transport;Imports;0;0;0;0;0;2;0;0;0;0;1;0;0;0;1;0;0;0;1;1;0;0;0;0;0;0;1;1;11;3;16;2;10;5;0;0;0;0;7;0;0;0;0;0;0;0;0;0;1;1;26;1;0;2;0;0;51;0;0;0;0;0;0
2003;H52;Warehousing and support activities for transportation;Imports;2;0;0;1;4;6;0;1;1;3;3;0;1;2;3;1;1;1;2;1;0;1;0;1;0;0;3;3;8;13;34;8;5;24;0;2;0;0;2;0;0;0;0;1;0;0;0;0;1;2;5;1;3;1;0;0;58;0;1;5;0;0;0
2003;H53;Postal and courier activities;Imports;0;0;0;0;0;0;0;0;0;0;0;0;0;0;0;0;0;0;0;0;0;0;0;0;0;0;0;0;0;0;0;0;0;0;0;0;0;0;0;0;0;0;0;0;0;0;0;0;0;0;0;0;0;0;0;0;1;0;0;0;0;0;0
2003;I;Accommodation and food service activities;Imports;1;0;0;0;3;0;0;0;0;0;0;0;0;0;0;0;0;0;0;0;0;0;0;0;0;0;0;0;0;0;0;0;0;0;0;1;0;0;0;0;0;0;0;0;0;0;0;0;0;0;0;0;0;0;0;0;5;0;1;1;0;0;0
2003;J58;Publishing activities;Imports;0;0;0;0;0;0;0;0;0;0;0;0;0;0;0;0;0;0;0;0;0;0;0;0;0;0;0;0;1;0;0;0;0;0;0;0;0;0;0;0;0;0;0;0;0;0;0;0;0;0;0;0;0;0;0;0;1;0;0;1;0;0;0
2003;J59_J60;"Motion picture, video and television programme production, sound recording and music publishing activities; programming and broadcasting activities";Imports;0;0;0;0;0;0;0;0;0;0;0;0;0;0;0;0;0;0;0;0;0;0;0;0;0;0;0;0;0;0;0;0;0;0;0;0;0;0;0;0;0;0;0;0;0;0;0;0;0;0;0;0;0;0;0;0;1;0;0;1;0;0;0
2003;J61;Telecommunications;Imports;0;0;0;0;1;2;0;0;0;0;1;0;0;0;0;0;5;1;1;0;0;0;0;0;0;0;1;3;9;10;4;0;0;2;0;1;0;0;9;0;3;0;0;0;0;0;0;0;2;1;4;1;1;1;0;0;31;0;0;7;0;0;0
2003;J62_J63;"Computer programming, consultancy and related activities; information service activities";Imports;0;0;0;0;0;1;0;0;0;0;0;0;0;0;0;0;8;1;1;0;0;0;0;0;0;0;0;0;1;1;0;0;0;0;0;0;0;0;4;0;1;0;0;0;0;0;0;0;1;1;4;1;1;0;0;0;10;0;0;7;0;0;0
2003;K64;Financial service activities, except insurance and pension funding;Imports;37;0;0;3;6;39;1;2;2;3;19;0;10;10;6;4;3;4;4;2;2;2;0;2;1;0;20;9;18;21;40;2;36;7;0;13;0;0;18;1;46;4;6;5;0;0;0;0;5;11;39;5;4;9;0;0;251;0;1;1;0;0;0
2003;K65;Insurance, reinsurance and pension funding, except compulsory social security;Imports;11;0;0;4;9;20;1;3;1;4;7;0;4;6;5;2;1;2;5;4;1;1;0;23;0;0;9;3;12;26;10;8;9;12;0;6;0;0;4;0;7;1;7;10;0;0;0;0;4;19;13;2;3;2;0;0;147;0;0;1;0;0;0
2003;K66;Activities auxiliary to financial services and insurance activities;Imports;0;0;0;0;0;0;0;0;0;0;0;0;0;0;0;0;0;0;0;0;0;0;0;0;0;0;0;0;0;0;0;0;0;0;0;0;0;0;0;0;0;0;0;0;0;0;0;0;0;0;0;0;0;0;0;0;2;0;0;0;0;0;0
2003;L68;Real estate activities;Imports;0;0;0;0;0;0;0;0;0;0;0;0;0;0;0;0;0;0;0;0;0;0;0;0;0;0;0;0;0;0;0;0;0;0;0;0;0;0;0;0;0;0;0;0;0;0;0;0;0;0;0;0;0;0;0;0;0;0;0;1;0;0;0
2003;M69_M70;"Legal and accounting activities; activities of head offices; management consultancy activities";Imports;0;0;0;0;0;0;0;0;0;0;0;0;0;0;0;0;0;0;0;0;0;0;0;0;0;0;0;0;0;0;0;0;0;0;0;0;0;0;0;0;0;0;0;0;0;0;0;0;0;0;0;0;0;0;0;0;1;0;0;2;0;0;0
2003;M71;"Architectural and engineering activities; technical testing and analysis";Imports;0;0;0;0;0;1;0;0;0;0;0;0;0;0;0;0;0;0;1;0;0;0;0;0;0;0;1;0;1;0;0;0;0;0;0;0;0;0;1;0;0;0;0;0;0;0;0;0;0;0;1;0;0;0;0;0;1;0;0;8;0;0;0
2003;M72;Scientific research and development;Imports;0;0;0;0;0;1;0;0;0;0;1;0;0;0;0;0;1;0;0;0;0;0;0;0;0;0;1;1;1;1;0;0;0;0;0;0;0;0;1;0;1;0;0;0;0;0;0;0;0;0;1;0;0;0;0;0;1;0;0;2;0;0;0
2003;M73;Advertising and market research;Imports;0;0;0;0;0;0;0;0;0;0;0;0;0;0;0;0;0;0;0;0;0;0;0;0;0;0;0;0;0;0;0;0;0;0;0;0;0;0;0;0;0;0;0;0;0;0;0;0;0;0;0;0;0;0;0;0;0;0;0;0;0;0;0
2003;M74_M75;"Other professional, scientific and technical activities; veterinary activities";Imports;0;0;0;2;8;9;1;2;4;1;12;0;3;2;2;1;1;1;4;4;0;3;0;2;1;0;12;23;42;21;8;0;1;7;0;6;0;0;36;4;20;1;1;5;0;0;0;0;10;5;20;9;10;18;0;0;46;0;0;1;0;0;0
2003;N;Administrative and support service activities;Imports;2;0;0;1;2;5;0;1;1;0;4;0;2;1;1;1;0;0;1;1;0;1;0;0;0;0;2;3;3;2;3;0;0;1;0;1;0;0;2;0;1;0;0;1;0;0;0;0;1;4;2;1;1;1;0;0;13;0;0;2;0;0;0
2003;O84;"Public administration and defence; compulsory social security";Imports;1;0;0;0;2;2;1;1;0;1;1;0;0;0;0;0;0;0;0;0;0;0;0;1;0;0;1;0;1;1;1;0;0;1;0;1;0;0;1;0;0;0;0;0;0;0;0;0;0;0;3;1;0;1;0;0;17;0;537;4;0;0;0
2003;P85;Education;Imports;0;0;0;0;0;0;0;0;0;0;0;0;0;0;0;0;0;0;0;0;0;0;0;0;0;0;0;0;0;0;0;0;0;0;0;0;0;0;0;0;0;0;0;0;0;0;0;0;0;0;0;0;0;0;0;0;1;0;1;3;0;0;0
2003;Q;Human health and social work activities;Imports;0;0;0;0;0;0;0;0;0;0;0;0;0;0;0;0;0;0;0;0;0;0;0;0;0;0;0;0;0;0;0;0;0;0;0;0;0;0;0;0;0;0;0;0;0;0;0;0;0;0;0;0;0;0;0;0;2;0;0;2;0;0;0
2003;R_S;Other service activities;Imports;0;0;0;0;0;2;0;0;0;0;0;0;0;0;0;0;3;0;0;0;0;0;0;0;0;0;0;0;0;0;0;0;0;0;0;0;0;0;1;0;0;0;0;0;0;0;0;0;0;0;0;0;0;0;0;0;204;0;83;4;0;0;0
2003;T;"Activities of households as employers; undifferentiated goods- and services-producing activities of households for own use";Imports;0;0;0;0;0;0;0;0;0;0;0;0;0;0;0;0;0;0;0;0;0;0;0;0;0;0;0;0;0;0;0;0;0;0;0;0;0;0;0;0;0;0;0;0;0;0;0;0;0;0;0;0;0;0;0;0;0;0;0;0;0;0;0
2003;U;Activities of extraterritorial organizations and bodies;Imports;0;0;0;0;0;0;0;0;0;0;0;0;0;0;0;0;0;0;0;0;0;0;0;0;0;0;0;0;0;0;0;0;0;0;0;0;0;0;0;0;0;0;0;0;0;0;0;0;0;0;0;0;0;0;0;0;0;0;0;0;0;0;0
2003;II_fob;Total intermediate consumption;TOT;15 557;136;171;1 984;32 163;39 653;1 735;3 315;2 125;6 680;10 380;0;5 511;5 947;10 028;4 351;3 631;3 469;6 409;7 156;578;4 998;0;10 080;479;239;15 390;4 963;9 276;9 956;19 336;1 837;2 815;6 489;0;7 957;0;0;4 899;424;5 354;298;433;4 745;0;0;3;0;3 198;3 346;9 366;2 124;4 260;4 069;0;0;180 461;0;35 299;50 584;1 694;0;0
2003;TXSP;taxes less subsidies on products;TOT;1 851;13;19;181;303;559;18;50;12;537;216;0;86;141;141;81;34;28;79;44;9;30;0;79;8;1;661;168;302;304;2 797;203;353;149;0;260;0;0;90;5;226;7;12;157;0;0;0;0;67;188;280;79;48;82;0;0;27 695;0;195;507;0;0;0
2003;EXP_adj;Cif/ fob adjustments on exports;TOT;0;0;0;0;0;0;0;0;0;0;0;0;0;0;0;0;0;0;0;0;0;0;0;0;0;0;0;0;0;0;0;0;0;0;0;0;0;0;0;0;0;0;0;0;0;0;0;0;0;0;0;0;0;0;0;0;0;0;0;0;0;0;0
2003;PURR;Direct purchases abroad by residents;TOT;0;0;0;0;0;0;0;0;0;0;0;0;0;0;0;0;0;0;0;0;0;0;0;0;0;0;0;0;0;0;0;0;0;0;0;0;0;0;0;0;0;0;0;0;0;0;0;0;0;0;0;0;0;0;0;0;2 113;0;0;0;0;0;0
2003;PURNR;Purchases on the domestic territory by non-residents ;TOT;0;0;0;0;0;0;0;0;0;0;0;0;0;0;0;0;0;0;0;0;0;0;0;0;0;0;0;0;0;0;0;0;0;0;0;0;0;0;0;0;0;0;0;0;0;0;0;0;0;0;0;0;0;0;0;0;-16 694;0;0;0;0;0;0
2003;VA;Value added at basic prices;TOT;28 955;818;545;3 048;9 507;14 519;587;1 236;1 365;1 070;4 165;0;2 014;3 453;3 115;1 858;1 052;1 434;3 900;2 267;546;1 635;0;4 578;2 081;248;12 363;6 537;14 774;15 837;25 879;2 690;1 223;5 594;0;6 581;0;0;6 038;813;9 603;525;314;25 862;0;0;4;0;6 120;4 871;13 975;8 450;4 583;4 863;436;0;0;0;0;0;0;0;0
2003;IntTTM;International Transport Margins;TOT;160;1;1;26;221;487;24;50;25;239;258;0;132;105;272;110;115;70;149;175;9;102;0;140;7;2;212;31;34;42;127;10;12;14;0;44;0;0;38;4;10;1;1;42;0;0;0;0;35;13;59;13;39;12;0;0;422;0;6;877;8;0;0
2003;GO;Output at basic prices;TOT;46 523;967;736;5 239;42 194;55 218;2 364;4 650;3 527;8 525;15 020;0;7 742;9 646;13 557;6 399;4 833;5 002;10 537;9 642;1 142;6 766;0;14 878;2 575;491;28 626;11 700;24 384;26 140;48 138;4 741;4 402;12 245;0;14 842;0;0;11 064;1 245;15 193;832;761;30 806;0;0;7;0;9 419;8 418;23 680;10 666;8 931;9 026;436;0;0;0;0;0;0;0;0
2004;A01;Crop and animal production, hunting and related service activities;Domestic;8 159;2;3;4;18 745;1 771;8;14;4;18;412;0;54;9;4;5;3;6;9;4;1;4;0;0;1;1;9;14;29;14;3;26;3;5;0;1 682;0;0;2;1;2;0;1;14;0;0;0;0;29;6;331;12;85;12;0;0;21 049;0;89;46;544;3 527;56 776
2004;A02;Forestry and logging;Domestic;2;11;0;27;30;2;337;174;0;0;1;0;0;3;1;0;0;0;1;0;0;0;0;0;0;0;2;8;2;53;0;0;0;2;0;48;0;0;0;0;0;0;0;6;0;0;0;0;1;1;0;4;7;1;0;0;410;0;4;1;20;18;1 181
2004;A03;Fishing and aquaculture;Domestic;0;0;18;0;95;0;0;0;0;0;0;0;0;0;0;0;0;0;0;0;0;0;0;0;0;0;0;0;0;0;0;0;0;0;0;155;0;0;0;0;0;0;0;0;0;0;0;0;0;0;7;1;3;0;0;0;478;0;0;0;3;138;898
2004;B;Mining and quarrying;Domestic;13;0;0;65;57;59;14;38;1;1 792;410;0;9;554;298;22;8;5;11;12;0;5;0;1 005;0;0;254;28;76;121;3;0;0;1;0;19;0;0;7;0;9;1;0;10;0;0;0;0;5;5;21;17;8;12;0;0;1 178;0;39;28;163;693;7 078
2004;C10-C12;Manufacture of food products, beverages and tobacco products;Domestic;1 696;0;33;25;7 578;786;8;50;11;6;227;0;34;27;23;15;34;15;51;22;2;17;0;14;1;0;48;38;92;59;32;55;12;17;0;3 026;0;0;20;3;18;1;2;13;0;0;0;0;96;33;306;35;163;29;0;0;32 034;0;378;126;1 153;4 346;52 813
2004;C13-C15;Manufacture of textiles, wearing apparel and leather products;Domestic;102;1;3;50;285;24 957;37;119;56;13;207;0;142;66;123;52;137;45;102;152;21;571;0;26;8;1;164;52;100;135;231;13;83;29;0;122;0;0;36;3;27;1;2;47;0;0;0;0;136;70;254;58;99;40;0;0;16 288;0;316;915;1 276;21 337;69 115
2004;C16;"Manufacture of wood and of products of wood and cork, except furniture; manufacture of articles of straw and plaiting materials";Domestic;29;0;0;5;17;19;382;49;3;1;11;0;11;16;87;19;18;14;22;12;9;413;0;4;0;0;644;2;20;13;117;0;0;1;0;6;0;0;1;3;3;0;0;8;0;0;0;0;20;1;26;12;9;32;0;0;393;0;0;31;75;399;2 959
2004;C17;Manufacture of paper and paper products;Domestic;18;1;2;11;675;307;45;1 160;745;3;215;0;90;205;26;59;45;41;125;24;3;75;0;7;3;0;71;13;56;61;14;2;3;36;0;69;0;0;21;7;172;15;23;5;0;0;0;0;338;16;159;89;69;28;0;0;844;0;3;13;-748;560;5 821
2004;C18;Printing and reproduction of recorded media;Domestic;4;1;0;10;57;79;6;32;174;5;85;0;23;27;14;15;15;12;30;25;2;23;0;9;3;0;56;244;491;352;221;1;2;81;0;79;0;0;231;18;110;12;14;15;0;0;0;0;400;46;219;97;72;133;0;0;995;0;5;101;-398;167;4 415
2004;C19;Manufacture of coke and refined petroleum products ;Domestic;639;13;16;177;145;527;14;55;7;552;193;0;64;259;88;55;7;19;38;94;5;17;0;51;6;0;623;178;261;223;2 229;171;285;96;0;90;0;0;24;1;160;1;1;178;0;0;0;0;39;112;177;77;41;37;0;0;2 285;0;29;125;-1 524;1 710;10 671
2004;C20;Manufacture of chemicals and chemical products ;Domestic;815;2;3;79;444;2 256;182;232;124;74;2 247;0;1 317;241;124;126;91;163;181;118;25;139;0;17;30;25;288;52;95;55;62;10;6;29;0;142;0;0;31;8;26;2;4;234;0;0;0;0;189;20;117;50;322;57;0;0;5 160;0;311;156;-279;2 600;18 800
2004;C21;Manufacture of basic pharmaceutical products and pharmaceutical preparations;Domestic;0;0;0;0;0;0;0;0;0;0;0;0;0;0;0;0;0;0;0;0;0;0;0;0;0;0;0;0;0;0;0;0;0;0;0;0;0;0;0;0;0;0;0;0;0;0;0;0;0;0;0;0;0;0;0;0;0;0;0;0;0;0;0
2004;C22;Manufacture of rubber and plastic products;Domestic;189;1;1;34;731;546;38;96;104;16;362;0;691;39;30;85;121;301;181;678;21;356;0;5;25;1;534;76;63;82;358;2;1;151;0;33;0;0;10;2;7;1;1;472;0;0;0;0;31;3;129;16;28;9;0;0;1 204;0;6;87;-619;2 354;9 690
2004;C23;Manufacture of other non-metallic mineral products;Domestic;43;14;0;32;285;194;14;18;7;38;130;0;88;1 398;474;79;31;87;171;168;17;41;0;8;1;0;3 509;54;25;43;10;1;1;4;0;74;0;0;4;1;10;0;1;1 206;0;0;0;0;97;23;437;88;252;36;0;0;574;0;2;73;-636;2 850;12 074
2004;C24;Manufacture of basic metals;Domestic;24;0;1;35;70;65;10;10;7;12;71;0;89;35;2 625;1 060;123;323;1 032;617;40;869;0;36;25;0;1 240;19;23;28;150;3;3;10;0;11;0;0;6;2;6;0;0;22;0;0;0;0;56;4;16;7;11;3;0;0;211;0;3;122;-733;8 566;16 969
2004;C25;Manufacture of fabricated metal products, except machinery and equipment;Domestic;23;1;0;50;145;96;16;12;8;11;100;0;60;55;117;299;21;166;171;503;65;170;0;39;2;0;1 590;31;40;101;19;2;1;22;0;33;0;0;4;3;4;1;1;165;0;0;0;0;55;29;30;46;16;7;0;0;271;0;1;1 140;-219;2 486;8 010
2004;C26;Manufacture of computer, electronic and optical products;Domestic;6;0;0;5;12;14;6;2;1;1;8;0;4;4;8;4;472;38;46;9;1;9;0;8;2;0;29;3;9;29;7;1;1;15;0;4;0;0;141;12;3;0;1;2;0;0;0;0;24;3;23;10;35;5;0;0;1 363;0;22;499;-481;3 629;6 049
2004;C27;Manufacture of electrical equipment;Domestic;9;0;0;49;16;19;1;4;3;3;13;0;9;9;7;13;115;487;159;53;15;8;0;172;8;0;458;5;13;40;196;14;17;9;0;5;0;0;174;1;1;0;0;33;0;0;0;0;37;2;159;9;7;1;0;0;310;0;0;2 044;-532;2 086;6 261
2004;C28;Manufacture of machinery and equipment n.e.c.;Domestic;175;1;0;69;79;122;11;29;18;17;52;0;36;77;93;68;28;48;542;73;22;32;0;54;17;2;347;20;20;52;22;27;1;6;0;10;0;0;5;1;2;0;0;130;0;0;0;0;39;35;228;17;11;7;0;0;1 415;0;1;4 980;-303;4 452;13 189
2004;C29;Manufacture of motor vehicles, trailers and semi-trailers;Domestic;27;1;1;12;16;23;1;3;2;6;17;0;11;11;8;8;10;14;26;453;4;8;0;7;1;0;49;92;57;41;233;9;8;12;0;4;0;0;7;1;8;0;0;8;0;0;0;0;10;29;31;5;7;5;0;0;249;0;0;390;-598;10 743;12 068
2004;C30;Manufacture of other transport equipment;Domestic;0;0;5;2;1;1;0;0;0;0;1;0;0;0;1;1;0;1;1;1;19;1;0;1;0;0;2;1;0;1;19;21;38;2;0;0;0;0;0;0;0;0;0;0;0;0;0;0;0;1;142;0;1;0;0;0;53;0;0;320;-591;1 382;1 429
2004;C31_C32;"Manufacture of furniture; other manufacturing";Domestic;30;0;0;6;48;165;9;11;6;2;16;0;5;7;50;13;19;7;11;12;2;146;0;3;1;0;62;13;29;106;190;0;0;10;0;105;0;0;4;2;4;1;1;13;0;0;0;0;34;17;37;16;16;34;0;0;3 122;0;1;948;132;3 000;8 468
2004;C33;Repair and installation of machinery and equipment;Domestic;0;0;0;0;0;0;0;0;0;0;0;0;0;0;0;0;0;0;0;0;0;0;0;0;0;0;0;0;0;0;0;0;0;0;0;0;0;0;0;0;0;0;0;0;0;0;0;0;0;0;0;0;0;0;0;0;0;0;0;0;0;0;0
2004;D35;Electricity, gas, steam and air conditioning supply;Domestic;206;1;1;213;259;654;61;228;69;64;138;0;220;316;778;108;29;87;195;88;18;31;0;6 315;111;4;126;301;271;242;64;2;9;23;0;427;0;0;203;6;115;3;9;84;0;0;0;0;35;50;704;207;197;149;0;0;2 744;0;0;152;-39;190;16 469
2004;E36;Water collection, treatment and supply;Domestic;139;4;0;9;45;80;3;6;12;4;16;0;20;23;9;10;4;4;20;7;1;6;0;4;4;9;407;95;117;283;13;2;0;30;0;147;0;0;22;2;13;1;2;132;0;0;0;0;13;28;117;92;54;115;0;0;787;0;0;76;-4;62;3 047
2004;E37-E39;"Sewerage; waste collection, treatment and disposal activities; materials recovery; remediation activities and other waste management services ";Domestic;0;0;0;0;0;0;0;0;0;0;0;0;0;0;0;0;0;0;0;0;0;0;0;0;0;121;0;0;0;0;0;0;0;0;0;0;0;0;0;0;0;0;0;324;0;0;0;0;0;0;0;0;0;0;0;0;39;0;96;0;0;0;581
2004;F;Construction;Domestic;99;2;1;12;12;17;1;2;3;2;6;0;3;4;6;3;4;3;7;4;0;4;0;4;65;30;506;44;89;119;38;0;0;2;0;28;0;0;65;2;21;1;3;688;0;0;0;0;5;4;394;31;55;14;0;0;225;0;0;35 044;0;2 195;39 866
2004;G45;Wholesale and retail trade and repair of motor vehicles and motorcycles;Domestic;549;27;10;141;117;286;13;30;8;286;101;0;69;136;55;36;9;31;53;686;13;36;0;34;6;1;431;578;658;395;2 731;113;183;114;0;60;0;0;55;5;203;2;4;64;0;0;0;0;36;277;187;57;35;50;0;0;3 192;0;6;1 289;30;1 946;15 434
2004;G46;Wholesale trade, except of motor vehicles and motorcycles;Domestic;907;33;41;169;1 724;2 659;148;235;198;245;742;0;400;415;726;374;390;339;631;297;45;474;0;154;34;5;1 238;264;921;499;427;49;52;50;0;435;0;0;264;45;162;10;19;259;0;0;0;0;183;203;621;104;296;74;0;0;7 212;0;71;2 752;236;4 338;32 167
2004;G47;Retail trade, except of motor vehicles and motorcycles;Domestic;361;5;5;82;2 002;2 242;82;243;160;53;605;0;361;352;646;308;376;305;496;295;31;347;0;79;19;9;1 099;107;193;216;285;28;29;46;0;575;0;0;169;15;64;5;8;296;0;0;0;0;205;66;338;75;190;59;0;0;11 848;0;129;3 308;263;5 402;34 483
2004;H49;Land transport and transport via pipelines;Domestic;777;15;10;197;2 201;2 235;142;244;141;531;860;0;391;571;790;339;291;309;499;560;52;436;0;259;20;5;1 355;416;1 018;1 273;5 983;284;231;2 100;0;685;0;0;200;25;81;13;19;347;0;0;0;0;204;158;609;135;263;85;0;0;22 661;0;102;2 902;230;7 291;60 549
2004;H50;Water transport;Domestic;46;0;3;9;76;57;8;10;5;108;82;0;28;29;85;38;4;13;47;30;6;33;0;61;2;0;104;130;360;836;194;290;9;21;0;26;0;0;5;1;6;1;1;20;0;0;0;0;9;6;134;6;6;9;0;0;278;0;3;213;13;2 500;5 963
2004;H51;Air transport;Domestic;4;1;1;6;16;46;5;4;9;2;18;0;10;10;13;6;7;9;17;17;2;10;0;1;0;0;34;27;243;68;362;38;210;110;0;12;0;0;147;6;2;1;3;2;0;0;0;0;19;16;557;19;9;30;0;0;1 887;0;0;19;-16;1 515;5 537
2004;H52;Warehousing and support activities for transportation;Domestic;12;2;10;52;100;298;23;30;39;32;111;0;45;68;83;36;7;10;45;16;1;19;0;14;1;0;89;151;373;264;3 487;450;543;2 856;0;205;0;0;163;20;30;1;2;40;0;0;0;0;59;183;308;49;293;43;0;0;2 240;0;1;25;1;2 470;15 402
2004;H53;Postal and courier activities;Domestic;0;0;0;0;0;0;0;0;0;0;0;0;0;0;0;0;0;0;0;0;0;0;0;0;0;0;0;0;0;0;0;0;0;0;0;0;0;0;0;0;0;0;0;0;0;0;0;0;0;0;0;0;0;0;0;0;0;0;0;0;0;0;0
2004;I;Accommodation and food service activities;Domestic;6;4;1;68;28;50;4;5;8;4;45;0;13;16;13;11;6;8;21;16;3;7;0;17;1;0;69;115;482;264;454;20;305;840;0;32;0;0;33;8;188;7;9;19;0;0;0;0;49;66;71;66;52;89;0;0;16 308;0;0;53;1;38;19 994
2004;J58;Publishing activities;Domestic;0;0;0;0;0;0;0;0;0;0;0;0;0;0;0;0;0;0;0;0;0;0;0;0;0;0;0;0;0;0;0;0;0;0;0;0;0;0;0;0;0;0;0;0;0;0;0;0;0;0;0;0;0;0;0;0;0;0;0;0;0;0;0
2004;J59_J60;"Motion picture, video and television programme production, sound recording and music publishing activities; programming and broadcasting activities";Domestic;0;0;0;0;0;0;0;0;0;0;0;0;0;0;0;0;0;0;0;0;0;0;0;0;0;0;0;0;0;0;0;0;0;0;0;0;0;0;0;0;0;0;0;0;0;0;0;0;0;0;0;0;0;0;0;0;0;0;0;0;0;0;0
2004;J61;Telecommunications;Domestic;4;4;2;26;77;191;17;16;46;5;56;0;50;38;30;34;16;27;57;28;4;33;0;21;3;9;94;425;1 166;1 327;429;10;56;227;0;144;0;0;971;36;332;26;57;12;0;0;0;0;217;191;517;106;120;147;0;0;6 131;0;0;41;0;220;13 796
2004;J62_J63;"Computer programming, consultancy and related activities; information service activities";Domestic;0;0;0;11;17;26;2;2;4;2;10;0;8;11;7;4;5;6;8;8;1;3;0;1;1;0;3;10;16;14;27;0;0;0;0;36;0;0;149;8;52;13;15;1;0;0;0;0;9;105;307;78;22;19;0;0;298;0;0;197;0;35;1 552
2004;K64;Financial service activities, except insurance and pension funding;Domestic;913;1;1;76;135;912;35;48;56;67;471;0;246;248;152;110;88;91;109;40;55;43;0;49;14;1;569;243;489;548;1 023;49;882;171;0;363;0;0;475;20;1 170;98;153;125;0;0;0;0;128;289;997;128;89;207;0;0;4 309;0;0;10;-2;2 418;18 911
2004;K65;Insurance, reinsurance and pension funding, except compulsory social security;Domestic;17;0;1;7;14;29;1;5;2;5;11;0;7;9;8;3;2;3;7;7;1;2;0;33;0;0;17;5;21;45;16;12;14;19;0;10;0;0;6;1;13;1;10;18;0;0;0;0;6;31;21;4;5;3;0;0;194;0;0;0;0;390;1 035
2004;K66;Activities auxiliary to financial services and insurance activities;Domestic;0;0;0;0;0;0;0;0;0;0;0;0;0;0;0;0;0;0;0;0;0;0;0;0;0;0;0;0;0;0;0;0;0;0;0;0;0;0;0;0;838;40;62;0;0;0;0;0;0;0;0;0;0;0;0;0;5;0;0;0;0;1;947
2004;L68;Real estate activities;Domestic;1;0;1;26;61;167;8;12;28;5;40;0;30;33;18;27;11;14;31;12;3;40;0;10;1;11;26;418;1 016;2 460;697;30;17;153;0;474;0;0;188;20;1 227;28;24;294;0;0;0;0;110;129;297;67;363;143;0;0;32 179;0;0;8;0;0;40 958
2004;M69_M70;"Legal and accounting activities; activities of head offices; management consultancy activities";Domestic;0;0;0;0;0;0;0;0;0;0;0;0;0;0;0;0;0;0;0;0;0;0;0;0;0;0;0;0;0;0;0;0;0;0;0;0;0;0;0;0;0;0;0;0;0;0;0;0;0;0;0;0;0;0;0;0;0;0;0;0;0;0;0
2004;M71;"Architectural and engineering activities; technical testing and analysis";Domestic;0;0;0;0;0;0;0;0;0;0;0;0;0;0;0;0;0;0;0;0;0;0;0;0;0;0;0;0;0;0;0;0;0;0;0;0;0;0;0;0;0;0;0;0;0;0;0;0;0;0;0;0;0;0;0;0;0;0;0;0;0;0;0
2004;M72;Scientific research and development;Domestic;0;0;0;0;1;1;0;0;0;0;1;0;0;0;0;0;1;0;1;0;0;0;0;0;0;0;0;0;0;0;0;0;0;0;0;0;0;0;0;0;0;0;0;0;0;0;0;0;1;0;0;0;1;0;0;0;0;0;0;0;0;0;10
2004;M73;Advertising and market research;Domestic;0;0;0;0;0;0;0;0;0;0;0;0;0;0;0;0;0;0;0;0;0;0;0;0;0;0;0;0;0;0;0;0;0;0;0;0;0;0;0;0;0;0;0;0;0;0;0;0;0;0;0;0;0;0;0;0;0;0;0;0;0;0;0
2004;M74_M75;"Other professional, scientific and technical activities; veterinary activities";Domestic;2;1;1;60;251;261;17;46;130;32;351;0;84;72;58;43;43;44;130;112;11;84;0;41;24;6;431;749;1 361;685;251;9;20;202;0;205;0;0;1 120;109;612;30;33;155;0;0;0;0;326;171;627;273;292;509;0;0;985;0;0;886;0;332;12 277
2004;N;Administrative and support service activities;Domestic;308;2;1;195;329;452;20;45;32;65;203;0;63;90;84;49;37;40;62;69;4;28;0;25;4;0;560;542;351;273;680;142;135;139;0;269;0;0;98;51;44;5;1;17;0;0;0;0;194;1 489;82;23;54;161;0;0;2 876;0;0;12;-22;418;10 800
2004;O84;"Public administration and defence; compulsory social security";Domestic;16;0;0;9;15;27;1;2;2;1;28;0;9;9;5;3;16;4;16;8;0;3;0;2;0;0;5;7;26;16;6;2;1;13;0;3;0;0;23;0;56;2;1;0;0;0;0;0;16;3;122;31;34;194;0;0;1 183;0;27 243;3;0;386;29 552
2004;P85;Education;Domestic;0;0;0;12;18;16;1;2;3;2;31;0;5;7;7;3;8;5;15;16;0;3;0;2;0;0;5;27;165;46;7;1;7;11;0;6;0;0;15;2;17;7;5;6;0;0;0;0;12;3;172;95;327;105;0;0;3 558;0;8 527;40;-1;19;13 343
2004;Q;Human health and social work activities;Domestic;112;0;0;21;22;45;2;9;9;4;46;0;8;18;27;12;14;8;33;14;1;6;0;3;1;0;24;45;89;56;75;1;6;13;0;15;0;0;68;6;48;6;2;10;0;0;0;0;26;10;47;37;493;67;0;0;3 820;0;5 528;54;-4;29;10 990
2004;R_S;Other service activities;Domestic;27;0;1;12;29;56;3;5;3;1;44;0;12;10;10;5;7;5;11;12;1;5;0;4;3;0;26;61;227;137;30;17;4;108;0;30;0;0;193;2;494;14;7;2;0;0;0;0;40;24;135;47;82;1 474;0;0;5 910;0;368;15;-1;226;9 938
2004;T;"Activities of households as employers; undifferentiated goods- and services-producing activities of households for own use";Domestic;0;0;0;0;0;0;0;0;0;0;0;0;0;0;0;0;0;0;0;0;0;0;0;0;0;0;0;0;0;0;0;0;0;0;0;0;0;0;0;0;0;0;0;0;0;0;0;0;0;0;0;0;0;0;0;0;570;0;0;0;0;0;570
2004;U;Activities of extraterritorial organizations and bodies;Domestic;0;0;0;0;0;0;0;0;0;0;0;0;0;0;0;0;0;0;0;0;0;0;0;0;0;0;0;0;0;0;0;0;0;0;0;0;0;0;0;0;0;0;0;0;0;0;0;0;0;0;0;0;0;0;0;0;0;0;0;0;0;0;0
2004;A01;Crop and animal production, hunting and related service activities;Imports;522;0;0;1;1 195;108;8;5;0;1;21;0;0;0;0;0;0;0;0;1;0;0;0;0;0;0;0;1;2;2;1;2;0;0;0;102;0;0;0;0;0;0;0;1;0;0;0;0;1;0;21;1;5;1;0;0;106;0;0;3;0;0;0
2004;A02;Forestry and logging;Imports;1;2;0;5;7;0;65;33;0;0;0;0;0;1;0;0;0;0;0;0;0;0;0;0;0;0;1;2;0;10;0;0;0;0;0;9;0;0;0;0;0;0;0;1;0;0;0;0;0;0;0;1;1;0;0;0;1;0;0;0;0;0;0
2004;A03;Fishing and aquaculture;Imports;0;0;0;0;2;0;0;0;0;0;0;0;0;0;0;0;0;0;0;0;0;0;0;0;0;0;0;0;0;0;0;0;0;0;0;1;0;0;0;0;0;0;0;0;0;0;0;0;0;0;0;0;0;0;0;0;7;0;0;0;0;0;0
2004;B;Mining and quarrying;Imports;23;1;0;102;82;83;22;61;0;2 909;654;0;11;896;491;38;5;7;11;18;0;10;0;1 626;1;0;417;45;121;193;19;2;2;1;0;30;0;0;10;0;12;2;0;17;0;0;0;0;2;8;32;24;7;20;0;0;13;0;0;4;0;0;0
2004;C10-C12;Manufacture of food products, beverages and tobacco products;Imports;156;0;3;2;661;87;2;6;1;1;41;0;16;3;2;2;1;2;3;2;0;2;0;0;0;0;4;3;7;4;3;5;1;2;0;265;0;0;1;0;1;0;0;3;0;0;0;0;8;3;27;2;16;3;0;0;566;0;7;8;0;0;0
2004;C13-C15;Manufacture of textiles, wearing apparel and leather products;Imports;9;0;0;3;12;2 914;4;11;4;1;18;0;14;3;9;4;9;2;4;15;2;64;0;1;1;0;10;5;7;10;25;1;10;3;0;9;0;0;2;0;1;0;0;3;0;0;0;0;11;7;26;4;7;4;0;0;1 003;0;20;8;0;0;0
2004;C16;"Manufacture of wood and of products of wood and cork, except furniture; manufacture of articles of straw and plaiting materials";Imports;5;0;0;1;3;5;62;8;1;0;2;0;2;3;14;3;3;2;3;3;2;67;0;0;0;0;105;1;3;2;20;0;0;0;0;1;0;0;0;0;0;0;0;1;0;0;0;0;3;0;4;2;1;5;0;0;24;0;0;6;0;0;0
2004;C17;Manufacture of paper and paper products;Imports;4;0;1;3;185;83;11;322;206;1;57;0;23;56;7;16;12;11;34;6;1;19;0;1;1;0;17;2;13;15;3;0;1;10;0;18;0;0;5;2;47;4;6;1;0;0;0;0;91;4;43;24;18;7;0;0;32;0;0;3;0;0;0
2004;C18;Printing and reproduction of recorded media;Imports;1;0;0;0;6;7;1;9;17;0;6;0;2;3;1;1;4;1;2;2;0;2;0;0;0;0;2;14;29;23;16;0;0;5;0;5;0;0;12;1;6;1;1;0;0;0;0;0;30;3;14;6;4;7;0;0;6;0;0;12;0;0;0
2004;C19;Manufacture of coke and refined petroleum products ;Imports;276;5;7;74;65;261;8;26;4;236;120;0;48;113;39;25;3;10;17;12;2;8;0;22;3;1;262;55;89;83;875;72;120;39;0;40;0;0;9;0;63;0;0;80;0;0;0;0;18;38;72;32;22;16;0;0;604;0;8;3;0;0;0
2004;C20;Manufacture of chemicals and chemical products ;Imports;892;1;2;75;373;2 423;172;189;92;77;2 526;0;1 477;239;102;121;68;154;157;101;24;96;0;6;32;29;201;44;60;26;28;9;4;25;0;137;0;0;20;7;8;1;2;244;0;0;0;0;181;12;90;42;345;59;0;0;521;0;33;19;0;0;0
2004;C21;Manufacture of basic pharmaceutical products and pharmaceutical preparations;Imports;23;0;0;2;11;63;4;5;3;3;64;0;37;7;3;3;2;4;5;3;1;3;0;1;1;1;6;1;2;1;3;0;0;1;0;4;0;0;1;0;0;0;0;7;0;0;0;0;5;0;3;1;9;2;0;0;16;0;1;7;0;0;0
2004;C22;Manufacture of rubber and plastic products;Imports;42;0;0;7;151;136;8;20;22;4;83;0;150;7;7;18;26;64;39;147;5;76;0;1;5;0;108;16;11;16;77;1;1;32;0;6;0;0;2;0;1;0;0;99;0;0;0;0;6;1;28;3;6;2;0;0;245;0;0;55;0;0;0
2004;C23;Manufacture of other non-metallic mineral products;Imports;6;1;0;3;19;23;2;2;1;23;22;0;12;93;36;7;3;7;12;12;1;4;0;12;0;0;221;4;2;4;2;0;0;0;0;5;0;0;1;0;0;0;0;75;0;0;0;0;6;2;28;6;17;3;0;0;33;0;0;10;0;0;0
2004;C24;Manufacture of basic metals;Imports;9;0;0;37;60;30;10;8;4;23;63;0;98;34;3 484;1 400;152;420;1 348;802;52;1 145;0;46;32;0;1 593;17;13;21;167;1;1;9;0;6;0;0;1;2;1;0;0;12;0;0;0;0;62;1;5;1;3;1;0;0;17;0;0;39;0;0;0
