Year;Code;Description;Origin;A01;A02;A03;B;C10-C12;C13-C15;C16;C17;C18;C19;C20;C21;C22;C23;C24;C25;C26;C27;C28;C29;C30;C31_C32;C33;D35;E36;E37-E39;F;G45;G46;G47;H49;H50;H51;H52;H53;I;J58;J59_J60;J61;J62_J63;K64;K65;K66;L68;M69_M70;M71;M72;M73;M74_M75;N;O84;P85;Q;R_S;T;U;CONS_h;CONS_np;CONS_g;GFCF;INVEN;EXP;GO
2010;C18;Printing and reproduction of recorded media;Domestic;10;0;0;1;4;1;1;3;84;0;0;0;1;1;1;1;0;1;1;0;0;1;0;2;0;0;2;1;20;2;1;0;0;6;1;4;33;10;10;3;17;1;3;1;5;7;1;10;7;19;14;23;2;9;0;0;47;0;1;1;1;14;389
2010;C19;Manufacture of coke and refined petroleum products ;Domestic;87;17;0;62;29;5;11;8;1;94;6;1;8;28;100;9;1;2;4;1;1;4;2;34;3;14;120;4;70;18;417;17;66;13;8;4;0;0;3;1;0;0;0;7;1;1;0;1;1;10;0;1;2;3;0;0;1 033;0;3;2;24;1 500;3 862
2010;C20;Manufacture of chemicals and chemical products ;Domestic;44;3;0;2;19;4;6;4;5;3;21;6;41;14;6;7;1;4;4;2;1;4;1;2;0;1;23;2;8;4;4;0;0;1;0;2;3;1;1;1;1;0;0;1;1;2;1;1;2;4;11;4;11;5;0;0;183;0;37;6;45;708;1 282
2010;C21;Manufacture of basic pharmaceutical products and pharmaceutical preparations;Domestic;1;0;0;0;1;0;0;0;0;0;1;7;1;0;1;0;0;0;0;0;0;0;0;0;0;0;1;0;1;0;0;0;0;0;0;0;0;0;0;0;0;0;0;0;0;0;0;0;0;0;11;0;7;0;0;0;163;0;42;1;1;201;446
2010;C22;Manufacture of rubber and plastic products;Domestic;11;1;0;8;24;4;2;2;1;2;5;2;37;17;17;14;3;10;15;4;5;6;5;8;3;14;143;4;37;37;13;0;1;8;0;7;1;1;2;1;0;0;0;1;1;2;0;1;2;11;3;1;5;1;0;0;169;0;1;10;0;395;1 081
2010;C23;Manufacture of other non-metallic mineral products;Domestic;12;1;0;6;18;1;2;3;0;16;4;1;3;73;17;9;1;3;5;4;8;1;3;14;0;2;328;1;14;8;7;0;0;12;0;5;0;1;1;0;3;1;0;7;0;1;0;0;0;6;2;1;2;1;0;0;247;0;3;13;48;476;1 395
2010;C24;Manufacture of basic metals;Domestic;9;1;0;10;11;1;1;0;0;2;3;0;4;11;463;91;10;65;93;7;6;10;34;12;1;5;175;2;9;3;18;0;0;10;0;1;0;0;1;0;1;0;0;1;0;0;0;0;0;1;1;1;2;3;0;0;18;1;1;49;55;3 026;4 231
2010;C25;Manufacture of fabricated metal products, except machinery and equipment;Domestic;26;5;0;13;18;4;6;1;1;6;2;1;2;2;87;30;1;8;42;2;4;5;8;32;1;5;262;7;29;13;6;0;1;18;0;4;0;1;2;1;3;0;0;3;1;1;0;1;1;9;2;1;2;3;0;0;157;0;1;185;-1;458;1 484
2010;C26;Manufacture of computer, electronic and optical products;Domestic;1;0;0;0;1;0;0;0;0;0;0;0;0;0;1;0;4;1;1;0;0;0;0;2;0;0;3;0;1;2;1;0;0;1;0;1;0;1;2;1;0;0;0;0;0;0;0;0;0;1;1;0;1;1;0;0;31;0;0;33;-71;367;395
2010;C27;Manufacture of electrical equipment;Domestic;4;1;0;2;7;1;0;0;0;1;1;2;1;1;5;4;3;12;5;5;2;1;1;28;0;1;29;1;3;3;6;0;0;5;0;1;0;1;2;1;0;0;0;4;0;0;0;0;0;2;2;1;2;1;0;0;134;0;0;66;-2;732;1 084
2010;C28;Manufacture of machinery and equipment n.e.c.;Domestic;4;1;0;1;5;1;0;0;0;1;1;0;1;3;4;2;0;1;4;1;1;0;1;6;0;1;24;1;3;3;4;0;0;2;0;1;0;0;1;1;1;0;0;1;1;1;0;0;1;1;1;0;2;1;0;0;51;0;1;388;-19;688;1 200
2010;C29;Manufacture of motor vehicles, trailers and semi-trailers;Domestic;0;0;0;0;0;0;0;0;0;0;0;0;0;0;0;0;1;1;1;13;0;0;0;2;0;0;2;0;0;1;23;0;0;1;0;0;0;0;1;0;0;0;0;0;0;0;0;0;0;0;0;0;0;0;0;0;148;0;0;45;-23;309;531
2010;C30;Manufacture of other transport equipment;Domestic;0;0;0;0;2;0;0;0;0;0;0;0;0;0;2;0;0;0;1;0;11;0;0;2;0;0;4;0;1;0;7;0;4;0;0;0;0;0;0;0;0;0;0;0;0;0;0;0;0;0;3;0;1;0;0;0;24;0;0;48;2;143;259
2010;C31_C32;"Manufacture of furniture; other manufacturing";Domestic;2;0;0;0;2;1;0;0;0;0;0;0;1;0;1;1;0;0;1;0;0;4;0;1;0;0;5;0;1;1;1;0;0;1;0;2;0;1;0;0;0;0;0;1;0;0;0;0;0;1;1;1;1;1;0;0;358;0;1;34;3;259;692
2010;C33;Repair and installation of machinery and equipment;Domestic;4;3;0;5;50;1;1;0;0;2;1;0;1;0;53;5;1;5;10;2;3;1;3;52;0;2;60;4;7;8;5;1;2;6;0;2;0;2;2;1;1;0;0;1;1;2;0;1;1;5;2;1;4;3;0;0;12;1;1;74;0;60;475
2010;D35;Electricity, gas, steam and air conditioning supply;Domestic;30;2;0;212;142;42;27;36;9;94;223;21;54;91;159;48;6;23;40;7;4;15;8;217;78;5;39;136;370;106;46;1;0;18;1;69;1;1;51;3;1;0;0;42;3;25;53;1;4;93;148;14;132;13;0;0;1 291;0;4;13;-9;539;4 802
2010;E36;Water collection, treatment and supply;Domestic;6;1;0;3;3;1;1;1;0;0;0;1;1;1;5;1;1;5;1;1;0;1;0;3;2;2;6;1;1;2;1;0;0;1;0;3;0;1;1;1;0;0;0;1;1;1;1;0;1;2;1;4;6;2;0;0;258;0;3;5;0;28;368
2010;E37-E39;"Sewerage; waste collection, treatment and disposal activities; materials recovery; remediation activities and other waste management services ";Domestic;2;0;0;0;3;0;0;1;0;0;0;0;0;0;1;0;0;0;0;0;0;0;0;1;0;0;19;0;2;1;2;0;0;0;0;1;0;0;0;0;0;0;0;0;0;0;0;0;0;1;0;0;1;1;0;0;139;0;45;2;6;381;615
2010;F;Construction;Domestic;97;15;1;64;92;11;12;4;3;17;23;7;13;27;96;38;13;35;41;19;30;10;16;140;8;104;1 358;57;195;94;60;1;7;58;4;95;2;24;36;12;75;24;13;591;24;34;3;16;26;105;77;53;108;51;0;0;273;2;35;5 561;77;472;10 560
2010;G45;Wholesale and retail trade and repair of motor vehicles and motorcycles;Domestic;7;1;0;2;9;1;1;0;0;2;1;0;1;1;3;2;0;1;3;3;0;1;1;5;0;5;13;1;6;3;124;0;1;4;0;2;0;1;1;1;2;0;0;2;1;1;0;1;1;8;7;0;2;2;0;0;631;0;3;13;0;59;940
2010;G46;Wholesale trade, except of motor vehicles and motorcycles;Domestic;393;11;0;46;602;71;17;10;10;39;60;24;71;52;211;49;23;33;39;54;12;31;13;82;4;21;418;19;168;73;176;5;14;20;3;88;9;11;28;19;12;2;1;33;15;16;4;19;9;22;36;21;134;32;0;0;227;1;18;291;33;1 540;5 493
2010;G47;Retail trade, except of motor vehicles and motorcycles;Domestic;271;8;0;37;420;48;12;7;7;30;42;16;50;37;147;35;16;23;27;38;9;21;10;64;3;16;303;14;132;54;141;5;11;19;5;63;7;9;24;14;10;2;1;26;10;11;3;15;7;17;25;15;93;26;0;0;174;2;30;235;24;1 051;3 973
2010;H49;Land transport and transport via pipelines;Domestic;53;17;0;57;150;16;24;7;3;120;18;6;13;38;71;33;6;39;48;23;4;11;7;236;3;20;489;18;227;81;166;4;6;93;5;15;2;4;14;6;6;3;1;10;6;8;3;13;5;52;29;5;16;9;0;0;1 487;0;191;19;1;803;4 821
2010;H50;Water transport;Domestic;2;1;4;1;19;0;0;0;0;53;1;0;0;0;8;2;0;2;2;1;0;0;0;6;0;2;8;0;26;3;28;14;0;2;1;1;0;0;0;0;0;0;0;0;1;1;0;0;1;3;1;0;0;0;0;0;11;0;7;1;0;27;242
2010;H51;Air transport;Domestic;1;0;0;0;0;0;0;0;0;0;0;0;0;0;0;0;0;0;0;0;0;0;0;1;0;0;2;0;7;0;1;0;2;3;0;0;0;1;1;0;2;0;0;0;0;0;0;0;0;4;11;0;1;0;0;0;162;0;5;0;0;327;533
2010;H52;Warehousing and support activities for transportation;Domestic;14;3;2;40;42;2;2;1;0;33;1;0;2;11;16;4;1;3;4;2;0;1;1;40;0;7;55;1;124;18;225;23;14;36;28;4;0;3;10;1;1;0;0;1;1;2;0;1;1;6;4;1;2;3;0;0;198;0;174;8;-1;271;1 447
2010;H53;Postal and courier activities;Domestic;2;1;0;1;3;1;1;0;2;1;1;0;1;1;2;2;0;1;2;0;0;1;1;7;0;1;11;1;20;8;7;0;2;7;3;4;1;6;13;1;7;3;2;1;2;2;0;1;2;6;1;2;1;6;0;0;132;0;8;0;0;14;308
2010;I;Accommodation and food service activities;Domestic;2;0;0;1;3;0;0;0;0;0;0;0;0;0;1;0;0;0;0;0;0;0;0;1;0;0;5;0;3;2;1;0;0;1;0;1;0;0;1;1;1;0;0;1;1;1;0;2;0;2;1;0;1;3;0;0;1 831;1;41;10;0;50;1 975
2010;J58;Publishing activities;Domestic;0;0;0;0;1;0;0;0;5;0;0;0;0;0;0;0;0;0;0;0;0;0;0;1;0;0;1;0;3;2;0;0;0;1;1;1;3;1;3;1;3;0;0;0;1;2;0;4;1;1;1;3;1;2;0;0;152;0;10;6;0;68;286
2010;J59_J60;"Motion picture, video and television programme production, sound recording and music publishing activities; programming and broadcasting activities";Domestic;1;0;0;0;3;0;1;0;3;0;0;0;0;1;1;0;0;1;0;1;0;1;1;5;0;1;11;0;9;7;1;0;1;6;2;5;1;27;19;3;2;3;2;0;2;3;0;45;2;5;1;6;3;10;0;0;138;1;37;94;4;32;503
2010;J61;Telecommunications;Domestic;10;3;0;5;19;4;3;1;3;1;3;1;3;6;12;10;1;5;9;3;1;4;3;30;1;5;51;7;30;33;25;1;7;31;12;17;2;32;259;22;29;14;10;8;7;10;1;16;8;28;10;9;10;27;0;0;1 283;0;10;38;1;241;2 435
2010;J62_J63;"Computer programming, consultancy and related activities; information service activities";Domestic;2;0;0;1;4;0;0;0;0;1;1;0;1;3;1;4;6;7;13;3;1;0;3;19;2;2;13;3;33;23;3;0;6;26;20;7;2;9;60;24;42;5;3;3;22;29;7;22;22;17;16;7;6;10;0;0;53;1;2;215;0;476;1 260
2010;K64;Financial service activities, except insurance and pension funding;Domestic;98;9;1;53;119;33;8;9;9;48;22;8;19;29;80;25;7;24;29;34;5;19;11;138;7;13;552;46;230;72;177;5;13;45;7;57;6;16;55;28;155;114;24;263;24;23;8;18;14;45;14;55;62;41;0;0;441;0;3;1;0;104;3 576
2010;K65;Insurance, reinsurance and pension funding, except compulsory social security;Domestic;33;5;0;7;10;3;3;0;0;3;1;0;2;4;13;7;1;4;5;2;1;2;1;23;1;3;103;7;55;29;53;5;8;41;1;10;0;3;7;4;139;260;3;27;6;6;1;3;5;26;9;8;6;3;0;0;192;0;0;0;0;88;1 244
2010;K66;Activities auxiliary to financial services and insurance activities;Domestic;3;0;0;1;1;0;0;0;0;0;0;0;0;0;1;1;0;0;0;0;0;0;0;2;0;0;10;1;12;7;6;0;1;5;1;1;0;0;1;0;58;84;19;3;1;1;0;0;0;3;6;1;1;0;0;0;20;0;0;0;0;9;268
2010;L68;Real estate activities;Domestic;20;4;0;19;21;30;3;1;1;2;1;0;2;3;14;5;1;4;3;3;1;2;3;36;0;22;209;23;220;226;21;7;4;83;9;41;3;17;198;190;58;6;7;100;28;50;17;25;29;111;49;9;15;63;0;0;4 375;1;83;157;0;43;6 678
2010;M69_M70;"Legal and accounting activities; activities of head offices; management consultancy activities";Domestic;7;1;0;3;16;3;2;1;2;2;2;1;2;6;6;7;2;11;9;5;2;2;3;10;1;6;102;7;92;44;18;0;2;18;1;16;2;8;6;21;17;5;2;13;186;29;1;21;21;36;26;4;17;17;0;0;71;0;3;12;0;176;1 108
2010;M71;"Architectural and engineering activities; technical testing and analysis";Domestic;3;0;0;5;27;1;1;0;1;1;1;0;1;3;3;3;1;5;4;2;1;1;1;5;0;3;211;3;39;17;8;0;1;11;5;7;1;4;5;14;9;2;1;8;51;128;1;6;9;6;3;2;28;5;0;0;61;0;3;33;0;261;1 016
2010;M72;Scientific research and development;Domestic;0;0;0;0;0;0;0;0;0;0;0;0;0;0;0;0;0;0;1;0;0;0;0;0;0;0;1;0;0;0;0;0;0;0;0;0;0;0;0;0;0;0;0;0;0;0;3;0;1;0;3;0;8;0;0;0;0;1;82;156;0;146;407
2010;M73;Advertising and market research;Domestic;5;1;0;6;94;19;2;1;1;5;2;3;1;1;1;2;0;7;1;4;1;2;2;3;1;3;9;2;7;9;5;1;3;3;2;7;1;3;10;21;12;4;1;3;13;3;2;342;2;8;2;3;4;14;0;0;27;0;1;2;1;163;854
2010;M74_M75;"Other professional, scientific and technical activities; veterinary activities";Domestic;123;1;0;1;13;2;1;0;1;1;0;1;1;1;1;1;0;5;4;2;1;1;1;4;0;3;8;2;11;14;4;0;1;3;1;3;1;4;6;8;9;3;1;3;6;5;1;21;62;12;4;2;3;12;0;0;99;1;41;13;0;38;571
2010;N;Administrative and support service activities;Domestic;61;9;0;4;26;6;2;0;2;3;3;1;2;6;6;6;1;8;7;4;1;2;2;12;1;17;113;6;95;42;45;1;21;31;2;17;1;12;13;14;25;4;1;13;30;32;1;14;23;121;15;3;18;24;0;0;445;1;239;14;-1;227;1 855
2010;O84;"Public administration and defence; compulsory social security";Domestic;2;1;0;0;0;0;0;0;0;0;0;0;0;0;0;0;0;0;0;0;0;0;0;2;0;0;8;0;12;8;1;0;1;1;0;0;0;1;1;0;2;0;0;0;1;1;0;0;1;3;12;3;2;2;0;0;129;0;3 481;0;0;13;3 690
2010;P85;Education;Domestic;0;0;0;0;0;0;0;0;1;0;0;0;0;0;0;0;0;0;0;0;0;0;0;0;0;0;2;0;2;1;18;0;8;0;0;3;0;14;1;3;15;0;0;0;1;1;1;0;1;20;48;46;18;17;0;0;295;29;1 449;0;0;53;2 050
2010;Q;Human health and social work activities;Domestic;4;0;0;0;4;0;0;0;0;0;0;0;0;0;0;0;0;0;0;0;0;0;1;0;0;0;1;0;6;0;16;0;79;7;0;0;0;3;0;1;64;13;13;0;3;4;0;2;3;13;198;13;68;30;0;0;669;5;1 328;0;0;30;2 581
2010;R_S;Other service activities;Domestic;6;0;0;23;17;2;0;0;2;14;0;1;0;2;7;2;1;1;2;1;0;1;2;3;0;11;6;0;4;21;12;0;4;1;2;100;3;17;41;12;42;1;1;3;5;5;0;13;4;11;5;15;105;459;0;0;1 015;138;122;9;0;53;2 328
2010;T;"Activities of households as employers; undifferentiated goods- and services-producing activities of households for own use";Domestic;0;0;0;0;0;0;0;0;0;0;0;0;0;0;0;0;0;0;0;0;0;0;0;0;0;0;0;0;0;0;0;0;0;0;0;0;0;0;0;0;0;0;0;0;0;0;0;0;0;0;0;0;0;0;0;0;0;0;0;0;0;0;0
2010;U;Activities of extraterritorial organizations and bodies;Domestic;0;0;0;0;0;0;0;0;0;0;0;0;0;0;0;0;0;0;0;0;0;0;0;0;0;0;0;0;0;0;0;0;0;0;0;0;0;0;0;0;0;0;0;0;0;0;0;0;0;0;0;0;0;0;0;0;0;0;0;0;0;0;0
2010;A01;Crop and animal production, hunting and related service activities;Imports;165;1;0;0;144;7;0;0;0;0;1;0;1;0;0;0;0;0;0;0;0;0;0;0;0;0;1;0;20;4;0;0;0;0;0;2;0;0;0;0;0;0;0;0;0;0;0;0;0;3;1;2;2;0;0;0;198;0;0;7;0;0;0
2010;A02;Forestry and logging;Imports;1;0;0;0;0;0;1;0;0;0;1;0;0;0;0;0;0;0;0;0;0;1;0;0;0;0;0;0;0;0;0;0;0;0;0;0;0;0;0;0;0;0;0;0;0;0;0;0;0;0;0;0;0;0;0;0;1;0;0;0;0;0;0
2010;A03;Fishing and aquaculture;Imports;0;0;0;0;0;0;0;0;0;0;0;0;0;0;0;0;0;0;0;0;0;0;0;0;0;0;0;0;0;0;0;0;0;0;0;0;0;0;0;0;0;0;0;0;0;0;0;0;0;0;0;0;0;0;0;0;12;0;0;0;0;0;0
2010;B;Mining and quarrying;Imports;40;1;0;2;25;4;6;13;0;1 634;193;67;76;135;594;128;1;87;7;2;1;2;1;915;0;1;12;0;7;1;50;0;2;1;0;2;0;0;0;0;0;0;0;1;0;0;0;0;0;1;0;0;3;0;0;0;6;0;0;2;0;0;0
2010;C10-C12;Manufacture of food products, beverages and tobacco products;Imports;41;2;0;0;232;5;1;0;0;1;2;1;3;1;1;1;0;0;1;0;0;0;0;0;0;0;3;0;51;1;1;0;0;0;0;19;0;0;0;0;0;0;0;0;0;0;0;0;1;6;11;5;13;2;0;0;1 252;0;1;4;0;0;0
2010;C13-C15;Manufacture of textiles, wearing apparel and leather products;Imports;6;4;0;6;6;211;1;2;2;1;3;1;12;2;6;3;1;6;5;3;0;41;1;2;0;2;14;2;45;3;7;0;1;4;0;22;1;5;1;1;0;0;0;12;0;0;0;0;1;3;18;8;42;13;0;0;323;0;0;3;0;0;0
2010;C16;"Manufacture of wood and of products of wood and cork, except furniture; manufacture of articles of straw and plaiting materials";Imports;3;1;0;0;2;0;17;1;0;0;0;0;1;1;1;1;1;0;1;2;1;44;0;0;0;0;29;0;2;1;0;0;0;2;0;0;0;0;0;0;0;0;0;2;0;0;0;0;0;1;0;0;0;0;0;0;8;0;0;2;0;0;0
2010;C17;Manufacture of paper and paper products;Imports;5;0;0;0;24;3;7;66;27;5;6;2;2;9;1;4;2;5;3;3;0;12;1;1;0;1;22;0;27;13;0;0;0;1;1;5;23;4;4;3;8;1;1;0;1;1;0;1;1;4;4;3;3;1;0;0;48;0;0;1;0;0;0
2010;C18;Printing and reproduction of recorded media;Imports;0;0;0;0;1;0;0;2;2;0;0;0;0;0;0;0;0;0;0;0;0;1;0;0;0;0;1;0;1;1;0;0;0;0;0;0;1;0;0;0;1;0;0;0;0;0;0;0;0;0;0;0;0;0;0;0;5;0;0;2;0;0;0
2010;C19;Manufacture of coke and refined petroleum products ;Imports;74;14;0;50;23;5;10;7;1;77;7;1;11;24;82;8;1;2;4;1;1;4;2;28;2;11;98;4;55;14;333;14;53;10;6;3;1;0;2;1;0;0;0;6;1;1;0;0;1;9;1;2;2;3;0;0;268;0;1;2;0;0;0
2010;C20;Manufacture of chemicals and chemical products ;Imports;224;18;0;12;57;20;33;13;22;14;113;2;231;73;28;40;5;23;22;8;8;18;8;5;1;2;98;7;26;17;15;0;1;5;0;2;12;6;0;1;1;0;0;2;5;7;4;3;10;20;8;19;25;27;0;0;252;0;5;6;0;0;0
2010;C21;Manufacture of basic pharmaceutical products and pharmaceutical preparations;Imports;6;0;0;0;2;1;1;0;0;0;2;16;5;2;1;1;0;1;1;0;0;1;0;0;0;0;3;0;1;1;1;0;0;0;0;0;0;0;0;0;0;0;0;0;0;0;0;0;0;1;26;0;15;1;0;0;531;0;140;5;0;0;0
2010;C22;Manufacture of rubber and plastic products;Imports;10;1;1;9;23;6;3;2;1;3;6;2;44;20;18;16;4;11;17;4;6;8;5;8;3;16;158;5;41;42;13;0;1;9;0;7;1;1;2;1;0;0;0;1;1;2;0;1;2;13;4;1;5;1;0;0;115;0;0;8;0;0;0
2010;C23;Manufacture of other non-metallic mineral products;Imports;5;0;0;3;7;0;1;2;0;5;2;0;2;40;8;5;0;1;3;2;4;1;2;4;0;1;177;0;6;4;2;0;0;6;0;3;0;0;0;0;1;0;0;3;0;0;0;0;0;2;1;0;1;0;0;0;20;0;0;4;1;0;0
2010;C24;Manufacture of basic metals;Imports;4;1;0;12;6;1;1;1;0;8;2;1;3;15;638;124;14;89;126;9;8;14;47;17;2;7;229;2;9;3;23;0;0;13;0;0;0;0;0;0;0;0;0;0;0;0;0;0;0;1;1;0;0;0;0;0;12;0;0;14;0;0;0
2010;C25;Manufacture of fabricated metal products, except machinery and equipment;Imports;13;3;0;7;5;2;4;1;0;3;1;1;1;1;63;20;1;7;27;1;3;4;6;16;0;3;153;4;15;7;4;0;0;11;0;2;0;1;1;0;2;0;0;1;0;1;0;0;0;5;1;0;1;1;0;0;36;0;0;141;0;0;0
2010;C26;Manufacture of computer, electronic and optical products;Imports;1;1;0;1;1;0;0;0;0;4;1;0;1;2;6;4;66;24;14;5;2;2;3;24;0;1;21;1;9;25;4;1;3;18;4;12;1;17;40;22;2;1;0;1;2;3;1;1;3;12;12;3;9;21;0;0;410;0;4;534;0;0;0
2010;C27;Manufacture of electrical equipment;Imports;4;3;0;4;7;1;1;0;0;3;1;5;1;1;9;10;10;34;13;15;5;1;4;82;0;3;74;4;5;7;14;0;0;14;1;2;0;3;5;4;0;0;0;12;0;0;0;0;0;5;5;2;4;2;0;0;384;0;1;112;0;0;0
2010;C28;Manufacture of machinery and equipment n.e.c.;Imports;4;1;0;3;3;1;1;0;0;2;1;1;1;3;10;5;2;3;13;2;1;1;1;15;0;1;29;2;4;5;7;0;0;3;0;1;0;1;1;2;1;0;0;1;1;2;0;0;0;2;3;0;2;1;0;0;111;0;2;1 283;0;0;0
2010;C29;Manufacture of motor vehicles, trailers and semi-trailers;Imports;1;1;0;1;1;1;0;0;0;1;0;0;1;1;3;1;2;4;3;53;2;1;1;7;0;1;12;1;2;2;95;0;1;2;0;1;0;1;1;1;0;0;0;0;0;0;0;0;0;1;1;0;1;1;0;0;635;0;2;207;0;0;0
2010;C30;Manufacture of other transport equipment;Imports;0;0;0;0;0;0;0;0;0;0;0;0;0;0;1;0;0;1;0;1;27;0;0;1;0;0;2;0;0;0;16;1;10;1;0;0;0;0;0;0;0;0;0;0;0;0;0;0;0;0;8;0;2;0;0;0;41;0;1;118;5;0;0
2010;C31_C32;"Manufacture of furniture; other manufacturing";Imports;1;0;0;0;2;1;1;0;0;0;1;0;1;1;3;2;1;2;2;1;0;19;1;2;0;0;10;0;2;5;2;0;1;2;0;6;0;4;1;0;2;0;0;1;1;1;0;1;1;4;2;5;2;1;0;0;212;0;1;58;5;0;0
2010;C33;Repair and installation of machinery and equipment;Imports;0;0;0;0;2;0;0;0;0;0;0;0;0;0;4;1;0;1;1;0;1;0;0;3;0;0;5;0;1;1;1;0;0;1;0;0;0;0;0;0;0;0;0;0;0;0;0;0;0;0;0;0;0;0;0;0;7;0;0;21;0;0;0
2010;D35;Electricity, gas, steam and air conditioning supply;Imports;1;0;0;3;2;1;0;1;0;4;3;0;1;1;4;1;0;1;1;0;0;0;0;5;1;0;6;2;5;2;1;0;0;0;0;1;0;0;1;0;0;0;0;1;0;1;1;0;0;1;2;0;2;0;0;0;14;0;0;2;0;0;0
2010;E36;Water collection, treatment and supply;Imports;0;0;0;0;0;0;0;1;0;0;0;0;0;0;0;0;0;0;0;0;0;0;0;0;0;0;11;0;0;0;0;0;0;0;0;0;0;0;0;0;0;0;0;0;0;0;0;0;0;0;0;0;0;0;0;0;0;0;0;1;0;0;0
2010;E37-E39;"Sewerage; waste collection, treatment and disposal activities; materials recovery; remediation activities and other waste management services ";Imports;0;0;0;0;1;0;1;13;0;0;0;0;0;1;1;0;0;0;0;0;0;0;0;1;0;0;254;0;0;0;0;0;0;0;0;0;0;0;0;0;0;0;0;0;0;0;0;0;0;0;0;0;2;0;0;0;2;0;0;0;0;0;0
2010;F;Construction;Imports;3;1;0;2;2;0;0;0;0;2;1;0;1;1;4;2;0;1;2;1;1;1;1;6;0;3;48;2;6;3;2;0;0;2;0;3;0;1;1;0;2;1;0;19;1;2;0;1;1;3;2;2;3;1;0;0;20;0;3;8;0;0;0
2010;G45;Wholesale and retail trade and repair of motor vehicles and motorcycles;Imports;2;0;0;0;3;2;0;1;0;1;1;0;2;1;3;1;1;1;1;1;0;1;0;2;0;0;7;0;2;1;3;0;0;1;0;1;0;0;0;0;0;0;0;0;0;0;0;0;0;1;1;0;1;1;0;0;42;0;2;14;0;0;0
2010;G46;Wholesale trade, except of motor vehicles and motorcycles;Imports;31;2;0;4;33;17;4;7;3;327;45;15;29;34;134;32;6;25;9;5;2;8;2;192;0;2;56;2;16;7;23;0;2;5;1;6;2;3;4;2;1;0;0;3;1;1;0;1;1;5;6;3;9;5;0;0;300;0;19;131;1;0;0
2010;G47;Retail trade, except of motor vehicles and motorcycles;Imports;5;1;0;1;7;6;1;1;1;3;2;0;3;2;8;2;1;2;2;2;1;3;1;3;0;1;13;0;5;2;5;0;1;1;0;2;1;1;1;1;0;0;0;1;0;0;0;1;0;1;2;1;2;1;0;0;81;0;2;21;0;0;0
2010;H49;Land transport and transport via pipelines;Imports;13;2;0;4;17;5;3;4;1;325;39;13;17;30;122;28;1;20;6;3;1;2;1;194;0;2;44;1;19;7;24;1;1;7;0;2;0;1;1;1;1;0;0;1;1;1;0;1;1;4;2;1;2;1;0;0;99;0;10;14;0;0;0
2010;H50;Water transport;Imports;3;2;10;2;45;1;1;0;0;130;1;0;0;0;20;5;0;4;4;2;0;0;1;14;0;5;18;0;61;7;67;35;2;5;2;2;0;1;0;0;0;0;0;0;1;1;0;0;1;5;1;0;1;1;0;0;14;0;6;1;0;0;0
2010;H51;Air transport;Imports;1;0;0;0;0;0;0;0;0;0;0;0;0;0;0;0;0;0;0;0;0;0;0;1;0;0;2;0;6;0;1;0;2;3;0;0;0;1;1;0;2;0;0;0;0;0;0;0;0;3;10;0;1;0;0;0;141;0;4;0;0;0;0
2010;H52;Warehousing and support activities for transportation;Imports;1;0;0;2;4;0;0;0;0;6;0;0;0;1;2;0;0;0;0;0;0;0;0;2;0;0;4;0;8;1;13;2;1;2;1;0;0;0;1;0;0;0;0;0;0;0;0;0;0;1;1;0;0;0;0;0;15;0;10;2;0;0;0
2010;H53;Postal and courier activities;Imports;0;0;0;0;0;0;0;0;0;0;0;0;0;0;0;0;0;0;0;0;0;0;0;0;0;0;1;0;1;0;0;0;0;0;0;0;0;0;1;0;0;0;0;0;0;0;0;0;0;0;0;0;0;0;0;0;4;0;0;0;0;0;0
2010;I;Accommodation and food service activities;Imports;0;0;0;2;3;1;1;0;1;0;0;0;1;1;1;2;1;2;1;1;1;1;1;7;0;1;3;1;14;6;3;0;6;9;0;2;1;1;1;1;1;1;1;3;1;2;2;1;1;9;7;2;1;3;0;0;57;0;1;0;0;0;0
2010;J58;Publishing activities;Imports;1;0;0;0;1;0;0;0;11;0;0;0;0;0;0;0;0;0;0;0;0;0;0;1;0;0;1;0;5;2;0;0;0;2;0;1;7;2;2;1;3;0;1;0;2;2;0;2;2;1;1;5;0;3;0;0;44;0;0;1;0;0;0
2010;J59_J60;"Motion picture, video and television programme production, sound recording and music publishing activities; programming and broadcasting activities";Imports;0;0;0;0;0;0;0;0;0;0;0;0;0;0;0;0;0;0;0;0;0;0;0;1;0;0;2;0;1;1;0;0;0;1;0;1;0;4;3;0;0;0;0;0;0;0;0;6;0;1;0;1;0;1;0;0;52;0;14;0;0;0;0
2010;J61;Telecommunications;Imports;1;1;0;1;2;1;0;0;0;0;0;0;0;1;1;2;1;1;1;0;0;1;0;5;0;1;8;1;4;5;4;0;1;5;2;3;0;4;42;4;5;2;2;1;1;2;0;1;1;5;2;1;2;5;0;0;64;0;1;3;0;0;0
2010;J62_J63;"Computer programming, consultancy and related activities; information service activities";Imports;0;0;0;0;0;0;0;0;1;0;0;0;0;0;0;1;1;1;1;0;0;0;0;2;0;0;2;0;4;3;0;0;1;3;2;1;1;1;7;3;4;1;0;0;2;3;1;2;2;2;2;1;1;1;0;0;29;0;1;3;0;0;0
2010;K64;Financial service activities, except insurance and pension funding;Imports;1;0;0;0;0;0;0;0;0;0;0;0;0;0;0;0;0;0;0;0;0;0;0;0;0;0;3;0;1;1;2;0;1;1;0;0;0;0;0;0;1;1;0;1;1;0;0;0;0;1;0;0;1;0;0;0;7;0;0;1;0;0;0
2010;K65;Insurance, reinsurance and pension funding, except compulsory social security;Imports;2;0;0;0;1;0;0;0;0;0;0;0;0;0;1;0;0;0;0;0;0;0;0;1;0;0;6;0;3;2;3;0;1;2;0;1;0;0;1;0;8;15;0;2;0;0;0;0;0;2;1;0;0;0;0;0;29;0;0;1;0;0;0
2010;K66;Activities auxiliary to financial services and insurance activities;Imports;0;0;0;0;0;0;0;0;0;0;0;0;0;0;0;0;0;0;0;0;0;0;0;0;0;0;0;0;0;0;0;0;0;0;0;0;0;0;0;0;0;0;0;0;0;0;0;0;0;0;0;0;0;0;0;0;0;0;0;0;0;0;0
2010;L68;Real estate activities;Imports;0;0;0;0;0;0;0;0;0;0;0;0;0;0;0;0;0;0;0;0;0;0;0;0;0;0;1;0;0;0;0;0;0;0;0;0;0;0;0;0;0;0;0;0;0;0;0;0;0;0;0;0;0;0;0;0;1;0;0;0;0;0;0
2010;M69_M70;"Legal and accounting activities; activities of head offices; management consultancy activities";Imports;1;0;0;0;2;0;0;0;0;1;0;0;0;1;1;1;0;1;1;1;0;0;0;1;0;1;11;1;10;5;2;0;0;2;0;2;0;1;1;2;2;1;0;1;19;3;0;2;2;4;3;0;2;2;0;0;43;0;0;1;0;0;0
2010;M71;"Architectural and engineering activities; technical testing and analysis";Imports;1;0;0;2;11;0;0;0;0;0;0;0;0;1;1;1;0;2;2;1;0;0;0;2;0;1;85;1;15;6;3;0;0;4;2;3;0;1;1;5;3;1;0;3;21;52;0;2;4;2;1;1;11;2;0;0;1;0;0;2;0;0;0
2010;M72;Scientific research and development;Imports;0;0;0;0;0;0;0;0;0;0;0;0;0;0;0;0;0;0;0;0;0;0;0;0;0;0;1;0;0;0;0;0;0;0;0;0;0;0;0;0;0;0;0;0;0;1;0;0;0;0;1;0;1;0;0;0;3;0;12;23;0;0;0
2010;M73;Advertising and market research;Imports;0;0;0;0;6;1;0;0;1;0;0;0;0;0;0;0;0;0;0;0;0;0;0;0;0;0;1;0;1;1;0;0;0;0;0;1;0;0;1;1;1;0;0;0;1;0;0;23;0;1;0;0;0;1;0;0;23;0;0;0;0;0;0
2010;M74_M75;"Other professional, scientific and technical activities; veterinary activities";Imports;3;0;0;0;0;0;0;0;0;0;0;0;0;0;0;0;0;0;0;0;0;0;0;0;0;0;0;0;0;0;0;0;0;0;0;0;0;0;0;0;0;0;0;0;0;0;0;0;2;0;0;0;0;1;0;0;3;0;0;1;0;0;0
2010;N;Administrative and support service activities;Imports;8;3;0;0;1;1;0;1;0;0;0;0;0;0;1;0;0;0;0;1;0;0;0;1;0;4;14;0;6;3;13;0;7;6;0;1;0;2;2;1;0;0;0;0;2;3;0;1;2;14;1;0;3;4;0;0;17;0;1;3;0;0;0
2010;O84;"Public administration and defence; compulsory social security";Imports;1;0;0;0;1;0;0;1;0;0;0;0;0;0;0;0;0;0;0;0;0;0;0;1;0;0;29;0;3;2;1;0;0;1;0;0;0;0;0;0;1;0;0;0;1;1;0;0;0;1;2;1;1;1;0;0;4;0;6;1;0;0;0
2010;P85;Education;Imports;0;0;0;0;0;0;0;0;0;0;0;0;0;0;0;0;0;0;0;0;0;0;0;0;0;0;1;0;0;0;1;0;1;0;0;0;0;1;0;0;1;0;0;0;0;0;0;0;0;1;3;3;1;1;0;0;2;0;8;8;0;0;0
2010;Q;Human health and social work activities;Imports;0;0;0;0;0;0;0;0;0;0;0;0;0;0;0;0;0;0;0;0;0;0;0;0;0;0;0;0;0;0;0;0;1;0;0;0;0;0;0;0;0;0;0;0;0;0;0;0;0;0;1;0;0;0;0;0;4;0;2;2;0;0;0
2010;R_S;Other service activities;Imports;0;0;0;0;0;0;0;0;0;0;0;0;0;0;0;0;0;0;0;0;0;0;0;0;0;0;2;0;0;0;0;0;0;0;0;6;0;0;0;0;0;0;0;0;0;0;0;0;0;1;1;0;6;15;0;0;20;1;2;1;0;0;0
2010;T;"Activities of households as employers; undifferentiated goods- and services-producing activities of households for own use";Imports;0;0;0;0;0;0;0;0;0;0;0;0;0;0;0;0;0;0;0;0;0;0;0;0;0;0;0;0;0;0;0;0;0;0;0;0;0;0;0;0;0;0;0;0;0;0;0;0;0;0;0;0;0;0;0;0;0;0;0;0;0;0;0
2010;U;Activities of extraterritorial organizations and bodies;Imports;0;0;0;0;0;0;0;0;0;0;0;0;0;0;0;0;0;0;0;0;0;0;0;0;0;0;0;0;0;0;0;0;0;0;0;0;0;0;0;0;0;0;0;0;0;0;0;0;0;0;0;0;0;0;0;0;0;0;0;0;0;0;0
2010;II_fob;Total intermediate consumption;TOT;3 315;237;23;855;4 320;810;321;294;260;3 581;1 013;271;831;935;3 601;967;247;765;797;407;197;459;248;3 111;138;399;7 227;439;3 197;1 390;2 716;153;400;836;154;899;157;333;1 032;505;890;585;120;1 282;542;555;133;696;333;1 065;1 030;452;1 189;1 067;0;0;30 891;188;7 822;10 864;165;0;0
2010;TXSP;taxes less subsidies on products;TOT;105;13;0;40;294;31;10;9;7;52;21;7;10;21;55;12;5;11;11;6;2;13;3;45;7;9;91;12;127;27;183;7;34;17;6;41;4;12;37;7;16;8;3;14;9;7;4;12;8;35;44;14;38;79;0;0;3 250;6;100;179;14;0;0
2010;EXP_adj;Cif/ fob adjustments on exports;TOT;0;0;0;0;0;0;0;0;0;0;0;0;0;0;0;0;0;0;0;0;0;0;0;0;0;0;0;0;0;0;0;0;0;0;0;0;0;0;0;0;0;0;0;0;0;0;0;0;0;0;0;0;0;0;0;0;0;0;0;0;0;0;0
2010;PURR;Direct purchases abroad by residents;TOT;0;0;0;0;0;0;0;0;0;0;0;0;0;0;0;0;0;0;0;0;0;0;0;0;0;0;0;0;0;0;0;0;0;0;0;0;0;0;0;0;0;0;0;0;0;0;0;0;0;0;0;0;0;0;0;0;830;0;0;0;0;0;0
2010;PURNR;Purchases on the domestic territory by non-residents ;TOT;0;0;0;0;0;0;0;0;0;0;0;0;0;0;0;0;0;0;0;0;0;0;0;0;0;0;0;0;0;0;0;0;0;0;0;0;0;0;0;0;0;0;0;0;0;0;0;0;0;0;0;0;0;0;0;0;-3 570;0;0;0;0;0;0
2010;VA;Value added at basic prices;TOT;1 876;258;12;983;1 203;766;125;152;117;111;223;161;211;413;465;478;133;286;372;107;54;207;217;1 569;222;202;3 151;486;2 142;2 543;1 867;80;91;585;147;1 028;121;154;1 361;745;2 669;650;144;5 379;556;452;269;146;228;747;2 607;1 579;1 343;1 176;0;0;0;0;0;0;0;0;0
2010;IntTTM;International Transport Margins;TOT;49;4;0;10;48;20;7;9;5;118;24;7;29;25;110;28;10;23;21;10;5;14;7;77;1;4;92;3;27;13;55;2;7;8;1;7;3;4;5;3;1;0;0;3;1;1;1;1;2;8;9;4;10;6;0;0;405;0;13;214;1;0;0
2010;GO;Output at basic prices;TOT;5 345;512;36;1 887;5 865;1 627;463;465;389;3 862;1 282;446;1 081;1 395;4 231;1 484;395;1 084;1 200;531;259;692;475;4 802;368;615;10 560;940;5 493;3 973;4 821;242;533;1 447;308;1 975;286;503;2 435;1 260;3 576;1 244;268;6 678;1 108;1 016;407;854;571;1 855;3 690;2 050;2 581;2 328;0;0;0;0;0;0;0;0;0
2011;A01;Crop and animal production, hunting and related service activities;Domestic;1 094;6;0;1;901;63;1;0;0;1;2;1;1;1;4;1;0;1;1;3;0;1;0;3;0;1;13;1;136;31;9;0;0;2;0;15;0;0;1;1;1;0;0;4;0;1;1;0;1;19;9;15;15;2;0;0;1 532;0;1;171;-1;2 337;6 405
2011;A02;Forestry and logging;Domestic;54;30;0;1;19;6;43;1;0;0;70;0;4;2;2;6;0;2;7;3;0;19;1;0;4;1;6;1;4;17;3;0;0;1;0;11;0;0;0;0;0;0;0;1;1;0;0;0;0;1;0;0;4;0;0;0;158;0;0;1;0;55;542
2011;A03;Fishing and aquaculture;Domestic;0;0;1;0;11;0;0;0;0;0;0;0;0;0;0;0;0;0;0;0;0;0;0;0;0;0;0;0;0;0;0;0;0;0;0;5;0;0;0;0;0;0;0;0;0;0;0;0;0;0;0;0;1;0;0;0;22;0;0;0;0;8;47
2011;B;Mining and quarrying;Domestic;9;0;0;1;6;1;1;3;0;423;44;15;17;27;170;32;0;22;4;2;0;1;1;221;0;0;9;0;3;1;15;0;0;1;0;1;0;0;0;0;0;0;0;2;0;0;0;0;0;1;0;0;1;0;0;0;47;0;2;13;0;941;2 039
2011;C10-C12;Manufacture of food products, beverages and tobacco products;Domestic;149;7;0;2;759;23;1;0;0;2;5;6;3;2;8;3;1;2;2;4;0;1;1;4;0;1;17;1;171;7;13;0;1;2;0;70;0;1;1;1;1;0;0;2;1;1;1;1;3;21;32;16;48;7;0;0;3 742;0;5;19;2;1 558;6 736
2011;C13-C15;Manufacture of textiles, wearing apparel and leather products;Domestic;14;4;0;6;18;329;1;2;2;2;4;1;14;3;13;4;2;7;6;5;0;48;1;4;0;3;19;2;52;5;13;0;1;5;0;29;1;6;1;1;1;0;0;16;0;1;1;0;1;4;17;9;52;12;0;0;601;0;1;7;-35;1 469;2 786
2011;C16;"Manufacture of wood and of products of wood and cork, except furniture; manufacture of articles of straw and plaiting materials";Domestic;8;2;0;1;6;1;25;1;0;1;2;0;1;2;3;2;1;1;2;4;1;66;0;1;0;0;37;1;4;2;2;0;0;3;0;1;0;0;0;0;0;0;0;4;0;0;0;0;0;2;0;1;1;0;0;0;138;0;1;4;1;245;578
2011;C17;Manufacture of paper and paper products;Domestic;5;0;0;0;19;3;6;52;20;4;5;2;2;7;2;4;2;4;3;3;0;10;1;2;0;1;16;0;22;11;1;0;0;1;0;5;16;3;3;3;7;1;1;0;1;1;0;1;1;4;3;3;3;1;0;0;101;0;0;1;7;209;583
